Tweet_ID,Sentiment_Label,Logits_Neutral,Logits_Positive,Logits_Negative,Tweet_text,hashtags,country,created_at
1417069300393811968,neutral,2.8777105808258057,0.05408763140439987,0.060467414557933814,Daniel Andrews confirms Victoria's lockdown will be extended as state records 16 new local COVID-19 cases https://t.co/VJy3qX8JLA via @SBSNews,,Australia,Mon Jul 19 10:30:23 +0000 2021
1417069522884849668,positive,1.9515669345855715,2.7450900077819824,-0.5919364094734192,"@Netherlanders Hey Jeroen, your name has become famous in the Australian state (province) of Victoria thanks to the man leading our response to COVID https://t.co/egtv0GvcGX",,Australia,Mon Jul 19 10:31:16 +0000 2021
1417072346452484100,negative,0.8004764318466187,-0.6852197051048279,1.8621323108673096,LNP Gladys grim reaper covid strategy has claimed the 5th victom https://t.co/d4itZ0ieiW,,Australia,Mon Jul 19 10:42:29 +0000 2021
1417072945302630403,negative,1.2362203598022459,-1.0618394613265991,2.7010045051574707,"Why is @NSWHealth barely acknowledging these deaths?? ☹

NSW records fifth death from COVID-19 Delta outbreak, woman in her 50s found inside her home 

#COVID19nsw #covidnsw #GetVaccinated 
 https://t.co/5kYX4oyzUK","COVID19nsw, covidnsw, GetVaccinated",Australia,Mon Jul 19 10:44:52 +0000 2021
1417075801992810496,neutral,0.9855177402496338,0.6666051745414734,0.3824499249458313,"@MrJThomson 20s,30s,40s, must get Vaccinated for this Delta Covid 19.",,Australia,Mon Jul 19 10:56:13 +0000 2021
1417076052657020929,negative,1.5504889488220217,-0.7632728815078735,2.212139129638672,@DrLeeJones @RebeccaMeckelb1 I'm afraid early WHO advice was not 100% &amp; changed subject to evidence. In some areas it did not change. E.g. aerosol transmission. Mask wearing for hygiene &amp; respiratory transmission is basic &amp; there is a weight of evidence with regard to it being part of COVID suppression.,,Australia,Mon Jul 19 10:57:13 +0000 2021
1417077851564646407,negative,0.4123648405075073,0.3381335735321045,2.5795724391937256,"Really feel for parents trying to teach their kids during lockdown. 
My Dad tried to better my abysmal mathematic skills once - by furiously circling his working and repeatedly shouting, “SEE?! SEE?! SEE?!”
I got 30% on that test. 
Good luck.",,Australia,Mon Jul 19 11:04:22 +0000 2021
1417078037821095936,negative,0.4924661815166474,-1.0170767307281494,3.0593717098236084,Feels like this is going to end badly. Shame. https://t.co/P5fTaJEpiS,,Australia,Mon Jul 19 11:05:06 +0000 2021
1417078386904600577,positive,1.501901626586914,1.864308834075928,-0.2433420568704605,@MConallin Haha whoops! Hopefully there’s a few breaking lockdown for you there then 😅😂,,Australia,Mon Jul 19 11:06:30 +0000 2021
1417078413706231810,positive,0.8449256420135498,1.7850053310394287,0.019622409716248512,The gift that just keeps on… #covid19olympics https://t.co/GtnpWInxVo,covid19olympics,Australia,Mon Jul 19 11:06:36 +0000 2021
1417079035935399937,positive,0.9686226844787598,1.3159582614898682,0.4993542432785034,JUST IN: A Tea Tree Gully council worker who is a close contact of the 81yo man has tested positive to COVID-19. @9NewsAdel https://t.co/YBClqod8gL,,Australia,Mon Jul 19 11:09:04 +0000 2021
1417079140784640001,negative,0.6621079444885254,-1.1471973657608032,3.528700590133667,All you people sharing memes saying there’s more suicides due to lockdown than covid deaths better keep up that energy once the pandemic is over. Fake ass.,,Australia,Mon Jul 19 11:09:29 +0000 2021
1417079660026892290,positive,0.7967167496681213,6.069142818450928,-1.3309810161590576,Wow finally an awesome #GetVaccinated Ad 👍🏻✅ Well done from #NSW #sydneylockdown @MelbSymphony #PerformanceOfALifetime #COVID19 #auspol | A message from Victoria's Arts Community https://t.co/nqk1cn0a0x via @YouTube,"GetVaccinated, NSW, sydneylockdown, PerformanceOfALifetime, COVID19, auspol",Australia,Mon Jul 19 11:11:33 +0000 2021
1417079999975235585,positive,1.1965922117233276,2.247612714767456,0.18600165843963626,@itsabelslife Ohhh my new dressing gown arrived today too!! I might just live in it during lockdown ☺🐶 https://t.co/7otc8lEZCJ,,Australia,Mon Jul 19 11:12:54 +0000 2021
1417080012293873669,neutral,1.2183172702789309,0.3928232192993164,-0.2821700870990753,@babychol Lockdown gotchu spiritual cuz,,Australia,Mon Jul 19 11:12:57 +0000 2021
1417080398941540357,positive,0.26920783519744873,3.2691495418548584,-0.4262867569923401,"This is GREAT 👏🏻👏🏻
@michaelsheen https://t.co/omxwp8ePOX",,Australia,Mon Jul 19 11:14:29 +0000 2021
1417080986660065280,neutral,1.4194117784500122,0.559207022190094,0.8202895522117615,"It would seem to me that the CCP are achieving their objectives by the releasing of Covid19 on the world. Dissent, division, unrest,constant criticism of Government, what ever you want to call it. We are playing right into their plans.😳😕😡",,Australia,Mon Jul 19 11:16:49 +0000 2021
1417081296380067844,positive,0.9137759804725648,1.4958672523498535,-0.4109952449798584,Watch this! https://t.co/yDPsc9IxBW,,Australia,Mon Jul 19 11:18:03 +0000 2021
1417082531976028160,neutral,1.8177275657653809,1.5403666496276855,0.25408509373664856,"Scrolling through my photos found this little dude from my visit to @thesydneyzoo late last year #straya … when the lock down ends, get there #animalsofinstagram @ Sydney Zoo https://t.co/LyrIdkWTcA","straya, animalsofinstagram",Australia,Mon Jul 19 11:22:58 +0000 2021
1417082579451146240,negative,1.283569097518921,-1.0433486700057983,2.422313451766968,"@BenFordham If Gladys had done a Hard Lockdown much earlier, Sydney wouldn’t be in the mess it is now. 🤦‍♀️",,Australia,Mon Jul 19 11:23:09 +0000 2021
1417082777338466306,negative,1.4394229650497437,-1.067408323287964,2.1035912036895748,@erica_ebooks_69 They haven’t said so explicitly but I believe Covid in the supply chain is cause of the shutdown https://t.co/yhGMP2KjC6,,Australia,Mon Jul 19 11:23:56 +0000 2021
1417082849044230149,neutral,1.593851089477539,-0.14249899983406067,1.0314141511917114,"@debwallace05 So today Sutton said we may not be able to beat it.  Ok, what is his plan B?

No journos asked that. 

Can't be another 4 month lockdown",,Australia,Mon Jul 19 11:24:13 +0000 2021
1417083418815307779,negative,1.2856701612472534,-0.4821268022060394,1.3776935338974,Tea Tree Gully residents are set to hardly notice any difference to usual. https://t.co/UhguTTvuMM,,Australia,Mon Jul 19 11:26:29 +0000 2021
1417083596439838723,positive,0.3435131311416626,3.311606407165528,-0.3801165223121643,"Love these little guys, such a unique Australian animal! https://t.co/SuSjlPmjiZ",,Australia,Mon Jul 19 11:27:12 +0000 2021
1417083819216175107,negative,1.103352189064026,-0.7851765751838684,2.544691801071167,"Lockdown dilemmas - @UberEats and @Menulog keep delivering to the wrong apartment, and I order way too much for this to not be embarrassing. Do we think my note worked? Hell no it didn’t. Save me, I’m never ordering food again 😂 https://t.co/svgeAuHHq4",,Australia,Mon Jul 19 11:28:05 +0000 2021
1417083827739103237,negative,0.7924342155456543,0.2117639482021332,1.3250179290771484,"Extended Melbourne #lockdown means more days unable to work. We do this job because we love it, so no work equals no helping people, no fun, and no money...👎
#igetitbutthissucks @ Sandown Raceway https://t.co/23BIg2ndZQ","lockdown, igetitbutthissucks",Australia,Mon Jul 19 11:28:07 +0000 2021
1417084202013519873,positive,0.8843165040016174,1.0761723518371582,0.6779258847236633,I'll be suprised if we get out of lockdown before August to be honest.,,Australia,Mon Jul 19 11:29:36 +0000 2021
1417084670534053892,positive,0.30025798082351685,2.229224443435669,-0.2187895029783249,"💝lockdown extension, but make it cute … https://t.co/cDmRUzLVzK",,Australia,Mon Jul 19 11:31:28 +0000 2021
1417084993424171008,positive,1.0831019878387451,1.3763028383255005,0.5708465576171875,"SECOND SOLD on Monday

         💥💥✨💫 💥💥✨💫

COVID21🦠? NO WORRIES!. SOLD
13 Robson street Sunshine North 
has been SOLD a ⭐️  during lockdown
Just Sold 🔥 Just Sold 🔥 
✅ 50 Private Inspections in 4Weeks
✅ 2570 Views Online 
✅ 112 Phone 📞 Inquiries
✅ 55 Email https://t.co/lvFVlEG3Pc",,Australia,Mon Jul 19 11:32:45 +0000 2021
1417085601325723649,positive,2.219578742980957,2.4546878337860107,-0.3630906939506531,Another... #tinnytime #independent #supportcraft #SAgreat #SAlockingdown #staysafe #stayhome #alienburpawareness 👽 #beeroclock Cheers all 😎👍🏿🖤💛❤🇭🇲🐋🐬🐟🐠🐡🦈🐙🇭🇲😷?... (Lorem Ipsum Hazy IPA) https://t.co/mriQL22b9u,"tinnytime, independent, supportcraft, SAgreat, SAlockingdown, staysafe, stayhome, alienburpawareness, beeroclock",Australia,Mon Jul 19 11:35:10 +0000 2021
1417085712537579520,neutral,1.4061076641082764,0.8193346261978149,0.5826453566551208,@vanOnselenP if this gets away then that’s the ball game for Morrison #Auspol https://t.co/cdRoDENlKh,Auspol,Australia,Mon Jul 19 11:35:36 +0000 2021
1417085860462272512,negative,1.1567845344543457,-0.9721500277519226,2.181518316268921,This is not too much to ask given people are losing wages from the NSW Premiers decision https://t.co/qhgnMPygVE,,Australia,Mon Jul 19 11:36:11 +0000 2021
1417086199915716612,positive,1.1655147075653076,1.261890172958374,0.2625525891780853,"When the rabid right turns on its own, you'd better hope your vaccinations are up-to-date #COVID19nsw https://t.co/od9m35M3VF",COVID19nsw,Australia,Mon Jul 19 11:37:32 +0000 2021
1417086533098684423,neutral,1.125317931175232,0.689096987247467,0.7866038084030151,"Sammy isn't sooking about lockdown, he just keeps swimming #TrooperGoldfish #CovidFree @ Be-Royalty https://t.co/7QHN1JDMqI","TrooperGoldfish, CovidFree",Australia,Mon Jul 19 11:38:52 +0000 2021
1417086635418669058,negative,1.1220498085021973,-0.10919221490621568,1.7710968255996704,there’s a special kind of creeping horror in downloading dating apps again and seeing what unhinged way too thirsty content your fresh third lockdown self was putting out there.,,Australia,Mon Jul 19 11:39:16 +0000 2021
1417086958317182980,neutral,1.8357191085815432,1.3828279972076416,-0.5844837427139282,Five new cases for today #COVIDSA https://t.co/8nwHFAZxbn,COVIDSA,Australia,Mon Jul 19 11:40:33 +0000 2021
1417087370642350085,positive,1.0618953704833984,3.52005934715271,-0.5684793591499329,"Ah the true winners of #COVID19! Pets! 

Max pulled his blanket to my work desk and kept a close eye on me all day* 

*he slept, all day! https://t.co/cTI23LynN1",COVID19,Australia,Mon Jul 19 11:42:12 +0000 2021
1417087585625665538,neutral,1.359158992767334,0.6837852597236633,0.3813274204730988,Imagine if #BelleGibson was active during times of #COVID19 She could've been a Social Media Influenza 😷 #BadInfluencer @ABCTV,"BelleGibson, COVID19, BadInfluencer",Australia,Mon Jul 19 11:43:03 +0000 2021
1417087971094794243,negative,0.9746708869934082,0.25034406781196594,1.665132761001587,@melissahoyer I’m sure they have other important things to worry about. And shame on the Olympic committee for making her go.  Meanwhile Australia is heading to total lockdown lol it’s really hitting the fan! 🙏,,Australia,Mon Jul 19 11:44:35 +0000 2021
1417089784887930880,negative,0.7269395589828491,-0.5012527108192444,1.9241706132888796,I’m thinking it’s a sadly obvious reason.😕 https://t.co/swcWWy5CTE,,Australia,Mon Jul 19 11:51:47 +0000 2021
1417090964057821184,neutral,1.088058590888977,-0.1755187213420868,0.9057377576828004,Who is calling the shots Murdoch Sky? # Auspol https://t.co/cdRoDENlKh,,Australia,Mon Jul 19 11:56:28 +0000 2021
1417090968197599234,negative,0.3623173534870148,-0.9959531426429749,4.684220314025879,This ad drives me nuts. No masks!!! Anywhere!! Even old mate in the coffee shop!!! Stupid!! #COVID19 #COVID19Aus #sydneylockdown https://t.co/pMwo6MqNsX,"COVID19, COVID19Aus, sydneylockdown",Australia,Mon Jul 19 11:56:29 +0000 2021
1417090987734745102,neutral,1.096993088722229,-0.1392286717891693,1.062910795211792,It hasn't even started yet and they're already coming at a rapid rate. https://t.co/TnO85Ze44p,,Australia,Mon Jul 19 11:56:34 +0000 2021
1417083351324708865,negative,0.4625968337059021,-1.0734399557113647,3.7904343605041504,@BenFordham you are a joke. #lockdown5.0 #lockdown #melbournelockdown #covid #covid19 #clueless #notaclue #coronavirus,"lockdown5, lockdown, melbournelockdown, covid, covid19, clueless, notaclue, coronavirus",Australia,Mon Jul 19 11:26:13 +0000 2021
1417076976007868422,negative,1.0774269104003906,-0.2718783318996429,2.2865395545959477,"Here’s a scenario. Western Australia currently is experiencing a shortage of nurses. Let’s just say a Sydney-like Covid explosion hits #Perth. Deaths, lots of ppl in ICU. More interstate nurses needed. Will the WA Premier @MarkMcGowanMP keep the hard border going? #COVID19","Perth, COVID19",Australia,Mon Jul 19 11:00:53 +0000 2021
1417077095352520711,negative,0.8653357028961182,-0.968450963497162,2.9316177368164062,This made me cry. A stateless man locked up for 10 years. What is wrong with us  Covid-19 and immigration detention https://t.co/6turEvoVlu,,Australia,Mon Jul 19 11:01:22 +0000 2021
1417077194212331530,negative,1.4553921222686768,-1.0520163774490356,2.4561238288879395,"@theprimod @NSWHealth It says ""NSW Health said the woman had COVID-19 and was a close contact of another case"". Don't be rude.",,Australia,Mon Jul 19 11:01:45 +0000 2021
1417080165696348160,negative,1.317454218864441,-0.5641643404960632,2.082466125488281,"@JackEKerley @Guildford @julia_zemiro No, it doesn't. Find a published definition from a reputable dictionary that supports your definition. Eliminate is a very subjective term based on context. 
Covid-19 has been eliminated/removed from the community and from Australia at numerous points.",,Australia,Mon Jul 19 11:13:34 +0000 2021
1417081371319697416,negative,1.2526047229766846,-0.7266412377357483,2.5560219287872314,I forgot I scraped the back of my throat and stuck a probe up my nose today in the name of surveillance so was surprised to get the text saying I had a negative COVID result. One more to go next Monday!,,Australia,Mon Jul 19 11:18:21 +0000 2021
1417083891177959432,positive,0.7697286009788513,1.251391053199768,0.3184797763824463,"https://t.co/ezy1Z8kxF5 this is true, only other day i started getting a Flu ,so nice me wore a mask to protect people around me, so i get the leader of a group of teens comment: 'there's not even any Covid here you weirdo'",,Australia,Mon Jul 19 11:28:22 +0000 2021
1417084372134469633,negative,0.6630154252052307,0.13396716117858887,1.91917085647583,"@OldCynicalSad @BennEllena Chasing War Criminals is Essential - NOBODY should use their Power fir the Killing of People in War&amp; Organizing millions of Deaths!😑😐
A Plague is Different. Unseen &amp; Kills thousands in it's Path.......WE HAVE TO FIGHT IT.!!We fought the Spanish Flu;we can Fught COVID!!",,Australia,Mon Jul 19 11:30:17 +0000 2021
1417084709356535811,neutral,1.283034086227417,1.073542594909668,0.2878139019012451,"When they said they were extending the ward, we thought they meant adding in extra orthosurgical beds. 

LOL! It’s for Covid surveillance 🤡",,Australia,Mon Jul 19 11:31:37 +0000 2021
1417087653682376706,neutral,2.827976942062378,2.406529903411865,-0.7816623449325562,"In addition @SAHealth has added a number of new exposure sites to its website, which include a winery in one tree hill and a Greek restaurant in the city. 
Full list here: https://t.co/nOLXAA1Or5 @9NewsAdel https://t.co/A4rCHsVBOU",,Australia,Mon Jul 19 11:43:19 +0000 2021
1417091581207711749,neutral,1.1008957624435425,0.3706982135772705,0.7413348555564879,"Covid lock down sux, can someone recommend some good action, drama or horror films to watch?",,Australia,Mon Jul 19 11:58:55 +0000 2021
1417077140525256705,negative,0.9405819177627563,-1.186008095741272,3.2321994304656982,@DrLeeJones @RebeccaMeckelb1 This is a dead rubber. Why bother with it? Just wear a mask like health professionals do routinely to prevent transmission and infection. It works and is no big deal.,,Australia,Mon Jul 19 11:01:32 +0000 2021
1417079233092878336,negative,0.859826922416687,-0.5530776381492615,1.6559191942214966,@bossmandaffid @Sarah_Kendall Not wearing her mask. The nudity is another trauma.,,Australia,Mon Jul 19 11:09:51 +0000 2021
1417079401649360899,neutral,1.8002904653549194,0.2899337112903595,0.17889152467250824,“You wear a mask to protect others. They wear a mask to protect you.” https://t.co/GTD21u7ZhB,,Australia,Mon Jul 19 11:10:32 +0000 2021
1417084628196724748,neutral,1.7123370170593262,1.0087056159973145,0.31972092390060425,"Looking at all the tweets and comments here about #FreedomDay, I'm definitely going to get called names when I'm back in the UK and wearing a mask aren't I?",FreedomDay,Australia,Mon Jul 19 11:31:18 +0000 2021
1417091041232969733,negative,0.6448097229003906,0.5768129825592041,1.150062918663025,@gcanavan2 I’m just glad we don’t have the US rules here. Imagine being dragged off a plane cos your 2 old won’t wear a mask.,,Australia,Mon Jul 19 11:56:47 +0000 2021
1417091811852443654,negative,1.0844581127166748,-1.0945609807968142,3.077002763748169,More contrarian mask nonsense. Gone. Is there any issue left for control that has not met bar for evidence? This is an issue that @skepticscience describes as raising the bar and shifting sands. Aristotelian rhetorical devices. Science denial. Desperate. Contrarian. https://t.co/KvVQIlm7u5,,Australia,Mon Jul 19 11:59:50 +0000 2021
1417093194781659136,negative,0.7435283660888672,-1.2517306804656982,3.8744609355926514,"Just hoping and praying this mum did not take her own life because of terrible mismanagement of COVID-19 and shame. This has no blame attached, it’s a terrible disease and language barriers have proven to be a huge problem 😞#covidnsw #media #humanitywithheart","covidnsw, media, humanitywithheart",Australia,Mon Jul 19 12:05:20 +0000 2021
1417093718646026242,negative,0.9214343428611756,-0.6761419177055359,2.134338140487671,So the local anti covid vaxer on FB has told me publicly not to get my kids vaxed as it will make them sterile..,,Australia,Mon Jul 19 12:07:25 +0000 2021
1417093903841386498,positive,0.5759619474411011,3.94795560836792,0.1517275869846344,"A lovely stout, better on tap but still great #SAgreat #SAlockingdown #staysafe #stayhome #roadtrip #oops #beeroclock Cheers all 😎👍🏿🖤💛❤🇭🇲🐋🐬🐟🐠🐡🦈🐙🍻😷🤣😁... (Southwark Old Stout) https://t.co/fmjdHTLxlm","SAgreat, SAlockingdown, staysafe, stayhome, roadtrip, oops, beeroclock",Australia,Mon Jul 19 12:08:09 +0000 2021
1417097374581678081,negative,0.8088451027870178,-0.15609365701675415,1.5134546756744385,There’s no politicians ‘willing to be honest’ about what ‘COVID-normal looks like’ https://t.co/Kv01tHl5br #NewsSuite https://t.co/z01q5cVIAU,NewsSuite,Australia,Mon Jul 19 12:21:57 +0000 2021
1417097767915188226,negative,1.2869594097137451,-0.289711594581604,1.7470602989196775,"@luvmygoose The winner is the women who saved Australia🤔 or is it now the women that wouldn't lockdown, that has caused the spread of Delta,  Dr Cant watch out for the 🚍",,Australia,Mon Jul 19 12:23:30 +0000 2021
1417098145683542021,neutral,2.1962113380432133,1.1061651706695557,-0.2842212915420532,"Eight crew members from cargo ship off WA test positive to COVID as SA travel advice updated
https://t.co/rR0F74JIHl",,Australia,Mon Jul 19 12:25:00 +0000 2021
1417098179716079629,neutral,1.5652837753295898,-0.3824087381362915,1.4165501594543457,Interestingly since this afternoon the federal government #COVID19 app case count for #COVID19nsw has gone up by 100 cases… 🤷🏻‍♂️🤔 https://t.co/dzefWdchVe,"COVID19, COVID19nsw",Australia,Mon Jul 19 12:25:09 +0000 2021
1417099213528133633,negative,0.18608292937278748,-0.3052354156970978,1.5285831689834597,Poor chemist works Wetherill Park https://t.co/7itITMb4Ok,,Australia,Mon Jul 19 12:29:15 +0000 2021
1417099657826603008,neutral,1.7007899284362793,0.9108952283859252,-0.1623164564371109,Gaganis AND The Greek on Halifax? Now it's personal https://t.co/adZWIyQlwk,,Australia,Mon Jul 19 12:31:01 +0000 2021
1417100245876363264,negative,0.7012946009635925,0.5350083708763123,0.7815567255020142,@Oceansnevlisten @fantoman79 @KittyOwen Me tooooo. If only we weren’t in lockdown 😂,,Australia,Mon Jul 19 12:33:21 +0000 2021
1417100331977043974,negative,0.8411248326301575,-0.6228498220443726,2.6888558864593506,"@ThePhightins33 Compared to rest of the world it’s not bad…. Our Vaccine rollout has been shit, and we just have this obsession with making sure there’s 0 Covid in the community",,Australia,Mon Jul 19 12:33:42 +0000 2021
1417100695342252040,negative,1.3363504409790041,-0.8754165172576904,1.866851806640625,Who is Herald and why can’t they understand things can move quickly in a pandemic? https://t.co/dazyhJSmKc,,Australia,Mon Jul 19 12:35:08 +0000 2021
1417101243944734720,negative,0.6626651287078857,-0.771004319190979,3.0654029846191406,Wow. The entire #Liberals need to be ffing sacked. #GladysB got us into a longer indefinite lockdown coupled with #Scomo's lack of vaccine orders and campaign management. #COVID19 https://t.co/mhjNKGiXsf,"Liberals, GladysB, Scomo, COVID19",Australia,Mon Jul 19 12:37:19 +0000 2021
1417101316552232961,positive,0.4632049798965454,2.067166566848755,-0.09949126094579697,"Please, for the love of god, no @BFtigercast https://t.co/6sEVos51i7",,Australia,Mon Jul 19 12:37:36 +0000 2021
1417101476246167559,negative,0.9557291269302368,-0.7299724817276001,3.3702940940856934,And not join in these dickheads as your freedom is a small price pay to get this pandemic over sooner. So you are doing well to help end this thing as soon as you can. And please know this that you will get through this crap sooner than you know it.,,Australia,Mon Jul 19 12:38:15 +0000 2021
1417101477890330632,negative,0.8402047157287598,0.3733347058296204,1.9834227561950684,And I’m sure you will get much as your pre COVID freedom AP an as sooner then we all thought. I have your back and I have faith in you all. I don’t want to bring false hope to you all so all I could do is bring you all positivity through this shit. Hang in there and be safe.,,Australia,Mon Jul 19 12:38:15 +0000 2021
1417102024584298500,neutral,1.7927848100662231,1.250982642173767,-0.2827935814857483,"Gahhh Trisha, just know you’ve helped save many lives 🙏🏼 https://t.co/Z4py4k7ZHA",,Australia,Mon Jul 19 12:40:25 +0000 2021
1417102686705520648,neutral,1.0086504220962524,0.6643097996711731,0.4011481702327728,@Snopiiee_y @ices_tea U too Pie stay away from corona ya,,Australia,Mon Jul 19 12:43:03 +0000 2021
1417102911977492485,negative,1.153078317642212,-0.006637111306190491,1.2020163536071775,@xskinn @emma__jayne14 Hope it wasn’t the last roll of dunny paper if they are in lockdown.,,Australia,Mon Jul 19 12:43:57 +0000 2021
1417103857021194240,positive,1.137421727180481,2.8332140445709233,-0.3593047261238098,"@saoulidisg @Raretoshi I live him, last interview I heard him do was on WBD with @PeterMcCormack he is so clued up in this space … love his wit too! Nigh nigh my friend! It’s 1045pm here in lockdown so time, doesn’t have any meaning 😂😜🙏",,Australia,Mon Jul 19 12:47:42 +0000 2021
1417104359121317889,neutral,2.1397809982299805,-0.08874865621328354,1.0784562826156616,"So @noreasonspec at today's Vic presser with Brett. He was asked if they had info on measures / effectiveness of specific components of last year's restrictions/lockdown rules. Answer was along lines of that they had studied it, but was hard to pick apart/attribute exactly...",,Australia,Mon Jul 19 12:49:42 +0000 2021
1417104430382477314,negative,0.5862649083137512,-0.09201744943857193,1.5773158073425293,@Oceansnevlisten @fantoman79 @KittyOwen Gladys and Kerry definitely can’t run a state like NSW during a pandemic without their manly input right 😂,,Australia,Mon Jul 19 12:49:59 +0000 2021
1417104558233329664,negative,0.38950562477111816,-0.136983722448349,1.8317371606826784,@AndrewBartlett How's the Covid debacle looking for you,,Australia,Mon Jul 19 12:50:29 +0000 2021
1417104649077673992,positive,0.8317002654075623,1.9567488431930544,0.2811167240142822,"The numbnuts who thought it would be a good idea to hold the Olympics during a pandemic.
What flogs. #Olympics2021 #Tokyo2020 #coronavirus #sport https://t.co/BVr9PBLo2e","Olympics2021, Tokyo2020, coronavirus, sport",Australia,Mon Jul 19 12:50:51 +0000 2021
1417106776298647552,positive,1.6107919216156006,2.294499158859253,-0.3543354272842407,"Loving one another during lockdown is as easy and profoundly thoughtful as a phone call, even a message or email. 

And if you’d like Reforming wallpaper  as a lovely little reminder of loving your church in this way - just let us know at https://t.co/1pCcTknzFQ https://t.co/ApjrBhV7zO",,Australia,Mon Jul 19 12:59:18 +0000 2021
1417099830967422983,positive,1.419092297554016,3.607264757156372,-0.5064656138420105,"Very important to review the latest #HealthAlert with a number of new locations. If you have visited one of the #COVID exposure sites, please complete the survey, quarantine and get tested. Additional staff on their way to #VicPark to assist with the testing demand @SAHealth https://t.co/HuyX6S35j4","HealthAlert, COVID, VicPark",Australia,Mon Jul 19 12:31:42 +0000 2021
1417102631252553728,negative,1.3566782474517822,-0.4642557799816132,1.67396080493927,@kayleen87686977 @NSWHealth Actually spent the last year managing  COVID without locking down the whole state and taking in the majority of overseas arrivals but I guess facts aren’t your friend.,,Australia,Mon Jul 19 12:42:50 +0000 2021
