Tweet_ID,Sentiment_Label,Logits_Neutral,Logits_Positive,Logits_Negative,Tweet_text,hashtags,country,created_at
1417261599685976090,neutral,2.502863645553589,0.10105946660041808,-0.26687687635421753,Coronavirus Infection Update | The New Daily https://t.co/4N25zgjp5C,,Australia,Mon Jul 19 23:14:31 +0000 2021
1417261761946820610,positive,0.7636933326721191,0.8467702269554138,0.7661369442939758,Gonna come right out and say it… not a huge fan of the novel coronavirus,,Australia,Mon Jul 19 23:15:10 +0000 2021
1417265706895253514,negative,1.2298908233642578,-0.5960252285003662,2.3223659992218018,"@karenandrewsmp @AusBorderForce People are confused this is no immunity to this virus its a jab it lessons the risk of morbidity for a short length of time thats all it does, its a warm and fuzzy jab let's be honest costing billions from now to eternity for big Pharmaceutical 
https://t.co/MCs29stHuu",,Australia,Mon Jul 19 23:30:50 +0000 2021
1417258630844358676,negative,1.2539193630218506,-1.0526207685470579,2.5532548427581787,Nothing to do on a covid lock down read this criminal behaviour by the Australian government https://t.co/0DKkKKTCBI,,Australia,Mon Jul 19 23:02:43 +0000 2021
1417262098531328011,negative,1.5296324491500854,-0.6439380645751953,1.5726367235183716,@CraigKellyMP @GladysB Wonder if there would be any public transport or need for public transport if COVID spread unchecked throughout the community while governments did nothing?,,Australia,Mon Jul 19 23:16:30 +0000 2021
1417262576996474881,positive,0.4389810562133789,1.7125614881515503,0.5900185704231262,My best friend is through the other side and has had a negative result after a rough week having COVID. I am so happy 🥳🎉,,Australia,Mon Jul 19 23:18:24 +0000 2021
1417262797554032642,positive,1.0732942819595337,1.712433099746704,0.0936184898018837,"Visited the GP yesterday and today. Two doctors &amp; three nurses all asked me if I had a plan to get my covid vaccine. I am privileged enough to be vaccinated already, but I love that they’re so eager to have the conversation. So they gave me a free flu shot instead :) #jabjabjab",jabjabjab,Australia,Mon Jul 19 23:19:17 +0000 2021
1417263107458572315,negative,1.5041409730911257,-0.2339299619197845,1.5598262548446655,"We need to remember that in attacking these people, they want them removed for the total Libertarians to take control of @LiberalNSW and let COVID rip, business first, which has been the underlying strategy of @newscorp, here being delivered by the @dailytelegraph https://t.co/KjPIPKHUuF",,Australia,Mon Jul 19 23:20:30 +0000 2021
1417263244079636490,negative,0.5401828289031982,0.0415218360722065,1.7123397588729858,Covid is accelerating change; generally for the better. When we get rid of the noise of toxic crazy govt it’ll be even better. https://t.co/QhSkN4NuY9,,Australia,Mon Jul 19 23:21:03 +0000 2021
1417263654844604456,neutral,2.595757007598877,-0.1337394416332245,0.1808747947216034,Victoria records 13 local COVID cases as state prepares for lockdown extension – ABC Australia https://t.co/wsA0jGmaok,,Australia,Mon Jul 19 23:22:41 +0000 2021
1417265571050135555,neutral,1.8280884027481081,1.3935837745666504,0.30136847496032715,"South Australians have done the right thing throughout the COVID-19 pandemic to keep our community safe.  
 
Now more than ever, it’s so important that we all continue to check-in and keep SA safe. https://t.co/rbVMtpIKhz",,Australia,Mon Jul 19 23:30:18 +0000 2021
1417266725926576186,positive,2.293696403503418,3.333496570587158,-1.3567659854888916,Listened to the entirety of ABBA gold greatest hits while in the queue for a covid test,,Australia,Mon Jul 19 23:34:53 +0000 2021
1417267362290573335,negative,0.8763529062271118,-0.7001903653144836,1.8542441129684448,"Fifth NSW COVID death, mother of twin removalists. 

 https://t.co/Dww0ohT4eG",,Australia,Mon Jul 19 23:37:25 +0000 2021
1417269882966614021,negative,1.440081238746643,-1.0542041063308716,2.4135570526123047,@John92318516 I thought it was suicide? Since when do you just drop dead of covid?,,Australia,Mon Jul 19 23:47:26 +0000 2021
1417271153752645633,positive,1.1993224620819092,1.2808246612548828,0.13145074248313904,"Finally! 
My second AstraZeneca covid vaccine shot.
Felt like a long 12 weeks! https://t.co/iZiOInFEpu",,Australia,Mon Jul 19 23:52:29 +0000 2021
1417272883433283585,negative,0.3225214779376984,0.03526066616177559,2.4956343173980717,Is it just me or is anyone else worried about the children of Australia getting vaccinated in time before they let it rip? Saw a thread on kids OS with covid earlier today and it is heartbreaking. We can’t let our kids get covid. #COVID19,COVID19,Australia,Mon Jul 19 23:59:21 +0000 2021
1417272983790395413,neutral,2.5722789764404297,0.4988493025302887,0.04980359598994255,"Australia COVID news LIVE: NSW tightens lockdown in Sydney’s south-west, Victoria exposure list tops 200; Katie Hopkins https://t.co/sCxyOXxNmg",,Australia,Mon Jul 19 23:59:45 +0000 2021
1417268980293672967,negative,0.8407183885574341,-0.5283341407775879,2.223919630050659,It’s now compulsory that Early childhood education educator have to wear mask how are we meant to do our jobs the mask scare children because they can’t see our mouths when talking etc #SydneyLockdown #EssentialWorker https://t.co/1joGKekpOw,"SydneyLockdown, EssentialWorker",Australia,Mon Jul 19 23:43:51 +0000 2021
1417258190031319040,negative,0.7767925858497621,0.31300002336502075,1.2625184059143066,"@BrittMezher AZ both doses. 68 yrs. No side effects. Same for my 88 yr old mother. Will have booster or other vaccine whenever they become available. Would have preferred Pfizer, but something is better than nothing. Morrison deserves a kick up the arse.",,Australia,Mon Jul 19 23:00:58 +0000 2021
1417266102522945538,positive,0.7090936899185181,1.3195176124572754,0.6583908796310425,"@weedo04 @lehmo23 I’ve given my babies every single vaccine the doctor prescribed, and every other medical intervention recommended. I haven’t compared risk profiles. I trust my doctor to do that. Every. Single. Time. For. 18. Years. I call it being a good father.",,Australia,Mon Jul 19 23:32:25 +0000 2021
1417262756319809538,negative,1.5418615341186523,-0.8857776522636414,2.2960336208343506,"20th of July, 2025. The human race is finally wiped out by the effects of climate change and the lethal virus it created. https://t.co/SPXJIuR2PX",,Australia,Mon Jul 19 23:19:07 +0000 2021
1417268800580329482,negative,1.6546870470046997,-0.4702195823192597,2.119891405105591,"@KateEmerson88 Covid has identified travel &amp; crowds ie sport events are the virus incubators &amp;  that the wealthy are financially insulated regardless. If you give money to the second class it stays in the public sector, give it to the reach it disappears into trusts &amp; tax avoidance systems.",,Australia,Mon Jul 19 23:43:08 +0000 2021
1417425053365329921,neutral,1.2887533903121948,0.4909012615680695,1.0012650489807131,"@vir_david @Dan_Iel78 Is that the same in Vic? Let’s face it, if AFL don’t keep the TV product coming the whole league could go bust…tough for everyone inc those in lockdown",,Australia,Tue Jul 20 10:04:01 +0000 2021
1417425119987703808,negative,0.7650402784347534,-0.3512302339076996,2.0481672286987305,"Never have the #Olympics not been political. Always have elite athletes been exploited as working animals for the cause.

#CancelTheOlympics  #TokyoOlympics 
#Tokyo2020 #Japan #Politics https://t.co/dsgIUoH7Hk","Olympics, CancelTheOlympics, TokyoOlympics, Tokyo2020, Japan, Politics",Australia,Tue Jul 20 10:04:17 +0000 2021
1417426228076695555,positive,1.0141216516494749,2.2320144176483154,-0.6051283478736877,Welcome to the gang! https://t.co/kE5GvH1J5D,,Australia,Tue Jul 20 10:08:41 +0000 2021
1417426393449730048,positive,0.06857557594776154,1.7660443782806396,-0.1230785921216011,Good times https://t.co/c3zs595wo7,,Australia,Tue Jul 20 10:09:21 +0000 2021
1417427043755597825,positive,1.2243614196777344,1.6373838186264038,0.12050949782133102,"@xskinn @GladysB Chances are, that the covid positive removalists that drove from Sydney, down  to Figtree, then out to Molong stopped at several towns on the way including Orange , and Lithgow",,Australia,Tue Jul 20 10:11:56 +0000 2021
1417427107672576006,negative,1.4782620668411257,-0.5959780216217041,2.32539963722229,Let the games begin🙄🙄🙄... maybe we can all take bets on how bad the Covid-19 outbreak at the ill advised Olympics will be.🤔🇦🇺😷 https://t.co/vNwEl9Yev5,,Australia,Tue Jul 20 10:12:11 +0000 2021
1417427482941083656,neutral,2.393380641937256,0.8245402574539185,-0.4563331007957458,Covid will get you at the 2.6km mark. https://t.co/SEKIoN88LY,,Australia,Tue Jul 20 10:13:41 +0000 2021
1417427679888908290,positive,0.7266086935997009,1.282470703125,-0.5441802740097046,Legend 👍 https://t.co/wGlhAIa0zQ,,Australia,Tue Jul 20 10:14:28 +0000 2021
1417427685509267456,neutral,1.472830295562744,-0.4504108726978302,1.338129997253418,"Without a ‘single bubble’ during lockdown, NSW are switching off an energy source I need to survive | Melanie Tait https://t.co/8PHbg6QzeJ",,Australia,Tue Jul 20 10:14:29 +0000 2021
1417427724528865280,negative,1.122663497924805,-0.0892152413725853,1.7536755800247192,"@Asset90210 @DifficultNerd Nope. I follow science journal and have been following clinical trials since 2020, and have read up on mrn and vector vaccines. And it’s never promised anythjng besides prevention from covid sever symptoms. If anythjng, scientists even acknowledged that covid is here to stay",,Australia,Tue Jul 20 10:14:38 +0000 2021
1417427749954756608,negative,0.221504420042038,-0.10494662076234818,2.7589001655578613,@AlanBixter STAY INSIDE!! Covid worse than Hail Stones!!😯😦,,Australia,Tue Jul 20 10:14:44 +0000 2021
1417427823887720448,neutral,1.5030559301376345,0.7699513435363771,0.11877806484699248,@overit_miss @grogsy28 Last years COVID and extended lockdown broke my 8 year relationship as well,,Australia,Tue Jul 20 10:15:02 +0000 2021
1417427977776680965,positive,0.14232482016086578,0.7830133438110352,0.3170607388019562,Some #COVID19 humour https://t.co/LTX0rLAN0p,COVID19,Australia,Tue Jul 20 10:15:39 +0000 2021
1417427980712771587,negative,0.5678083300590515,0.4187227189540863,1.280048370361328,"With NSW’s pandemic strategy in tatters, Australians are piling on the state they love to hate | Peter Lewis https://t.co/4fEtJF3mNS",,Australia,Tue Jul 20 10:15:39 +0000 2021
1417428109846978560,neutral,1.3893593549728394,-0.2841693460941315,0.9708834290504456,"When lost in lockdown, let your senses save you | Paul Daley https://t.co/e63EUSGPvA",,Australia,Tue Jul 20 10:16:10 +0000 2021
1417428736345968641,negative,1.2472466230392456,-0.722517728805542,1.6291297674179075,😂😂How does one respond to this? can't stop laughing. Is this a parody? https://t.co/0SQ5X5orHQ,,Australia,Tue Jul 20 10:18:39 +0000 2021
1417428810283184131,neutral,1.7480645179748535,-0.540591299533844,1.0607459545135498,Millions of Australians in lockdown amid Delta spread | The New Daily https://t.co/b587OxwRkv,,Australia,Tue Jul 20 10:18:57 +0000 2021
1417429055075352576,positive,0.3832203447818756,2.616412401199341,-0.1790701448917389,"This thread cheered me up immensely *and* I had some very good grant news, so lockdown is good actually https://t.co/aaTcsWS63y",,Australia,Tue Jul 20 10:19:55 +0000 2021
1417429063409434624,negative,1.0761642456054688,-0.1650441288948059,1.3682122230529783,@cloxic Had to lol or I'd cry. In Sydney and fml we are never getting out of lockdown 😫,,Australia,Tue Jul 20 10:19:57 +0000 2021
1417429657964609542,positive,0.3470740616321564,4.723279476165772,-0.6853469610214233,Stay safe gorgeous girl xx https://t.co/HbBxiGyZkI,,Australia,Tue Jul 20 10:22:19 +0000 2021
1417429812155584512,positive,2.0834667682647705,2.772644519805908,-0.37943845987319946,"CEO @kellyfryan: We know how volatile the pandemic is in the community and we are doing everything we can to complete the Suncorp Super Netball season - I’d like to thank all our stakeholders – our clubs, sponsors, broadcasters, umpires, staff and fans who continue to support.”",,Australia,Tue Jul 20 10:22:56 +0000 2021
1417429938097983488,negative,0.2571421265602112,0.12021369487047195,1.3614639043807983,Morrison is a flog. He doesn’t care. @ScottMorrisonMP @AlboMP https://t.co/LyVujsN0q8,,Australia,Tue Jul 20 10:23:26 +0000 2021
1417429956435406850,neutral,1.421317458152771,0.12940026819705966,1.2133947610855105,"People queued up in front of Centrelink before the pandemic, and they will continue to do so for long afterward. 

If you didn’t know this, or you’ve never had to do this, please check your wealth privilege before commenting. https://t.co/uYrVZNX7z7",,Australia,Tue Jul 20 10:23:30 +0000 2021
1417430247335612416,neutral,2.9299631118774414,1.0601723194122314,-0.7192270755767822,Knockin’ on Heaven’s Door (in the lockdown) https://t.co/Blm6LiH3KX,,Australia,Tue Jul 20 10:24:40 +0000 2021
1417430614454669314,neutral,1.6983374357223509,0.2531573474407196,0.7520332336425781,"Me in Fitzroy, Melbourne before we got out cus of lockdown 📸 https://t.co/P6uI14s31x",,Australia,Tue Jul 20 10:26:07 +0000 2021
1417430972564340743,negative,1.0067442655563354,-0.3669658601284027,2.2384839057922363,"Me before COVID vax: This is going to make me feel like hell. I’m sensitive to vaccine side effects.

Me after first shot: I feel like a corpse warmed up just enough to fester in the grossest possible manner.

Still 100% worth it to protect my family.",,Australia,Tue Jul 20 10:27:33 +0000 2021
1417431619024015363,neutral,1.6967414617538452,-0.11732300370931625,0.9704003334045409,"How about an 85% vaccinated party instead?
“around 85% of Australia’s population will need to be vaccinated for herd immunity to occur.”
https://t.co/Vf3XtBlDSG https://t.co/h87jY10mZl",,Australia,Tue Jul 20 10:30:07 +0000 2021
1417431742084837382,neutral,1.6450097560882568,-0.17339131236076355,0.7134554982185364,Barty skips athletes’ village as COVID fears rise | The New Daily https://t.co/oxcfwkn7sa,,Australia,Tue Jul 20 10:30:36 +0000 2021
1417431780315914241,neutral,0.9666287302970886,0.6160660982131958,0.7019038796424866,"Not just Sydney, tis is for all my friends in lockdown https://t.co/ilYiH5gFNs",,Australia,Tue Jul 20 10:30:45 +0000 2021
1417432168012288002,neutral,2.06509780883789,1.2438336610794067,-0.331548273563385,Bahahahaha @jimmyrees #auspol #COVID19 #NSWHealth Meanwhile in Australia *PART 26* 😳🍷😭 https://t.co/6gzcP9RjEe via @YouTube,"auspol, COVID19, NSWHealth",Australia,Tue Jul 20 10:32:18 +0000 2021
1417432258160459778,negative,0.8715983629226685,0.3882598578929901,1.249667406082153,"My #lockdown rewatch of the saga continues. Solo was much maligned for valid reasons, but I’m duty bound to defend it. Banging score #nw https://t.co/yCGfrMd6Pc","lockdown, nw",Australia,Tue Jul 20 10:32:39 +0000 2021
1417432485424627712,positive,1.2926087379455566,2.681983470916748,0.08122078329324722,"When your 6-year old daughter yells out “Daddy! You better come watch TV because your mate is on it!” 

What a legend @GavinWanganeen! 💪🏼
.
.
.
@Channel10AU @Survivor_AU 
#lockdown #tv https://t.co/ZqHrXI9uQU","lockdown, tv",Australia,Tue Jul 20 10:33:33 +0000 2021
1417432652248870912,positive,1.314618706703186,2.6279401779174805,-0.6949086189270021,@TheMatildas Come on girls give a nation in lockdown something to smile about.,,Australia,Tue Jul 20 10:34:13 +0000 2021
1417432714966233095,positive,0.4600297510623932,1.3820804357528689,0.3040089607238769,Due for a coffee after lockdown @GavinWanganeen! ☕️☕️ https://t.co/9urCDIQ2zh,,Australia,Tue Jul 20 10:34:28 +0000 2021
1417432911301677056,negative,0.952867031097412,-0.6896564960479736,2.2091927528381348,@my_gay_agenda_ She’s a dickhead.  She also said NSW would never lockdown….just days before it happened.  Horrid person.,,Australia,Tue Jul 20 10:35:15 +0000 2021
1417434192485535789,neutral,2.905742645263672,0.9215188026428224,-0.6909174919128418,Just posted a photo @ Melbourne Lockdown https://t.co/Uo9wyyU6el,,Australia,Tue Jul 20 10:40:20 +0000 2021
1417434231790137347,neutral,2.495144844055176,1.642861008644104,-0.9463898539543152,@DustyPee Father John Misty will get us through lockdown,,Australia,Tue Jul 20 10:40:30 +0000 2021
1417434362736381952,positive,0.2559070587158203,1.5978461503982544,0.7105070948600769,Cant wait for the Sky News Outsiders crew to start pushing this crapola. https://t.co/H1yCuHUbRF,,Australia,Tue Jul 20 10:41:01 +0000 2021
1417434620770009089,positive,2.9499690532684326,3.1477320194244385,-1.1885919570922852,"When there’s a lockdown … you need a few strawberries

#strawberries #smoothie #mealprep #red #green #melbournelockdown #melbournelife @ Melbourne, Victoria, Australia https://t.co/CniSrBVkQm","strawberries, smoothie, mealprep, red, green, melbournelockdown, melbournelife",Australia,Tue Jul 20 10:42:02 +0000 2021
1417434970079985669,negative,1.4087567329406738,-0.2500561773777008,1.5932053327560425,@lyntonmanuel Still working all every day from home so nothing different in this household except if I go to get groceries (if there are any left) I have to wear a mask. No time to binge watch tv. 😂,,Australia,Tue Jul 20 10:43:26 +0000 2021
1417435324418953219,positive,0.05563301220536232,0.7612895369529724,0.2892743945121765,Interesting times.. https://t.co/rkrzILwRYj,,Australia,Tue Jul 20 10:44:50 +0000 2021
1417435616896192512,negative,0.5096469521522522,-1.1486958265304563,4.363365650177002,"@statnews This is making me sick in the stomach.  Thousands of lives are lost everyday in Indonesia from COVID-19. Some unable to breath, dying in their home because hospitals are running out of beds and millions of unused doses are set to go to waste in the US!!!!!
@HelenBranswell",,Australia,Tue Jul 20 10:46:00 +0000 2021
1417435684252512259,negative,0.2181776911020279,-0.3468262553215027,2.1565635204315186,Unbelievable crap https://t.co/2ChYz0paBo,,Australia,Tue Jul 20 10:46:16 +0000 2021
1417435699934941186,positive,1.4126735925674438,2.031401872634888,0.939965844154358,"Things are gloomy in #southaustralia 2night, with #winter weather gripping, &amp; start 7 days COVID #lockdown.
Three #bovine ladies paid a cheering visit to peer through my office window.
As always, #agriculture is an essential industry so #foodproduction continues.
#limestonecoast https://t.co/aloDx2JO20","southaustralia, winter, lockdown, bovine, agriculture, foodproduction, limestonecoast",Australia,Tue Jul 20 10:46:20 +0000 2021
1417435808965922816,negative,1.340564846992493,-1.2103826999664309,3.3315923213958736,Why do we bother shutting out our eastern states fellow Australians when ships from highly infected high risk Indonesia many crewed with COVID-19 unavoidably infected Indonesians float in on an almost daily basis. Why?,,Australia,Tue Jul 20 10:46:46 +0000 2021
1417436097273991176,neutral,1.508578896522522,0.5672013759613037,0.40607526898384094,Just a reminder how covid will effect regional and remote areas. #COVID19Vic https://t.co/yhnqdCkYSi,COVID19Vic,Australia,Tue Jul 20 10:47:54 +0000 2021
1417436275489968131,negative,0.6391628384590149,-0.8054634332656859,3.1832761764526367,Better still please stop listening to the BS that comes from your State Governor. He is ducking moron and if you think he hasn’t been vaccinated and takes all precautions you’re as big a ducking moron as he is! https://t.co/oxZn8EcXVI,,Australia,Tue Jul 20 10:48:37 +0000 2021
1417436695314636800,positive,0.6930403113365173,1.008541703224182,0.577203631401062,Never let facts get in the way of a good tweet. https://t.co/tvmimLDX9m,,Australia,Tue Jul 20 10:50:17 +0000 2021
1417436762423500811,negative,0.39697232842445374,0.6971167922019958,1.3731558322906494,Disappointed we’ve had to cancel - huge amount of work. So many great SA events have been affected by this lockdown. Thinking of everyone in the industry ❤️ #adeaide #festival https://t.co/sTuvyy9nFj,"adeaide, festival",Australia,Tue Jul 20 10:50:33 +0000 2021
1417437548754784258,positive,1.0683462619781494,2.1174483299255367,0.06494748592376709,"A non-transport related tweet from the head of the @ptua. 

Great to learn a little more about your background @danielbowen. 

Your research and persistence admirable. https://t.co/rrmMBniokW",,Australia,Tue Jul 20 10:53:40 +0000 2021
1417438102491041798,neutral,0.6689666509628296,0.42047062516212463,0.08060495555400847,Please like me https://t.co/S1WBgZ12NT,,Australia,Tue Jul 20 10:55:53 +0000 2021
1417438207289872385,negative,1.5280762910842896,-1.0743207931518557,2.6101131439208984,"@sophieelsworth Your information as Usual is Wrong No Stats 2 support your Argument 
If U R being sarcastic about # days in Lockdown then surely U should at least disclose the end result 
But No Murdoch wouldn't approve of this Approach 4 Good Ethical Journalism 
So your comments mean Nought",,Australia,Tue Jul 20 10:56:18 +0000 2021
1417438418376609793,negative,0.7887547016143799,-0.2409200072288513,1.9175808429718015,"You have to take the good with the bad during lockdown . 
At least you won’t get Burgled . https://t.co/z3KwlGciOt",,Australia,Tue Jul 20 10:57:08 +0000 2021
1417438549876510725,neutral,1.423535704612732,-0.022110134363174442,0.8367756009101868,"@ZevShalev @audiomagnate We have been operating at the absolute outer edges not human knowledge since COVID arrived, there are no answers yet",,Australia,Tue Jul 20 10:57:39 +0000 2021
1417438693380399104,neutral,1.3701028823852541,-0.0875047817826271,0.9487209916114808,"For those who do not believe covid is real... @ Adelaide, South Australia https://t.co/2SisOXUMO8",,Australia,Tue Jul 20 10:58:13 +0000 2021
1417425794901495819,negative,1.6265017986297607,0.1154571995139122,1.9875117540359497,"@SAHealth Hey @SAHealth is there no way of reviewing your own Check-in History, other than just the last check in, using the COVID-SAfe Check-in capability on the mySA GOV App? 🤷🏻‍♂️",,Australia,Tue Jul 20 10:06:58 +0000 2021
1417428555646980096,neutral,1.7566778659820557,0.2651650309562683,1.4214633703231812,"@Asset90210 @DifficultNerd And one more thing, the clinical trials are ongoing as scientists learn more about the virus and its variants, and second generation vaccines are taking on different approaches to assist on what’s already proven by approved existing vaccines. Even pfizer is plannnng covid tablets",,Australia,Tue Jul 20 10:17:56 +0000 2021
1417428584537288708,negative,0.6993308067321777,0.4739585816860199,1.954467535018921,"So much for ""Build Back Better"", our recovery from covid is likely to accelerate emissions growth in the short term! Of $16tn spent on covid recovery just 2% is invested in renewables. 
What a wasted opportunity, what a failure of leadership. https://t.co/Qi0XsjO5nQ",,Australia,Tue Jul 20 10:18:03 +0000 2021
1417430583525875713,neutral,2.2491343021392822,1.0141311883926392,0.6771796345710754,With our whole state on extended covid lockdown Friday’s show at @TheatreRoyalCM supporting Mick Thomas And The Roving Commission has been rescheduled to Saturday October 30 ! Existing Tix valid for the new date or grab some now from @oztix https://t.co/8JMhRExhvQ #covid #rock https://t.co/ha9QTEc8wM,"covid, rock",Australia,Tue Jul 20 10:26:00 +0000 2021
1417433446209572866,negative,1.150517821311951,-0.4582534730434418,2.1361117362976074,"@jboyded If that's true it would be the biggest story outside of covid in this country. It's also probably been buried under 10 tonnes of concrete. Morrison has a powerful backer, he's too stupid to have gotten where he is without one.",,Australia,Tue Jul 20 10:37:22 +0000 2021
1417433609019936769,negative,1.7409652471542358,-1.0711675882339478,2.5974698066711426,@penbo Ask him why the covid support payments for workers stood down in #SALockdown arent available to regional South Australians? Why are workers in our regions left out in the cold?,SALockdown,Australia,Tue Jul 20 10:38:01 +0000 2021
1417433885479084035,positive,1.341895580291748,4.0494961738586435,-1.0117866992950442,Thanks Shannon. Keeping an eye on you always. Need to know what’s happening COVID-19 &amp; beyond! Pleasure working with you. https://t.co/TomUWSrAhD,,Australia,Tue Jul 20 10:39:07 +0000 2021
1417437247004020743,negative,0.6596752405166626,-0.08958473056554794,3.4120981693267822,Dear @ScottMorrisonMP &amp; @GladysB thank you so much for delivering Covid to us in South Australia. Your incompetent bumbling of everything surrounding this virus has caused undue stress on many. Thanks for fuck all! I hope you are destroyed in your respective elections. #auspol,auspol,Australia,Tue Jul 20 10:52:29 +0000 2021
1417437328230928389,negative,1.496631741523743,-1.045994758605957,2.1811506748199463,If we must allow a ship from high risk country to berth why can’t the crew be subjected to COVID-19 tests before being free to do so.,,Australia,Tue Jul 20 10:52:48 +0000 2021
1417429364220723207,neutral,1.6598716974258425,-0.3102220594882965,1.554118037223816,"@KayeStirland At work today a customer didn't wear a mask. Pharmacist asked her. She started yelling about how we're not allowed to asked her. And you should check the DH web. And she carried on that she got exemption.

PS. Sure it's not an exemption. Just Karen in general.",,Australia,Tue Jul 20 10:21:09 +0000 2021
1417429763711324160,positive,0.6903353333473206,1.724590301513672,-0.03538031131029129,"@Rileymitch19987 @FOXFOOTY @kayosports It’s discrimination at its very best . There are many who cannot take the vaccine for various reasons , fact",,Australia,Tue Jul 20 10:22:44 +0000 2021
