Tweet_ID,Sentiment_Label,Logits_Neutral,Logits_Positive,Logits_Negative,Tweet_text,hashtags,country,created_at
1416352077022855169,neutral,0.9401954412460328,0.7970093488693237,0.6773704290390015,@sarahmeganbridg @rwynnemp We are not in lockdown - but it would be very helpful if @VicGovDH could confirm next steps for our building @VictorianCHO @DanielAndrewsMP,,Australia,Sat Jul 17 11:00:24 +0000 2021
1416352421182275584,negative,0.779032289981842,0.7962204217910767,2.3110737800598145,@dontdoitdani Welcome to how hospitality/events/the arts industry have been feeling this whole pandemic. It’s horrible but we’ve been keeping our chin up because we know it’s going to help us return to normal faster.,,Australia,Sat Jul 17 11:01:46 +0000 2021
1416352456972279813,neutral,1.3104771375656128,1.0522522926330566,0.6726897954940796,The Covid check-in and check-out process would be so much more efficient if it didn't require two face id checks while wearing a mask. Just a scan in and a scan out is all it would really need. #COVID19nsw #covidsydney,"COVID19nsw, covidsydney",Australia,Sat Jul 17 11:01:54 +0000 2021
1416352627734974465,neutral,2.2683534622192383,2.1608011722564697,-0.7360504865646362,Second Covid jab done! Pfizer jab at Sydney Olympic Park. #Pfizer #COVID19nsw #vaccinated #roarlouder #sparkleharder https://t.co/awslhADXCY,"Pfizer, COVID19nsw, vaccinated, roarlouder, sparkleharder",Australia,Sat Jul 17 11:02:35 +0000 2021
1416352689772920832,neutral,1.5024739503860474,1.196792721748352,-0.4249383509159088,I'd say 2-3 weeks https://t.co/vQZpu0jKP9,,Australia,Sat Jul 17 11:02:50 +0000 2021
1416352810350776324,positive,0.919446051120758,1.362731695175171,0.2587556838989258,"@PRGuy17 Does my head in that more removalists traveled from West Hoxton , to Figtree, then out to Molong while knowing they were Covid positive. #WheretheFuckAreWeMal #GladysCovidSpreaders","WheretheFuckAreWeMal, GladysCovidSpreaders",Australia,Sat Jul 17 11:03:19 +0000 2021
1416352977514680323,negative,1.3315234184265137,-0.8954155445098877,2.0571966171264653,@kirkbroadhurst @JElliotMP Sydney is in lockdown. It's illegal to leave Sydney.,,Australia,Sat Jul 17 11:03:59 +0000 2021
1416353172465979393,negative,1.3176591396331787,-1.273235559463501,3.2584111690521236,"@RedJules4 @David_Speers Seriously? That’s what you’ve got.  Where’s the damning outright condemnation that NSW govt got it wrong.  It failed to contain the Bondi outbreak when they had a chance.  Think about it, NSW govt allowed it to escape shutting down another city.  Again!",,Australia,Sat Jul 17 11:04:45 +0000 2021
1416353583033819144,negative,0.5548886060714722,0.17230017483234406,2.1075007915496826,"@lisagiven @BradRyan @MatthewJoel92 @rwynnemp @theheraldsun Hah! While I hate that term, you might well be right. Especially considering the “hard lockdown” comment came from the Herald Sun originally. They’re not always that concerned with facts! 😅",,Australia,Sat Jul 17 11:06:23 +0000 2021
1416353740982865922,negative,1.3691623210906982,0.3537790775299072,1.3983819484710691,"@JoshFrydenberg @EconomistAnge @theheraldsun We remember what you did last year &amp; 4th lockdown, how you threw us under the bus when we were very fragile &amp; vulnerable. We remember how you played politics against @DanielAndrewsMP &amp; @VictorianCHO. And you're playing politics now in an election year. #shameonyou #VoteJoshOut","shameonyou, VoteJoshOut",Australia,Sat Jul 17 11:07:01 +0000 2021
1416353956146475009,negative,1.4292044639587402,-0.4056931436061859,1.626574158668518,@David_Speers David you have never in a true lockdown like we have here in WA where the state shuts down as everyone stays home apart from essential workers,,Australia,Sat Jul 17 11:07:52 +0000 2021
1416355380293107718,negative,1.4697965383529663,-0.43786528706550604,1.8959915637969968,@DoctorKarl What frustrates me. Lockdown was to test the weaponisation of 5G while we were at home. Now at lockdown/test number 5.0 why can’t they get it to work?,,Australia,Sat Jul 17 11:13:31 +0000 2021
1416356235327074305,negative,1.0739134550094604,-0.7498155832290649,2.1457071304321294,@julia_zemiro Kind did admit to recommending a total lockdown and a “lockdown” was implemented.  Was just missing the air quotes.,,Australia,Sat Jul 17 11:16:55 +0000 2021
1416356495088705536,positive,0.7197560667991638,2.734473466873169,0.15506286919116974,"OMG I'm going crazy here people in this Lockdown I had so many great ideas planned for my YouTube channel with great content I'm sure you will all enjoy, but being in lockdown is holding me back 😭😭😭",,Australia,Sat Jul 17 11:17:57 +0000 2021
1416356558867341312,neutral,1.378887414932251,-0.041082628071308136,0.9599274396896362,"When two sides go to war...
Give me a target. https://t.co/cHlCp57bqC https://t.co/CcbCypepvR",,Australia,Sat Jul 17 11:18:12 +0000 2021
1416356889416192000,positive,0.2586760222911835,2.3373281955718994,-0.044318966567516334,@GaryLineker Yes! I made a delicious lockdown dinner https://t.co/D1WZcA248q,,Australia,Sat Jul 17 11:19:31 +0000 2021
1416356935662641158,neutral,1.5221220254898071,0.6095305681228638,1.1113512516021729,"@MarilynShephe15 @NickMcCallum7 @3AW693 “but has been authorized for emergency use by FDA under an Emergency Use Authorization (EUA) to prevent Coronavirus Disease 2019 (COVID-19) for use in individuals 12 years of age and older.”
You left that part out…. You’re welcome",,Australia,Sat Jul 17 11:19:42 +0000 2021
1416356997524459520,neutral,1.8182907104492188,0.06684589385986328,0.5496165156364441,@PatsKarvelas And spread to regional areas the Lockdown is preemptive.,,Australia,Sat Jul 17 11:19:57 +0000 2021
1416357061420404738,neutral,1.405813694000244,1.2719117403030396,0.08857941627502441,"Inspired by Guillaume’s roast leg of lamb over wood fire #platdetour @cuclingcentral #cupcakechallenge
#lockdown https://t.co/yWsiLcNHxQ","platdetour, cupcakechallenge, lockdown",Australia,Sat Jul 17 11:20:12 +0000 2021
1416357601009442818,negative,1.6031241416931152,-0.9642813205718994,2.1280782222747803,@David_Speers WA Government does each time we have a lockdown as Perth and peel shut-down for the duration,,Australia,Sat Jul 17 11:22:21 +0000 2021
1416358066233118726,negative,0.919636368751526,-0.9431989789009094,3.4715893268585205,"Hey #ScottyDoesNothing 

Your 2 largest states are in lockdown people loosing their jobs businesses...
Any chance you could step up and blame us the people for your ineptitude just so we can cope?
The clock is ticking for us",ScottyDoesNothing,Australia,Sat Jul 17 11:24:12 +0000 2021
1416358080816680964,neutral,1.6010063886642456,-0.17179188132286072,0.8962238430976868,Surely being in full lockdown is easier than being a Knights supporter 😫😫#NRLStormKnights,NRLStormKnights,Australia,Sat Jul 17 11:24:15 +0000 2021
1416358444353744898,neutral,0.9222785830497742,0.35196661949157715,0.41082626581192017,Shoulda been there last year f***k covid https://t.co/f78Q4wEZGu,,Australia,Sat Jul 17 11:25:42 +0000 2021
1416358455229616133,negative,1.140951156616211,-1.02921462059021,2.7523763179779053,@kirkbroadhurst @JElliotMP Do you want cops on every street corner ? Most my family are in Sydney and they don't feel like it's a lockdown in name only.,,Australia,Sat Jul 17 11:25:45 +0000 2021
1416359141250015236,negative,0.7635518312454224,0.1795876920223236,1.4453336000442505,"So sorry for you mate.

Wish you had McGowan like we do. https://t.co/uiCxB30Ujw",,Australia,Sat Jul 17 11:28:28 +0000 2021
1416359210321793027,negative,1.494147539138794,-0.8326261043548584,2.310209035873413,"Testing places for COVID-19 that cite ""no referral"" don't want to be a doctor doing that, and there is no GOD they can use as a doctor because the Governor of New South Wales does not have a cost of business they are going to get to.",,Australia,Sat Jul 17 11:28:45 +0000 2021
1416359799189512195,neutral,1.2700656652450562,0.519497811794281,0.907533884048462,@samaskydweller @JElliotMP @GladysB I'm yet to see any evidence that outdoor mask wearing has stopped anything. Covid theatre. Maybe you'd prefer a Dan lockdown of the whole state.,,Australia,Sat Jul 17 11:31:05 +0000 2021
1416360232909824003,negative,1.1114645004272459,-0.7538060545921326,1.813982605934143,@fayafox @haris43516539 Yes no fear from Covid-19 😝😝😝😝,,Australia,Sat Jul 17 11:32:48 +0000 2021
1416360589090115584,negative,0.8397131562232971,-1.1016324758529663,3.5415380001068115,"Bull shit. 

They're no more severe than Victoria endures every time one of her sister states leaks a seeding event across the border.

What planet do you live on? https://t.co/Vy2QpaZz0R",,Australia,Sat Jul 17 11:34:13 +0000 2021
1416360648443777030,neutral,1.5733613967895508,-0.21796104311943051,1.4118053913116455,"@CraigKellyMP @DanielAndrewsMP So these businesses would remain open, be flooded with customers and prosperous if COVID was allowed to spread uncontrolled throughout the community???",,Australia,Sat Jul 17 11:34:27 +0000 2021
1416360859736018948,neutral,1.3441150188446045,0.7987479567527771,-0.3142413794994354,"I signed, boot her out https://t.co/Rbjqfslmqa",,Australia,Sat Jul 17 11:35:18 +0000 2021
1416361676048240640,negative,0.8710595965385437,-1.4733834266662598,4.526505470275879,"This is utter rubbish.

We in the West know how to lock down and when.

Victoria is the gold standard.

What planet does Speers inhabit? https://t.co/Vy2QpaZz0R",,Australia,Sat Jul 17 11:38:32 +0000 2021
1416361914167296002,neutral,1.8013321161270142,0.7236677408218384,0.36726632714271545,"NSW Covid numbers for Sunday morning are believed to be 105 according to the man’s man
🦠🦠🦠",,Australia,Sat Jul 17 11:39:29 +0000 2021
1416362058782674947,negative,1.30415940284729,-1.1880801916122437,3.0102105140686035,"I agree, how is Katie Hopkins allowed to come here and spread the disease of hate and close mindedness, when we already have COVID to contend with? https://t.co/y5stmUJunN",,Australia,Sat Jul 17 11:40:04 +0000 2021
1416362377818214401,neutral,1.991981029510498,0.20354321599006653,0.9317083954811096,A whole lot of folks gonna move out of the “friend zone” this #lockdown 😂😂😂 https://t.co/qG2Jg3IVvc,lockdown,Australia,Sat Jul 17 11:41:20 +0000 2021
1416362893168111622,negative,1.2513904571533203,0.3136818110942841,1.260798096656799,"If left alone, I wonder how quickly it takes for this to hit the bottom dollar. Already this year, there’s been so much more talk about people tuning out of games. Obviously attendances are down because of Covid but once the ratings go down…you know the rest.",,Australia,Sat Jul 17 11:43:23 +0000 2021
1416363036839878656,neutral,1.3503414392471311,0.9879962801933287,-0.3727697432041168,Get one with fewer pieces. https://t.co/m9sujZttXS,,Australia,Sat Jul 17 11:43:57 +0000 2021
1416363204498792448,negative,0.38019144535064703,-0.6121553778648376,3.179335832595825,It's why @GladysB is the Gold Standard in fucking up the Covid19 response! If she cared for NSW people she'd have locked the place down and kick @ScottMorrisonMP out and keep him out. https://t.co/w8nIaE26vM,,Australia,Sat Jul 17 11:44:37 +0000 2021
1416363293900304384,neutral,1.537781000137329,0.5618953108787537,0.6804216504096985,If you haven’t heard of these guys yet I can recommend checking out their website 👍 https://t.co/bBNPM3j6Dm https://t.co/4ozg2Di7rl,,Australia,Sat Jul 17 11:44:58 +0000 2021
1416363364523995239,neutral,1.1133155822753906,-0.1332283318042755,0.939642071723938,This is a thread IPRs and global health folks/anybody https://t.co/hAl3Yip5cD,,Australia,Sat Jul 17 11:45:15 +0000 2021
1416363709090320385,negative,1.0652033090591428,-0.8821976184844971,3.0536229610443115,"@emma__jayne14 @susan_taylor07 @GladysB When will Josh Frytheturd  eviserate the NSW government and leader G***** for their ineptitude in handling of this lockdown, why they are making it up as they go along and why they have no plan to get out of this economic disaster?  I mean this Clusterfck is diabolical.",,Australia,Sat Jul 17 11:46:37 +0000 2021
1416363941563822080,neutral,1.095031499862671,0.9404361248016356,-0.07381437718868256,You're a bit late mate. https://t.co/pWuNNFrFdW,,Australia,Sat Jul 17 11:47:33 +0000 2021
1416364368405491718,negative,1.6991634368896484,-1.3817175626754759,3.472242593765259,"@smh All this because Gladys &amp; NSW Health were too arrogant to lockdown Sydney immediately COVID was in the community in the Eastern suburbs, remember this started in the Eastern suburbs,",,Australia,Sat Jul 17 11:49:14 +0000 2021
1416364447795322880,neutral,0.573706865310669,0.08416978269815445,0.42610034346580505,Yes. Yes they are https://t.co/2YhAeQ4SDO,,Australia,Sat Jul 17 11:49:33 +0000 2021
1416365010293444612,negative,1.285433650016785,-1.0451126098632812,2.83773136138916,"@7NewsSydney This outbreak started in the Eastern suburbs, Gladys &amp; NSW Health were too arrogant to lockdown then, which many experts totally requested. Now it's in the SW all because they FAILED.",,Australia,Sat Jul 17 11:51:47 +0000 2021
1416365912807018498,positive,1.3864407539367676,3.4197494983673096,-0.4656412303447723,DOMINANT. 14 on the trot for the purple juggernaut. Providing the perfect distraction for fans and members who are doing it tough in lockdown. Thank you @storm 💜 #NRLStormKnights #YourStorm #NRL https://t.co/7iVQptatK2,"NRLStormKnights, YourStorm, NRL",Australia,Sat Jul 17 11:55:23 +0000 2021
1416366369633804290,negative,0.4891774952411652,-0.17088428139686584,1.1247130632400513,"Its a worry, isn't it. https://t.co/zuh21bTnv1",,Australia,Sat Jul 17 11:57:11 +0000 2021
1416366586378657800,negative,1.5423288345336914,-0.7563665509223938,1.5454620122909546,'Unmitigated disaster': Victorian catering head calls for change amid fifth lockdown https://t.co/4tKV11Xhl5,,Australia,Sat Jul 17 11:58:03 +0000 2021
1416366624748097543,neutral,1.0826420783996582,0.7443292140960693,1.0181753635406494,"""Gosh I'm so lucky to be in a profession that has continued to thrive during covid"" she says as the Premier shuts down construction sites restricting all overdue development and causing further influx in housing prices #COVID19nsw",COVID19nsw,Australia,Sat Jul 17 11:58:12 +0000 2021
1416367229935910913,neutral,2.027751922607422,1.4765143394470217,0.3228035271167755,"In full lockdown in Sydney, decided to wash the car, and do a service on it (Oil change, change track pads and wheels for the street setup). My Son  (7) loves to take pics with my Camera (Canon 600D) took and edited the pics #blitz #vitz #a050 https://t.co/mUmaPZxE4k","blitz, vitz, a050",Australia,Sat Jul 17 12:00:37 +0000 2021
1416367813619425282,negative,1.0636554956436155,-0.6554343700408936,2.366058826446533,tattoo booking fucked over by lockdown.... David Lynch u win this round once again https://t.co/Y44QJOWQwI,,Australia,Sat Jul 17 12:02:56 +0000 2021
1416367863116419077,negative,0.6978610157966614,-0.0891404077410698,0.7524097561836243,It's  not an empire. https://t.co/JbNiQg7Y4c,,Australia,Sat Jul 17 12:03:08 +0000 2021
1416368285805813760,negative,0.7106189131736755,-0.3749276399612427,2.2293322086334233,"A draw is like lockdown. Heart-racing and painful to get there, ultimately leaves you with in limbo with a total sense of emptiness. Not much else to say. #AFLDeesHawks",AFLDeesHawks,Australia,Sat Jul 17 12:04:48 +0000 2021
1416368476931837960,neutral,1.2186657190322876,0.9959178566932678,-0.026515012606978416,"@Mikala_T_ Hey possum it’s lockdown, go home!",,Australia,Sat Jul 17 12:05:34 +0000 2021
1416369120694530048,negative,1.2906100749969482,-0.3207127153873444,2.1442759037017822,"@LesStock @catherine___c Do you think it might be 0.01659% as a result of the lockdown measures? As pathetic as they’ve been in NSW so far. Go on, give us your best estimate of what the number would be without some lockdown measures.",,Australia,Sat Jul 17 12:08:07 +0000 2021
1416369449267994625,positive,0.8000146746635437,1.2972339391708374,0.1720459759235382,"When it comes to the pandemic Cadel, some memories ain’t worth keeping #couchpeloton",couchpeloton,Australia,Sat Jul 17 12:09:26 +0000 2021
1416369535557406727,neutral,1.2625081539154053,0.8546332120895386,0.9026444554328918,I received my first shot of COVID-19 vaccine today. I was privileged due to my workplace being in Fairfield LGA. It all worked very efficiently. Thank you to the staff at Prairiewood. Hopefully we can shut down the anti-vaccers https://t.co/KYxRLajTIp,,Australia,Sat Jul 17 12:09:46 +0000 2021
1416370100244914185,negative,1.163342833518982,-1.0195765495300293,3.4954774379730225,@VanityFair @DelilloM &amp; there are a lot of angry Australians stranded overseas due to Covid-19 &amp; restrictions of who can return home to Australia. But our current right wing government seems to think it's ok for 'celebrities' to fly in for Big Brother episodes. FFS!🤬,,Australia,Sat Jul 17 12:12:01 +0000 2021
1416370263378169858,positive,1.5234581232070925,2.891145944595337,-0.8230645656585693,@vmainard Good to have a mate with you during lockdown Vicki . Take care 👍🏼,,Australia,Sat Jul 17 12:12:40 +0000 2021
1416370631222779905,positive,1.1782965660095217,2.434300422668457,-0.5814979076385498,"Well, that improved - as it needed too. Just have to get used to no-fan footy - again - i suppose, and just be thankful there’s something to watch at all in lockdown (and iso for me). #AFLDeesHawks",AFLDeesHawks,Australia,Sat Jul 17 12:14:08 +0000 2021
1416370830540378113,negative,0.3096275329589844,-0.2474271059036255,2.274720430374145,"Absolutely ridiculous, make the hotel as far as she gets, you should be ashamed @Channel7 #BigBrotherAU #Channel7 https://t.co/TP7EcUwTRw","BigBrotherAU, Channel7",Australia,Sat Jul 17 12:14:55 +0000 2021
1416370949834772489,negative,1.016288161277771,-0.5406372547149658,1.443644404411316,@central_spook This is what boredom does  in lockdown lol,,Australia,Sat Jul 17 12:15:23 +0000 2021
1416371045737672704,positive,1.508623719215393,1.8656252622604368,-0.6790944337844849,More than 200 exposure sites now. Get checking Melbourne xx https://t.co/RQTtVNvCeD,,Australia,Sat Jul 17 12:15:46 +0000 2021
1416371524462809104,negative,0.8869333267211914,-0.09331008046865463,1.49125075340271,"So, that’ll be the olympics cancelled. https://t.co/tlyNBGPE7k",,Australia,Sat Jul 17 12:17:40 +0000 2021
1416371634135461892,neutral,1.581621170043945,-0.00685090571641922,0.727310299873352,That's not what you said last week Josh https://t.co/s6Km5rPtmM,,Australia,Sat Jul 17 12:18:07 +0000 2021
1416371667501154305,neutral,1.7080237865447998,-0.22725537419319156,0.5992823243141174,What's the current contrarian twattery on this? @ProfKarolSikora https://t.co/pGuQBq9zhl,,Australia,Sat Jul 17 12:18:15 +0000 2021
1416371707003031553,positive,0.7289534211158752,1.116766333580017,0.8104177117347717,"Farewell to another day in  #lockdown … I had a laugh before bed with BBC Talking Animals, never gets old (for me anyway) 
#SteveSteveSteve #TryingToBePositive 
https://t.co/PctQf1P1YP","lockdown, SteveSteveSteve, TryingToBePositive",Australia,Sat Jul 17 12:18:24 +0000 2021
1416373034793897988,neutral,1.8798651695251465,1.6746368408203125,-0.4134190976619721,"So the boy announced there ll be 105 cases in Sydney tomorrow.
#COVID19 #SydneyLockdown #SydneyOutbreak","COVID19, SydneyLockdown, SydneyOutbreak",Australia,Sat Jul 17 12:23:41 +0000 2021
1416373053156560899,neutral,1.6977639198303225,-0.05240673571825028,1.3804420232772827,"@jaynefrances63 @Channel7 We're in another lockdown in Melbourne with 20+ cases, meanwhile the UK is removing all restrictions and expecting 100,000 new cases as a day as a result. Madness",,Australia,Sat Jul 17 12:23:45 +0000 2021
1416373598197932037,negative,0.9515793323516846,-0.7040873765945435,2.720456600189209,"I hope there is compensation coming for tonight's debacle @sportsbetcomau Things are tough enough in lockdown without a legal vice being taken away from us .. 🥺🥴
#NRL #AFL #sportsbet","NRL, AFL, sportsbet",Australia,Sat Jul 17 12:25:55 +0000 2021
1416373727441211398,negative,0.2281317412853241,0.2186589539051056,0.6350246667861938,"@NoDirectAction CDC bias, nah, never!

https://t.co/zGFe0rDTte",,Australia,Sat Jul 17 12:26:26 +0000 2021
1416373910409334787,neutral,1.7169740200042725,0.9397299289703368,0.15466581284999847,@daynaa2000 Fingers crossed the lockdown is going to end as soon as it's safe for all of us,,Australia,Sat Jul 17 12:27:09 +0000 2021
1416374539550789639,negative,1.1571153402328491,-1.1023259162902832,2.8580877780914307,"@jkalbrechtsen How about, for the lockdown period, landlords don’t get their rent &amp; banks their instalments when businesses are shut down &amp; people not able to work.  @ScottMorrisonMP @DanielAndrewsMP #alanjones @SkyNewsAust",alanjones,Australia,Sat Jul 17 12:29:39 +0000 2021
1416375308941369344,neutral,1.6161346435546875,1.0993590354919434,0.45082211494445795,@MarianSaines @KoparaFallsKid Been like this since April 2020 in Australia.  Have friends in UK  with long Covid since May 2020 that after 5 tests have to pay £100  per test,,Australia,Sat Jul 17 12:32:43 +0000 2021
1416375966729863170,positive,0.5222430825233461,2.0424563884735107,0.2613185942173004,"Hardly, Sydney needs a good old-fashioned #melbournelockdown &lt;5km radius with a CURFEW 😷 #SydneyLockdown #SydneyOutbreak https://t.co/uDJyInmx8T","melbournelockdown, SydneyLockdown, SydneyOutbreak",Australia,Sat Jul 17 12:35:20 +0000 2021
1416376111873675267,positive,1.841080904006958,5.607803821563722,-0.9032118916511536,"Thanks to #communitymember Daniela for sharing her family’s experience at our @BanyuleCHS #RMIT Bundoora East Car Park #COVID-19 #DriveThru #testingclinic. 
Our team’s working extremely hard, 7 days a week, supporting + caring for our #community.
We’re #AlwaysHereForYou @VicGovDH https://t.co/bJnyRAYNjB","communitymember, RMIT, COVID, DriveThru, testingclinic, community, AlwaysHereForYou",Australia,Sat Jul 17 12:35:54 +0000 2021
1416376215129055232,negative,1.2611099481582642,0.3455667495727539,1.4143580198287964,Is this Dan Andrews vision for Melbourne? He’s very keen for no one to return to offices. He happily shuts regional areas with no Covid and has his PR team convincing everyone they think he is keeping them safe. He’s not. He’s destroying your children’s future and your lives now https://t.co/rhAov39r5x,,Australia,Sat Jul 17 12:36:19 +0000 2021
1416376255457366016,negative,1.34355366230011,-0.37696531414985657,1.4519622325897217,"@MarianSaines @KoparaFallsKid https://t.co/92e5XNw6vC

The folk over there don't even blink at these stats. They've  lived with them for so long  they don't even follow the stats anymore.  They just get on with life",,Australia,Sat Jul 17 12:36:28 +0000 2021
1416376717770326017,neutral,1.8832271099090576,1.5003682374954224,-0.32439354062080383,"Lockdown blues made it. Team WARM/COOL?

#Lockdown5 #melbournelockdown5 #Melbourne https://t.co/9fwF1GAzac","Lockdown5, melbournelockdown5, Melbourne",Australia,Sat Jul 17 12:38:19 +0000 2021
1416377219446808581,positive,1.2336267232894895,1.7503918409347534,-0.11224471777677536,"PLEASE STAY AT HOME and be safe always. 💕
#StaySafe #WearAMask #GetVaccinated # https://t.co/MQ0UNwdqOv","StaySafe, WearAMask, GetVaccinated",Australia,Sat Jul 17 12:40:18 +0000 2021
1416378150682984449,neutral,1.233612298965454,0.6597669124603271,-0.3906842470169067,Send her home https://t.co/IN0eV9LWvc,,Australia,Sat Jul 17 12:44:00 +0000 2021
1416378411887570952,neutral,2.725416660308838,1.6625424623489382,-0.5706911683082581,"The first Scrabble game of Lockdown Season #5. @ Abbotsford, Victoria, Australia https://t.co/9w8yXp8vQG",,Australia,Sat Jul 17 12:45:03 +0000 2021
1416379176282517508,negative,1.327383518218994,-1.3065729141235352,3.378897428512573,@backyardbirdo Aaaannnd I just realised who you are and what you do….🤦🏻‍♀️I blame lockdown….🙄🤷🏻‍♀️😂,,Australia,Sat Jul 17 12:48:05 +0000 2021
1416379350266441735,positive,1.4134769439697266,1.449970245361328,-0.4989924430847168,"Making a tim tam cheesecake
#lockdown #life","lockdown, life",Australia,Sat Jul 17 12:48:46 +0000 2021
1416380367620120576,neutral,1.4705826044082642,0.5915697813034058,1.0897995233535769,"We’re right behind this book. 
It’s soon to be released and based on footy banners that have gone before…..like the one we would have hoisted tonight if COVID19 didn’t interfere 🥲 https://t.co/WFAsm2bCuH",,Australia,Sat Jul 17 12:52:49 +0000 2021
1416380865546887168,positive,0.6266117691993713,0.8129953145980835,-0.11194402724504472,Exactly right. https://t.co/b1EyYp4ZAK,,Australia,Sat Jul 17 12:54:48 +0000 2021
1416381070786711554,neutral,1.7931557893753052,0.20778688788414,-0.2544315755367279,Sydney Lockdown Day 20 https://t.co/Fp18mGQshg,,Australia,Sat Jul 17 12:55:37 +0000 2021
1416381621658292224,negative,1.3106716871261597,-0.1401747167110443,1.3975030183792114,"@JoelyDenterpris @Tedthekelpie @SimonCotter62 Yeah, no, it is not. Perhaps visit a covid ward? The mortality rate is at least 10 times higher … maybe have a read of the differences?  https://t.co/azOZPTHu4j",,Australia,Sat Jul 17 12:57:48 +0000 2021
1416382602068434944,neutral,1.1884188652038574,1.1186069250106812,0.7842149138450623,How are you holding up over there @slrpa ? We are in our 5th lockdown at the moment… but hopefully this won’t be a long one. I hope you are all safe and well xx,,Australia,Sat Jul 17 13:01:42 +0000 2021
1416382646435737608,positive,0.6129987835884094,2.7675793170928955,0.5493106245994568,"@taggysbar 
Looking for a reservation for 4 whenever this pandemic bullshit ends and we can travel from Oz... matchday tickets more than welcome too... 🤪🤪🤪
Place looks brilliant!
YNWA ☆☆☆☆☆☆",,Australia,Sat Jul 17 13:01:52 +0000 2021
