Tweet_ID,Sentiment_Label,Logits_Neutral,Logits_Positive,Logits_Negative,Tweet_text,hashtags,country,created_at
1386981220941058061,neutral,1.9225372076034544,0.3431422114372253,0.9939305782318116,"COVID 19 can result in serious cardiac complications and has been associated with increased morbidity  and mortality of people with CVD.  The panel Profs Chow, Cunningham, Davidson and Ward discuss the current implications of COVID and CVD and the future post Pandemic. https://t.co/AkrgesJoF9",,Australia,Tue Apr 27 09:51:06 +0000 2021
1386968738512064512,negative,1.4059406518936155,-0.3180232644081116,1.6631442308425903,"@thetechpie @Joseph_Witty It's not abandoning the Japanese market. What they did was made their Japanese divisions smaller so they could claim the business Covid payment as they were affected. They're still supporting the Japanese market, and have deals with Companies like Square and Capcom.",,Australia,Tue Apr 27 09:01:30 +0000 2021
1386973083919994883,negative,1.0681885480880735,-0.6153422594070435,3.2193429470062256,Ahead of his appearance at the @SydWritersFest later this week I spoke to @DoctorKarl about how we’ve all become armchair epidemiologists and the most frustrating COVID/vaccine misunderstandings he has to bust: https://t.co/cwRVnxEOtX @newscomauHQ,,Australia,Tue Apr 27 09:18:46 +0000 2021
1386974947784814593,negative,1.155973196029663,-1.3791004419326782,3.530892133712769,"@K4ti34 @FLAT666 @abcnews They’re also travelling to a country that has handled Covid worse than Australia, they’re at a higher risk. Australia’s vaccine response has been abysmal, but Australian athletes staying home isn’t going to fix anything.",,Australia,Tue Apr 27 09:26:10 +0000 2021
1386971756200529922,neutral,1.568642258644104,0.0511584505438804,-0.2293349057435989,First vaccine shot booked 💉,,Australia,Tue Apr 27 09:13:30 +0000 2021
1386974839613784064,positive,1.5678222179412842,2.0146851539611816,-0.493989884853363,"When it comes to the vaccine rollout and fiscal support measures, the market is pretty definitive as to who will emerge stronger. 

@WestpacMacro chart. https://t.co/qmAlzMsnYy",,Australia,Tue Apr 27 09:25:45 +0000 2021
1386983486846799873,positive,1.1059921979904177,5.196148872375488,-0.7173506617546082,"For #TellAStoryDay, we're excited to announce One Year On, a digital showcase of stories about resilience &amp; hardship collected across Melbourne suburbs during the first year of the #COVID19 pandemic. https://t.co/Nlgr0avka7 @VicGovDJPR #CollectingTheCurve #SuburbanDevelopment https://t.co/q2ARE1wE4J","TellAStoryDay, COVID19, CollectingTheCurve, SuburbanDevelopment",Australia,Tue Apr 27 10:00:06 +0000 2021
1386983490831462401,positive,1.1059921979904177,5.19614839553833,-0.7173507213592529,"For #TellAStoryDay, we're excited to announce One Year On, a digital showcase of stories about resilience &amp; hardship collected across Melbourne suburbs during the first year of the #COVID19 pandemic. https://t.co/3TCxq06qJe @VicGovDJPR #CollectingTheCurve #SuburbanDevelopment https://t.co/vqyKSh4JsP","TellAStoryDay, COVID19, CollectingTheCurve, SuburbanDevelopment",Australia,Tue Apr 27 10:00:07 +0000 2021
1386983929584947202,negative,1.4504705667495728,-0.8515961170196533,2.47768235206604,@lazarus4917 @HCICanberra @australian @cgisydney @CGIPerth @cgimelbourne @MEAIndia Which country did keep everything ready to fight CORONA? When last yr it was at its peak India did not find shortage of O2.This yr it was sudden and unexpected. Indian med ecperts also did not foresee 2nd wave with such magnitude. Now givt is on war footing like prev yr.,,Australia,Tue Apr 27 10:01:52 +0000 2021
1386989375800680449,positive,2.1552484035491943,2.534022569656372,-0.9843131303787231,"Spotted this on my walk today #covid19 @ Waitara, New South Wales, Australia https://t.co/c7GFKz9f8q",covid19,Australia,Tue Apr 27 10:23:30 +0000 2021
1386995823687335945,negative,1.3594740629196167,-0.653229296207428,2.013720750808716,"Every time Adam says a country is doing well, he sends thousands of people to their deaths. https://t.co/73RsqRmvYa",,Australia,Tue Apr 27 10:49:08 +0000 2021
1386986441813598210,negative,0.7109953761100769,0.4256648421287536,2.0437326431274414,The announcements of lineups for northern hemisphere festivals just have me thinking pls m8. Covid’s fucked there,,Australia,Tue Apr 27 10:11:51 +0000 2021
1386995556518490115,negative,1.5748175382614136,-0.8584840893745422,1.8915177583694456,"WA hotel quarantine report warned of 'high-risk' COVID-19 dangers a month before Perth lockdown
https://t.co/708Lc6PnEr",,Australia,Tue Apr 27 10:48:04 +0000 2021
1386986160405106688,negative,0.6809866428375244,-0.7955578565597534,3.1619865894317627,"@lazarus4917 @HCICanberra @australian @cgisydney @CGIPerth @cgimelbourne @MEAIndia Western countries cant enforce mask, and lock down for public and face riot, arson. Kumbh is a huge festival and politicians are scared of taking a tough decission like farmers protest, namaz,Ramzan gatherings. BTW more spike is in Mah, Kerala, Chhgrh where there is no kumbh!",,Australia,Tue Apr 27 10:10:44 +0000 2021
1387274140344754181,negative,0.7535917162895203,-0.0486069694161415,1.1095685958862305,Giving our government full authority to poison you https://t.co/SR3urhxeVC,,Australia,Wed Apr 28 05:15:04 +0000 2021
1387275606438543361,neutral,2.041854858398437,0.6321425437927246,0.6644975543022156,"#BREAKING: #Canberra records new case of #Covid - a male diplomat in his 50s who is a returned traveller from overseas.  
#9NewsCanberra #9NewsLocal #9News","BREAKING, Canberra, Covid, 9NewsCanberra, 9NewsLocal, 9News",Australia,Wed Apr 28 05:20:53 +0000 2021
1387276423690219528,negative,0.6906166672706604,0.9309271574020386,0.9500075578689576,Well worth the read! Should the #IPL really be continuing as the country battles a deadly wave COVID? Great story from @rebeccaaruthven 🏏 #IPL2021 https://t.co/28yxSkhNCY,"IPL, IPL2021",Australia,Wed Apr 28 05:24:08 +0000 2021
1387276618410774536,negative,0.5234746336936951,0.0438784137368202,1.6405179500579834,"One man did a great job with #COVID19 but he has done nothing to improve hospitals, transport, schools or housing. Not enough for @GutweinTeam to get my vote. #politas","COVID19, politas",Australia,Wed Apr 28 05:24:54 +0000 2021
1387276685964320770,positive,0.4114494919776916,0.995188534259796,0.2356047481298446,definitely how covid 19 spreads. https://t.co/k48V3yOEyX,,Australia,Wed Apr 28 05:25:10 +0000 2021
1387280281090990080,negative,0.9550706148147584,-0.4055607616901397,2.073106288909912,What really is going on with Covid and how our governments are controlling us? It’s no longer kooky conspiracy theories for me. Having the world shut down and seeing how far you can push the peasants has been very successful. Why is Wesfarmers involved with WEF? Read up people https://t.co/cdJdMzBEsp,,Australia,Wed Apr 28 05:39:28 +0000 2021
1387283028003606529,neutral,1.8458651304244995,1.1328246593475342,0.1486208438873291,watch this space over the next couple of days kassi 😎 https://t.co/sa3VOn1j6x,,Australia,Wed Apr 28 05:50:23 +0000 2021
1387284165427535876,positive,0.9047936797142028,1.1419715881347656,0.7966927886009216,Compendium of legal responses to #Covid_19 seems like a very useful resource. #law #pandemic #health #HumanRights https://t.co/rV6WAIlW51,"Covid_19, law, pandemic, health, HumanRights",Australia,Wed Apr 28 05:54:54 +0000 2021
1387270582731874304,neutral,1.3485280275344849,-0.1001691445708274,0.6873279809951782,"The ‘rona is sorted in Daly Waters, NT https://t.co/2MeqnA4HEt",,Australia,Wed Apr 28 05:00:55 +0000 2021
1387271930890252289,neutral,1.9977939128875728,1.097449541091919,0.0515546947717666,"The Senate Select Committee on COVID-19 should be seeking the nursing voice as a matter of course, especially in relation to the vaccine rollout. Read our press release: https://t.co/M3ruZOZIlk 
@acn_tweet @Nikdjoh",,Australia,Wed Apr 28 05:06:17 +0000 2021
1387289576180359168,negative,0.9392090439796448,-0.3398354351520538,1.17146098613739,@WHO so many Indians cannot afford 600 rupees for vaccines! @tnatw,,Australia,Wed Apr 28 06:16:24 +0000 2021
1387290144437276674,neutral,1.0859349966049194,0.5374591946601868,-0.0591500252485275,As you do. https://t.co/TuWvW6Pzxn,,Australia,Wed Apr 28 06:18:39 +0000 2021
1387290312679202820,negative,0.7842881083488464,-0.4289099872112274,2.107879400253296,"@ASpeedingCar Having just gone through this, it's disheartening. And we can't re-issue accessories due to COVID-19, so are buying new of everything.",,Australia,Wed Apr 28 06:19:19 +0000 2021
1387292376922685443,neutral,2.0839102268218994,1.5108388662338257,0.290116012096405,"There was an address from the Prime Minister, Hon @ScottMorrisonMP who provided a thorough update on the Government’s rollout of the COVID-19 vaccine. The forum provided community with an opportunity to provide feedback.",,Australia,Wed Apr 28 06:27:31 +0000 2021
1387294180905426947,neutral,2.4286787509918213,0.3567580580711365,0.2792622745037079,Staff plastering the mail box with their covid check in dots on the way out. Unfortunate position of the post box https://t.co/DVGmk4h3xc,,Australia,Wed Apr 28 06:34:42 +0000 2021
1387294407427190788,positive,1.2469290494918823,1.257233738899231,0.3658392429351806,Late but Important. Having a Tetanus or Mararlaria Shot feels like a punch in the arm.  Good for you  Brittany ✋💞  High Five https://t.co/56lYHv0gA2,,Australia,Wed Apr 28 06:35:36 +0000 2021
1387297786748489728,negative,1.272467017173767,-0.5120452046394348,1.8216538429260252,"@elonmusk can u help with the Indian COVID19 situation. 

CureVac with vaccines 💉 
Tesla Ventilator Prototype 

 https://t.co/YuvLIHqPW5 

@kkvr2823 @meckimac @shawn_bissell https://t.co/H6iFjKdxRa",,Australia,Wed Apr 28 06:49:01 +0000 2021
1387300270846083074,positive,0.9261232018470764,2.6504273414611816,-0.1803941428661346,"Books bringing happiness:
Camel delivers books to Pakistan’s desert children amid Covid school clo... https://t.co/hAYYMwJeiK #Books #Literacy #Libraries https://t.co/u3DXgwMajz","Books, Literacy, Libraries",Australia,Wed Apr 28 06:58:54 +0000 2021
1387286417349386240,neutral,1.7369328737258911,0.2543939054012298,0.8633726835250854,"WA has recorded four days in a row of ZERO community transmission #COVID19 cases.
4 coronavirus cases have been recorded in hotel #Quarantine. https://t.co/12S1y2XYqh","COVID19, Quarantine",Australia,Wed Apr 28 06:03:51 +0000 2021
1387290240440696832,negative,1.3801153898239136,-0.8066871762275696,2.13051176071167,"India: Narendra Modi’s Bharatiya Janata Party (BJP) are holding political rallies to drum up support ahead of municipal elections despite a devastating second wave of coronavirus gripping the country.

https://t.co/wp5XiGzJ9W",,Australia,Wed Apr 28 06:19:02 +0000 2021
1387293739035500546,negative,0.4212166368961334,-0.6302902698516846,2.327742099761963,@itsArnaBack @coreynorris9 @9NewsMelb Surprised not given him shit yet for how wearing mask 🤣🤣,,Australia,Wed Apr 28 06:32:56 +0000 2021
1387287283984846850,negative,1.6426231861114502,-0.7047911286354065,1.9626505374908447,Turns out if you are going to the basketball in the US you can get a vaccine but not if you work in aged or disability care in Australia. https://t.co/NaM2EjaDP4,,Australia,Wed Apr 28 06:07:17 +0000 2021
1387291050025181184,positive,0.5435745120048523,1.5258097648620603,-0.0614078268408775,"It's ok healthy people should get the vaccine, it's safe! https://t.co/ZE5Qok5ZFX",,Australia,Wed Apr 28 06:22:15 +0000 2021
1387294566487711744,negative,0.996901273727417,0.4520089030265808,1.0702416896820068,"@JasonJMurdoch @StephenMcDonell Short term, corrective action but goal is to vaccinate all including world..lot of vaccine shortage and had a tough time to get 2 doses at the top Apollo hospital in Madurai.. but got it.. https://t.co/9i01ndlhJY",,Australia,Wed Apr 28 06:36:13 +0000 2021
1387301864270491649,neutral,1.775989055633545,-0.4529174268245697,1.2567566633224487,"@abirballan He left the main one out...

Why in the world would anyone wear a mask",,Australia,Wed Apr 28 07:05:13 +0000 2021
1387305748724551683,positive,1.912260055541992,2.062896728515625,-0.5339729189872742,"Thoughts for my family, friends and colleagues in India 🇮🇳 .  #StaySafeIndia https://t.co/OGJV2YE1Ev",StaySafeIndia,Australia,Wed Apr 28 07:20:40 +0000 2021
1387308060230643715,positive,0.7255218029022217,1.6544920206069946,0.6310777068138123,".@POTUS @KamalaHarris, the world is calling on you to suspend the #patents and share the science, so that more countries can produce the life-saving @Pfizer @JNJNews &amp; @moderna_tx #COVID19 #vaccines. Everyone deserves a fair shot! #PeoplesVaccine https://t.co/1h8R16JY6R","patents, COVID19, vaccines, PeoplesVaccine",Australia,Wed Apr 28 07:29:51 +0000 2021
1387311872903286786,neutral,1.4264469146728516,0.5190870761871338,-0.0472205802798271,Choosing safer activities by CDC🦠 https://t.co/GYu1XJyMen,,Australia,Wed Apr 28 07:45:00 +0000 2021
1387312534022025219,positive,1.0568549633026123,1.7692480087280271,-0.2302321344614029,"@the_RMT Actually, the horses created a magical COVID safe shield.",,Australia,Wed Apr 28 07:47:37 +0000 2021
1387319631572967426,positive,0.4530285000801086,3.933004856109619,-0.670877993106842,Thanks for finding this gem @pdjewell @westernsydneyu #WesternSydneyU https://t.co/vYS0PfV7Zn,WesternSydneyU,Australia,Wed Apr 28 08:15:49 +0000 2021
1387320306549673989,neutral,0.8137241005897522,0.4889982044696808,0.1782200336456298,#covid #aerosol transmission https://t.co/nLMlHpuv3f,"covid, aerosol",Australia,Wed Apr 28 08:18:30 +0000 2021
1387322353114255361,negative,1.1706326007843018,-0.8302556276321411,1.994213819503784,@Naveen_Odisha why dont you stop liquor shops till COVID spread is minimized? https://t.co/WE2jxtwXHN,,Australia,Wed Apr 28 08:26:38 +0000 2021
1387325520522530817,negative,1.4554351568222046,-0.747848629951477,1.5275548696517944,Anyone thought about Covid-19 vaccines passing the drug tests?? @Tokyo2020 @LizzyLegsEllis,,Australia,Wed Apr 28 08:39:14 +0000 2021
1387325632955043842,neutral,1.4329900741577148,0.5943494439125061,0.4469529092311859,"When your prop clock disappears... As they say, timing is everything in live TV. #tickticktick ⏰ https://t.co/KzWjauiedD",tickticktick,Australia,Wed Apr 28 08:39:40 +0000 2021
1387325855001579523,positive,1.7423577308654783,6.142376899719238,-1.460921287536621,"Great to see our article out 👇🏾 Thanks again to editors - Professors  @thalia_anthony &amp; @LoranaBartels &amp; also @elbowlass for her helpful comments!
Always great to work with @LyttleStorrod &amp; @hannah_klose96 https://t.co/knoyAhJjXk",,Australia,Wed Apr 28 08:40:33 +0000 2021
1387327481196150784,positive,1.498603582382202,4.53976583480835,-0.5393277406692505,Wow 12 months since the #raceatyourplace campaign was released in response to COVID-19 halting Brisbane’s 2020 winter carnival... How good that the bounce back to our best winter carnival yet is on the horizon! #qldisracing #brisbanewintercarnival https://t.co/v2x4YQbchk,"raceatyourplace, qldisracing, brisbanewintercarnival",Australia,Wed Apr 28 08:47:01 +0000 2021
1387328050216374276,positive,1.3217933177947998,5.087489128112793,-0.8593862652778625,We’re excited to support the @ASImmunology International @DayofImmunology public lecture on COVID-19 vaccines. Sign up to this engaging online event hosted by @DrShaneRRR: https://t.co/1jG1DVemtP #DoImmuno #COVID19 #COVID_19 #DayofImmunology #SciComm https://t.co/z3aszNoLv9,"DoImmuno, COVID19, COVID_19, DayofImmunology, SciComm",Australia,Wed Apr 28 08:49:17 +0000 2021
1387328282220064771,positive,0.7369765639305115,4.332713127136231,-0.5819789171218872,We’re excited to support the @ASImmunology’s International @DayofImmunology public lecture on COVID-19 vaccines. Learn how vaccines work from the experts. Book here: https://t.co/A3ZevDxugz #DoImmuno #COVID19 #COVID_19 #DayofImmunology #SciComm,"DoImmuno, COVID19, COVID_19, DayofImmunology, SciComm",Australia,Wed Apr 28 08:50:12 +0000 2021
1387326847139008515,neutral,1.721010446548462,-0.4993868172168731,1.1483489274978638,"‘Bizarre’ vaccine decisions questioned, as two million jabs given | The New Daily https://t.co/9BXN9StTyW",,Australia,Wed Apr 28 08:44:30 +0000 2021
1387319569333645316,neutral,1.9306013584136963,-0.1851924359798431,0.675468385219574,@coreynorris9 @9NewsMelb Someone needs to tell Dustin to either wear his mask properly or not at all.,,Australia,Wed Apr 28 08:15:35 +0000 2021
1387324910981181441,neutral,1.9964289665222168,0.2372594773769378,0.2185407131910324,@ricklyon Sharon O'Neil coming out of retirement to rework Maxine into Vaccine,,Australia,Wed Apr 28 08:36:48 +0000 2021
1387328685779292160,negative,1.3317573070526123,-1.5094531774520874,3.922025680541992,"All Countries have fools, idiots &amp; fear mongers ""We must Protect Our Border's"" Sadly it's about those who are seeking Asylum. So Racism. But when real danger came to the UK🇬🇧as a Virus. Why didn't the Gov. worry about it's Borders &amp; Citizens. You're a Island. Lockdown them.
 #UK https://t.co/YpxCQ4O4S0",UK,Australia,Wed Apr 28 08:51:48 +0000 2021
1387330762064551938,negative,0.9936959743499756,-0.0170912072062492,1.5821319818496704,Whilst acknowledging the immense difficulty and significant cost of the Covid pandemic for many arts organisations I must publicly express my sadness that this company which not so long ago used to have a number of singers on salary will instead have none. https://t.co/9EdlHaUIdI,,Australia,Wed Apr 28 09:00:03 +0000 2021
1387339864350224385,neutral,2.030025005340576,0.5257152318954468,0.2320870608091354,Just look at what is happening in India.😳 https://t.co/ClexopdXeo,,Australia,Wed Apr 28 09:36:13 +0000 2021
1387340275668832263,negative,0.4852301180362701,1.0726125240325928,2.325927972793579,Fucking whinging cricketers and expats in COVID stricken India. Happy to take the money. Not happy to give back.   Petals. Grow a pair!!! HELP don’t flee. 🤬🤬🤬 https://t.co/hT2Q8HGn85,,Australia,Wed Apr 28 09:37:51 +0000 2021
1387341080056659970,neutral,1.4787418842315674,0.4603856205940246,-0.1976270228624344,"@CathMurphySport Overseas, during a pandemic.",,Australia,Wed Apr 28 09:41:03 +0000 2021
1387342108479066123,positive,0.408780425786972,1.6183825731277466,-0.3303219079971313,Good question.😳 https://t.co/ARPFeAcfMJ,,Australia,Wed Apr 28 09:45:08 +0000 2021
1387342877458636800,negative,1.0991034507751465,-1.4582719802856443,4.043067455291748,@thereclaimparty @WadeGTaylor Yes politicians know they should never have forced democratic countries into a communist policy &amp; personal creation of President Xi Jinping- LOCKDOWNS in stupid blind faith there was an actual pandemic in Wuhan. THERE WASNT. It’s called ‘ saving face’. Go to @MichaelPSenger 🇺🇸,,Australia,Wed Apr 28 09:48:12 +0000 2021
1387344860412321796,neutral,1.1959782838821411,0.4521351456642151,0.9770723581314088,Is Duterte's strategy for combatting COVID just an endless series of lockdowns of varying intensity? 2022 cannot come soon enough.,,Australia,Wed Apr 28 09:56:05 +0000 2021
1387333133222105094,positive,0.4517071843147278,0.8202306628227234,0.5762563347816467,@gr4ceL4nd @drbrainhacker Agree 100%. Helps with surgical mask fit too.,,Australia,Wed Apr 28 09:09:29 +0000 2021
1387346113301147651,neutral,1.3373414278030396,0.6822631359100342,0.5397940278053284,"Covid has highlighted the weaknesses of a lot of countries. From their leaders, their health systems and the willingness of people to cooperate.😳 https://t.co/VI3EHT8J3D",,Australia,Wed Apr 28 10:01:03 +0000 2021
1387346673194602496,positive,1.309957504272461,1.4174737930297852,0.0866077989339828,"@HagenFromHobart @rdhinds @leachitup He’s left the country, in-season, in a pandemic. That’s news.",,Australia,Wed Apr 28 10:03:17 +0000 2021
1387347130235252741,neutral,2.0389404296875,1.699330449104309,0.2555401027202606,"At Queensland’s Children’s Hospital today, our HEAL team engaged consumers and staff in a conversation about what a healing environment looks like - COVID has restructured face/to/face activities, so our pivot to a ‘market stall’ approach https://t.co/O23N3IjEcM",,Australia,Wed Apr 28 10:05:06 +0000 2021
1387348443283083267,positive,1.3119337558746338,1.4511715173721311,0.3780161440372467,"@rdhinds @leachitup I don’t see there being an inference that it is scandalous, but I get where you’re coming from. I just think the league’s best player heading overseas during a pandemic is news.",,Australia,Wed Apr 28 10:10:19 +0000 2021
1387350904706277376,negative,0.33553346991539,1.114687442779541,1.3321638107299805,"IN INDIA THEY HAVE A NEW STRAIN OF COVID-19!

YOU COULD LAUGH @ A COMMENT LIKE, INDIA HAS A ""NEW 'STRAIN' OF PILES"", EXCEPT THAT IT ISN'T REALLY FUNNY!

BODIES BY THE HUNDREDS OR THOUSANDS ARE ""PILING-UP @ THE CREMATION SITES!

I CAN'T SEE THAT THE INDIAN COVID WILL BE OVER SOON",,Australia,Wed Apr 28 10:20:06 +0000 2021
1387352213706575873,negative,1.176204800605774,-1.1961132287979126,2.672290563583374,"@rdhinds @leachitup Yes, because this pandemic has been eminently predictable and hasn’t ended up causing issues at short notice for people away from home.",,Australia,Wed Apr 28 10:25:18 +0000 2021
1387353360685146113,positive,1.399343967437744,2.274430751800537,-0.2725400626659393,"@hozinoz @Ianrob12 I was able to say goodbye before she passed, &amp; the last time I saw her before COVID she opened her eyes, smiled at me &amp; said “I love you”.  Someone loves you too Hoz, likely many someones. Hold onto that when it seems dark.",,Australia,Wed Apr 28 10:29:51 +0000 2021
1387354461081772033,negative,0.8709523677825928,-1.106378197669983,3.761529684066773,This demonstrates your lack of knowledge and understanding The authors are avid anti Israel activists. They have redefined apartheid in this document.Why not focus on the real persecutors of the #palestinains. The corrupt #pa and the terror org #hamas. Always pick the wrong side https://t.co/tAhnVBebfO,"palestinains, pa, hamas",Australia,Wed Apr 28 10:34:13 +0000 2021
1387358457703985156,negative,1.5888172388076782,-1.1655396223068235,2.901427984237671,@smh did you fact check this outrageously incorrect document before printing its claims. @MehreenFaruqi you should educate yourself before making slanderous accusations https://t.co/tAhnVBebfO,,Australia,Wed Apr 28 10:50:06 +0000 2021
1387360026579259392,negative,0.5098221302032471,-1.4343894720077517,4.429343223571777,https://t.co/T8rMoariQ1 7yrs jail is a bloody joke @MarkMcGowanMP his child grows up without a dad and be out of jail before leaving school All killer's should be given life without parole shame your justice system isn't as tough as your #COVID19 plan #BBAU #MasterChefAU #Perth,"COVID19, BBAU, MasterChefAU, Perth",Australia,Wed Apr 28 10:56:20 +0000 2021
1387360913091555329,negative,0.8566094040870667,0.2889921963214874,1.9836283922195437,"I just contributed to GiveIndia in the spirit of #Giving https://t.co/5u1yAHOriZ via @giveindia 

The news is devastating me, if anybody wants to donate please do. Anything and everything counts.",Giving,Australia,Wed Apr 28 10:59:52 +0000 2021
1387357382615855104,negative,1.5353127717971802,-1.3286131620407104,3.1217904090881348,"@JenScheffelHI @mkraju What piece of legislation has he passed that they find particularly abhorrent?? Tell the arseholes he has only transitioned one piece - the ‘coronavirus relief and government funding bill’, which most people agreed was required.

If and when what Fox warns happens then abuse him.",,Australia,Wed Apr 28 10:45:50 +0000 2021
1387360575424921600,negative,0.8464934825897217,-0.5890260934829712,2.4459848403930664,@humanist_i @UrHuckleberry @nypost Just like your profile name you might be a virus!! Noooo I don’t like viruses,,Australia,Wed Apr 28 10:58:31 +0000 2021
1387636799929872385,neutral,1.3241935968399048,0.6466245055198669,0.5627260208129883,"“...We must speak up for what’s right, even if it’s not popular.” https://t.co/nQFiaUMKFc",,Australia,Thu Apr 29 05:16:08 +0000 2021
1387637163316023299,positive,0.2166093736886978,3.357635498046875,-0.4656174778938293,Thank you for being the courageous voice of integrity Tarang. @tarang_chawla https://t.co/sabub1lksT,,Australia,Thu Apr 29 05:17:35 +0000 2021
1387638212743426049,neutral,1.482198715209961,0.0403274372220039,0.3264996111392975,Strange things have sprung up since #lockdown began https://t.co/bk6YyAmKqq,lockdown,Australia,Thu Apr 29 05:21:45 +0000 2021
1387639970387529729,negative,0.958179771900177,-0.3832571506500244,3.308998107910156,@VictorianCHO Here’s some actual authoritative advice for you from a man that makes your credentials look PITIFUL. Dr Wolfgang Wodarg You’re a bald faced complicit liar. End this Covid Charade - the stairs are coming for you 🤥😉🇦🇺https://t.co/2cZQjMS1vK,,Australia,Thu Apr 29 05:28:44 +0000 2021
1387643405707005955,negative,1.573815107345581,-1.2003045082092283,2.893989086151123,"@VirginAustralia ensure your Perth Airport staff are up to date with their Covid19 restrictions for QLD. They just made an announcement causing stress and unnecessary panic. https://t.co/isLaR6R7eT
Please do not reply.",,Australia,Thu Apr 29 05:42:23 +0000 2021
1387646493083848706,negative,0.8550712466239929,-0.625251293182373,1.827263116836548,Thankfully there is no where in Australia you can't drive to... https://t.co/EACsX0LQKh,,Australia,Thu Apr 29 05:54:39 +0000 2021
