Tweet_ID,Sentiment_Label,Logits_Neutral,Logits_Positive,Logits_Negative,Tweet_text,hashtags,country,created_at
1386559048443514883,neutral,1.106899976730347,0.538112223148346,0.2453723698854446,Metaphor for so many Twitter accounts. https://t.co/osruIPQnfH,,Australia,Mon Apr 26 05:53:32 +0000 2021
1386559502091100162,negative,1.2635676860809326,-0.2912677824497223,1.783265471458435,"@MargMcCrohon @MarilynMab2 I don't think I'm special.😊
During the big lockdown here in Melbourne last year they held a party. I didn't know, but another neighbour told me. Apparently the police were called.",,Australia,Mon Apr 26 05:55:20 +0000 2021
1386560383784161287,negative,1.4027765989303589,-1.3531159162521362,3.424060344696045,"@TMFScottP You can look at India with despair and grave concern and still believe lockdown in Australia for next to no cases is an extremely poor policy approach that causes untold misery for many people. 

They are not mutually exclusive positions.",,Australia,Mon Apr 26 05:58:51 +0000 2021
1386546692640497666,neutral,2.0869736671447754,-0.246698260307312,0.6870771646499634,Perth lockdown to end midnight Monday as no new community cases recorded - ABC News https://t.co/jHsNAUPac1,,Australia,Mon Apr 26 05:04:26 +0000 2021
1386548876895657984,neutral,1.1364872455596924,0.1200824677944183,-0.2095625251531601,Data from https://t.co/ogQnHqOTwv,,Australia,Mon Apr 26 05:13:07 +0000 2021
1386547353646075907,negative,1.6191233396530151,-1.4637250900268557,4.094119071960449,Do news outlets deliberately send their most idiotic journalists and instruct them to ask ridiculous hypothetical questions? Or is this just a coincidence from every Covid press conference ever?,,Australia,Mon Apr 26 05:07:04 +0000 2021
1386550481040728066,negative,0.4559869170188904,0.7262481451034546,1.78418231010437,@FoxNews Alone vaccine drive in first 100 days is better than 4 years of trump bullshit! Let’s not forget about bleach injections and ultra violet rays killing covid! I mean that sums up his intelligence 🤣🤣🤣!! Think Lindsey Graham was impressed by his covid solutions!,,Australia,Mon Apr 26 05:19:30 +0000 2021
1386552034023788545,positive,0.7325847744941711,1.160689353942871,0.3102151155471802,@suzihands @newscomauHQ Plus we are practically covid free!,,Australia,Mon Apr 26 05:25:40 +0000 2021
1386558966499450882,negative,1.018527865409851,-0.4995599091053009,2.18041467666626,@DonnieMountjoy @leighsales @MarkMcGowanMP Let’s not forget the Ruby Princess debacle. When NSW allowed Covid into Australia and then sent it on it way state wide.,,Australia,Mon Apr 26 05:53:13 +0000 2021
1386546815307112452,neutral,2.3115813732147217,0.3031667470932007,-0.0876228511333465,Is derby going on Sunday half crowd I think with mask or without?,,Australia,Mon Apr 26 05:04:56 +0000 2021
1386558301383512066,negative,0.525181770324707,0.6950905919075012,2.16906476020813,"So....gonna have to wear a mask whilst outside until Saturday even though we don’t have community transmissions. 

Yeah that makes sense hey? 

🤦🏽🤦🏽🤦🏽

Absolutely ridiculous. Would love to see the health advice behind this. 

#perthlockdown #perthnews #wqpol #auspol","perthlockdown, perthnews, wqpol, auspol",Australia,Mon Apr 26 05:50:34 +0000 2021
1386561430715965446,positive,1.119243621826172,1.1264774799346924,0.8557355403900146,"Check the drop of active cases in the Philippines the past week. Only a miracle cure could make this drastic steep drop believable. While stories on the ground reveal the true picture of the pandemic, the government is busy playing with numbers. #COVID19PH #DutertePalpak https://t.co/fXIENNo1Bs","COVID19PH, DutertePalpak",Australia,Mon Apr 26 06:03:00 +0000 2021
1386561727546810368,negative,1.4793689250946045,-0.3066953420639038,1.9122501611709597,Cricketers in India filling their coffers at the risk of bringing back new strains of COVID-19 to Australia. Mc Gowan nailed it when he said Cricket is not essential he also said as long as we have returnees coming back to Australia we run the risk of outbreaks.This in our 2nd yr,,Australia,Mon Apr 26 06:04:11 +0000 2021
1386562242041114629,positive,0.9213948845863342,1.46369206905365,0.3233058154582977,@smh @LisaVisentin Chernobyl and Covid two great disasters: the two greatest cover-ups.,,Australia,Mon Apr 26 06:06:14 +0000 2021
1386563616074178565,neutral,3.3542349338531494,-0.9940783381462096,0.961181938648224,@SAPoliceNews Will the cross border travel restrictions be updated following the end of lockdown in WA at midnight? Is travel for work allowed?,,Australia,Mon Apr 26 06:11:41 +0000 2021
1386563840683380737,neutral,2.40250825881958,1.6570003032684326,-0.2182912677526474,"To keep in front of the endless variants to come we’ll have to shoot up every three months (for a decade). 

Prefer my chances with COVID. https://t.co/P6vWvjN1d3",,Australia,Mon Apr 26 06:12:35 +0000 2021
1386563977073754115,neutral,1.4922741651535034,-0.7845397591590881,1.3395435810089111,@funder Not yet but we have almost zero covid cases here in Australia.,,Australia,Mon Apr 26 06:13:07 +0000 2021
1386564121567449091,negative,1.7620025873184204,-0.888964056968689,2.2370829582214355,"Time to let anyone OUT who wants to go to accepting countries, and concentrate on securing the borders against infection entering. Immunised and negative-tested only allowed to enter, and most of those to quarantine,either at home or in a camp. No HQ. https://t.co/6v056pZDRV",,Australia,Mon Apr 26 06:13:42 +0000 2021
1386564197962579969,negative,1.3663702011108398,-0.8191338181495667,3.0031704902648926,You can’t go to a wedding? So be it. You can’t go to a funeral? So be it. So says Premier of WA. So how come a person was permitted to go to India allegedly to get married then return with COVID-19 causing hotel quarantine break out and  lock down in WA. It’s a joke.,,Australia,Mon Apr 26 06:14:00 +0000 2021
1386565407750819844,neutral,1.4563424587249756,-0.1696887016296386,1.4024378061294556,"And even this tony lockdown came to an end.
Just follow the rules and be safe out there. @9NewsPerth @perthnow @coastfmlive @tweetmandurah @CityofMandurah https://t.co/In0DpgoOzI",,Australia,Mon Apr 26 06:18:49 +0000 2021
1386567316750561281,negative,1.2302576303482056,-0.1919387280941009,2.80106258392334,"I spent my 3 day lockdown in #Perth building my online photography store. 

I’ve been procrastinating &amp; making excuses not to for about a year now. 🤦🏽‍♀️

So check out my website if you want to buy a print.

#photography #shoponline #WesternAustralia 

https://t.co/zyImfbQNyK https://t.co/CkMW5NrvlY","Perth, photography, shoponline, WesternAustralia",Australia,Mon Apr 26 06:26:24 +0000 2021
1386568322930528256,negative,1.1429980993270874,-0.059718944132328,1.1969112157821655,"Way to much of substance abuse from Creighton,I think he needs to go to rehab https://t.co/CUybcjx7D8",,Australia,Mon Apr 26 06:30:24 +0000 2021
1386568338176835586,neutral,1.7363680601119995,-0.0514381751418113,1.5128023624420166,"@mattloughnan1 Hi Matt 

The ticketek fee is a cost of serving for Covid tracking imposed by ticketek.  Unfortunately out of the club’s control.  

Tickets can be purchased at the ground but will still attract that fee.  

@Cronulla_Sharks have reduced ticket prices this year to compensate.",,Australia,Mon Apr 26 06:30:27 +0000 2021
1386568386855858178,positive,2.2545981407165527,3.1292147636413574,-0.7580456137657166,"I built my photography online shop in lockdown &amp; yes I’m retweeting my own tweet.

Happy Lockdown Lifting Perth 👍🏽

#perth #photography #vlwphotography #CelebratingLockdown #NewShop https://t.co/l14jPwp8Qg","perth, photography, vlwphotography, CelebratingLockdown, NewShop",Australia,Mon Apr 26 06:30:39 +0000 2021
1386570378273714177,neutral,1.7575854063034058,0.2993496358394623,0.5701004266738892,"@goodfoodgal Bear this in mind when the same crowd are telling us to lockdown, wear masks, hide behind Perspex screens &amp; antisocial distance",,Australia,Mon Apr 26 06:38:34 +0000 2021
1386573393118457856,neutral,2.206246852874756,-0.1576837003231048,1.069783329963684,Hi @SAHealth I know you’re busy but please can you answer my previously asked question: why is there now no daily vaccinations number on this dashboard? https://t.co/p2wxXl32rZ,,Australia,Mon Apr 26 06:50:32 +0000 2021
1386573486995378179,negative,1.338127613067627,-0.4947739541530609,1.6916950941085815,"@Hadfickla @leighsales Some people don't seem to understand the precautionary principle, safety first? Should we not lock down, let it rip for a few days before having to lockdown harder and longer? I'd hope not.",,Australia,Mon Apr 26 06:50:55 +0000 2021
1386573805204623362,positive,2.034379243850708,3.433929681777954,-0.1688272356986999,"Ok guys I’ve got food for you!

Great platform for home chefs/small biz to offer their services where really needed and for those in distress to find their next meals. 

Please RT/amplify

#COVID19India #Covid19IndiaHelp #IndiaFightsCOVID19 #CovidIndiaInfo #indianfood https://t.co/q83J5VACxh","COVID19India, Covid19IndiaHelp, IndiaFightsCOVID19, CovidIndiaInfo, indianfood",Australia,Mon Apr 26 06:52:11 +0000 2021
1386573812498534400,neutral,3.7986557483673096,3.2261924743652344,-0.9627497792243958,"‼️ ATTENTION ‼️ 

Amazing photoshoot with Chris Jenson from married at first site @MAFSLifetime 

📸 Book now 
#sexworker #PhotoOfTheDay #photoshoot #pornstar #escorts #brisbane #photographer #sexindustry #pornstars #modeling #sexparty #playboy #onlyfans #COVID19 #nude #sex https://t.co/7X3UKIUgZB","sexworker, PhotoOfTheDay, photoshoot, pornstar, escorts, brisbane, photographer, sexindustry, pornstars, modeling, sexparty, playboy, onlyfans, COVID19, nude, sex",Australia,Mon Apr 26 06:52:12 +0000 2021
1386572735640268801,negative,1.6928056478500366,-0.6957424283027649,2.185708522796631,"How can someone explain this ? 🤷‍♂️

The veterans who fought for our country were locked out the Shrine of Remembrance because of #COVID #coronavirus #COVID19, but there was 78,113 people at the MCG and not social distancing 🤦‍♂️ #AnzacDay2021   #AnzacDay #AFL   #AFLPiesDons https://t.co/BkrdY3KPHW","COVID, coronavirus, COVID19, AnzacDay2021, AnzacDay, AFL, AFLPiesDons",Australia,Mon Apr 26 06:47:56 +0000 2021
1386565336284078080,negative,1.6205201148986816,-0.913949191570282,1.862479567527771,"The man's a cancer on intelligence - Facebook removes Craig Kelly's page, says former Liberal MP breached misinformation policies https://t.co/KMfjLdvRKg",,Australia,Mon Apr 26 06:18:31 +0000 2021
1386572320924266496,negative,1.228786587715149,-0.252833604812622,1.5423996448516846,@DianahA73546643 Each state didn't have much choice after the Feds Covid-Safe clusterfrack. From what I can tell most of them work quite well with little drama.,,Australia,Mon Apr 26 06:46:17 +0000 2021
1386570088648626176,neutral,1.8340132236480715,-0.0371450707316398,-0.0920571386814117,@handonthepulse While mask restrictions are in place,,Australia,Mon Apr 26 06:37:25 +0000 2021
1386576711681155072,positive,0.5103186964988708,0.9643995761871338,0.0746113434433937,Sounds family... https://t.co/y4JshjDqaS,,Australia,Mon Apr 26 07:03:44 +0000 2021
1386576999783694338,neutral,1.8492616415023804,-0.5488876700401306,1.7632226943969729,We were 100% correct in locking down pending this outbreak but it didn’t happen?? 1 guy in a restaurant was infected while everyone else wasn’t?? We need to explore what’s going on in Perth population to allow such minimal transfer. @normanswan,,Australia,Mon Apr 26 07:04:52 +0000 2021
1386577000949719044,positive,1.6086244583129885,2.8523757457733154,-0.7422909736633301,"Well done WA, you got tested, wore your masks and used the app, which means we'll come out the other side of this lockdown with confidence. Stay safe friends!",,Australia,Mon Apr 26 07:04:53 +0000 2021
1386579869434216448,negative,0.359072595834732,0.4426439106464386,1.2834203243255615,"This month has not been nice to me. Just had to get COVID tested. My health has never been this bad before, I can’t sit up in my bed 😔",,Australia,Mon Apr 26 07:16:16 +0000 2021
1386580417088659457,positive,0.3256185054779053,1.4989569187164309,-0.0702721327543258,So good. 😂😂 https://t.co/aPBhtT0i2R,,Australia,Mon Apr 26 07:18:27 +0000 2021
1386582709066104839,negative,1.0510737895965576,-0.6495673060417175,2.5761425495147705,"@StenHelmfrid IMO - #ME is not the infectious trigger.
#ME &amp; #Long Covid are the post viral sequelae. They are the result of a viral trigger.","ME, ME, Long",Australia,Mon Apr 26 07:27:33 +0000 2021
1386582778326650880,negative,1.5971543788909912,-0.4111717045307159,1.6625419855117798,"@starppael @leighsales If a city or state has to go for a short lockdown for 1 case, then those who designed and implemented the system should be out of work. Not worth the ROI.  NSW has a legacy contact tracing system &amp; they trust it a bit more than WA or Vic.",,Australia,Mon Apr 26 07:27:50 +0000 2021
1386586437252902913,negative,0.7904306054115295,-0.2469083070755005,3.0987389087677,"We’re seeing terrible scenes on tv news here in Australia. The government meets tomorrow to see how much help we can send - probably oxygen and ventilators. We will almost certainly close the borders to flights from India as well, but I’m sure people can see the reason for that. https://t.co/aMPar1QZQy",,Australia,Mon Apr 26 07:42:22 +0000 2021
1386589824019095552,negative,0.9611451625823976,0.8158013224601746,1.112421989440918,"Prestart : “No, you are not going home. You stay here forever.” 
Terus td : “ I booked you for 15 months” 🤣🤣
Buseeet Chef. Awak kapan pindah statenyaa 😅",,Australia,Mon Apr 26 07:55:50 +0000 2021
1386590009709367303,neutral,1.4889642000198364,-0.6368591785430908,1.443181395530701,So is @leighsales following the @newscorpaus line here or still aggrieved because she got caught in a lockdown. @abc730 #auspol https://t.co/KCRiqCXi5O,auspol,Australia,Mon Apr 26 07:56:34 +0000 2021
1386579666161442818,negative,1.2556297779083252,-0.828132688999176,2.379926919937134,"We're missing the point of ventilators - by opening nasal  valves , they allow oxygen - the O2 molecule which tells our brain and body what to do to eject the virus. 
Inflammant. 

https://t.co/1HQDrcqipK",,Australia,Mon Apr 26 07:15:28 +0000 2021
1386578297518137345,negative,1.3883012533187866,-0.1789764761924743,1.5862807035446167,@C_Wint50 @SAHealth the pre flight test won't fully stop all covid cases coming in. As it can take anywhere from 5-14 days after exposure to become positive that's why quarantine is 14 days. Preflight tests are only required 72 hours prior.,,Australia,Mon Apr 26 07:10:02 +0000 2021
1386580707082858496,negative,0.9992732405662536,0.126378133893013,1.8196451663970947,@BenWoodSay @CatmanForever @GhostWhoVotes Fact. Not opinion. Indisputable - except by rusted-on LNP supporters.  Corruption is hidden better but the other two are plain for all to see. Examples of the latter: Stuart Robert. Angus Taylor. 103rd in world for vaccine. Fossil fuel subsidies. Murray-Darling. F35’s. China. etc,,Australia,Mon Apr 26 07:19:36 +0000 2021
1386580928869244929,negative,1.4225900173187256,-1.084674596786499,2.8253777027130127,@madnyc @VicGovDH The problem is 1a &amp; b are the ones who get it worse &amp; as vaccine doesn't stop you getting it or passing it on it you are just less likely to get it as bad or end up in hospital i'd rather they were all covered first before passing on to my stage.,,Australia,Mon Apr 26 07:20:29 +0000 2021
1386591710927495170,positive,0.7208159565925598,0.951996922492981,0.8987109661102295,"@muso1947 @Nigella_Lawson @NHSEnglandLDN @ucked Of course not but, the rest of the world needs to know we were best placed to beat the pandemic and failed thanks to Morrison.",,Australia,Mon Apr 26 08:03:20 +0000 2021
1386592000120479744,negative,1.4939032793045044,-0.9925543069839478,2.109707355499268,With no new cases was the WA lockdown actually needed? @CollignonPeter thinks not: https://t.co/etjX6yF4Uq by @CharisChang2 @newscomauHQ,,Australia,Mon Apr 26 08:04:29 +0000 2021
1386592869440393222,positive,2.5572502613067627,4.079037666320801,-1.1509017944335938,"One year ago today.

Pandemic had closed everything + we were 5 days away from opening our first retail outlet.

Huge thanks to @toga_group for the opportunity in the space, @Academybrand for helping us with stock + our handy man @rodneyboyce for the fit out 🙌🏻

@Pitt_anthony ❤️ https://t.co/NaxdsYlmUX",,Australia,Mon Apr 26 08:07:56 +0000 2021
1386593406068019204,negative,0.150522381067276,0.0361808016896247,1.5448375940322876,Sorry to say @TariqNaqash.. Yes! We are https://t.co/kxwGD4VUju,,Australia,Mon Apr 26 08:10:04 +0000 2021
1386593550280716291,positive,0.0982125252485275,1.9717596769332888,-0.0331534296274185,Good to go nowhere https://t.co/whK1ozxndE,,Australia,Mon Apr 26 08:10:38 +0000 2021
1386594545983393793,negative,1.0182212591171265,-1.2320271730422974,3.355872392654419,If we don't learn from history we're doomed to repeat it... https://t.co/uHRcIVC0n0,,Australia,Mon Apr 26 08:14:36 +0000 2021
1386594579365842951,positive,0.9493081569671632,3.505656242370605,-1.0258818864822388,Great to be part of this (only a small part). 👍👍 @bourne_digital https://t.co/8W4NYWZdal,,Australia,Mon Apr 26 08:14:44 +0000 2021
1386596285281562625,negative,1.07417631149292,-1.300474762916565,3.132127523422241,"Either ignorance or intentionally misleading. You can't ""boost"" your immune system but you CAN optimise it by improving your health. Was it an intentional misuse of terminology or just ignorance. Health is still the leading indicator of your likely outcome if infected by COVID. https://t.co/AIkVKvstV2",,Australia,Mon Apr 26 08:21:30 +0000 2021
1386598324761989120,positive,0.9405462741851808,0.9529337882995604,0.8673152327537537,"Really hoping they stay on their word! Help India (And Brazil). If I read right, they are now sending those raw materials?
Let's keep it up though, we are watching US, please don't double back or give false hope. I want to see the world helping all countries for once. https://t.co/fr68RCKLXB",,Australia,Mon Apr 26 08:29:37 +0000 2021
1386602488887877635,positive,0.4890199601650238,1.925625205039978,0.6679181456565857,@brockathome Can't agree more. BTW my profile picture was my very first flight the day after my 45th birthday. Old dogs are never to old to learn new tricks. Now I love flying. Can't wait to go OS once this Covid deal is sorted.,,Australia,Mon Apr 26 08:46:09 +0000 2021
1386603631269466112,negative,1.251322865486145,-0.6075730323791504,1.7538294792175293,Like the experts have been telling @ScottMorrisonMP to do for over a year.. https://t.co/9VM6fG2b6y,,Australia,Mon Apr 26 08:50:42 +0000 2021
1386605005084389376,positive,1.916451930999756,2.764348268508911,-0.615942120552063,Big week for the @EsportsHPC program with some major announcements coming! #esports #sportsbiz https://t.co/PGeMoDe7yC,"esports, sportsbiz",Australia,Mon Apr 26 08:56:09 +0000 2021
1386605424669958146,negative,0.7957212924957275,0.2295911908149719,2.841404914855957,It’s so sad to hear news surrounding the #Covid19 situation in #India. #IndiaNeedsOxygen &amp; hopefully international assistance is forthcoming from #Australia #UnitedKingdom #Japan #Germany #UnitedStates.,"Covid19, India, IndiaNeedsOxygen, Australia, UnitedKingdom, Japan, Germany, UnitedStates",Australia,Mon Apr 26 08:57:49 +0000 2021
1386605711207976961,positive,1.0164178609848022,1.1742358207702637,1.0892949104309082,I’m starting to freak out a little again about covid....... not helped by hearing about the people dying in the hospital by sister works in Vancouver........ we’re so lucky here in Australia.. for now 😕,,Australia,Mon Apr 26 08:58:58 +0000 2021
1386595434336948224,neutral,1.3068143129348757,-0.0143437981605529,0.947034239768982,@ABCthedrum no place is purpose built for COVID-19 why single out hotels,,Australia,Mon Apr 26 08:18:07 +0000 2021
1386595676616724482,neutral,1.7204904556274414,-0.6096109747886658,1.3096481561660769,@az_asx @Dockerman3 @GardenerMinOne @ClayGolledge Should a Victorian ever comment on any form of lockdown or Covid strategies? 🤔,,Australia,Mon Apr 26 08:19:05 +0000 2021
1386600467090739201,negative,1.402456521987915,-0.7108349204063416,1.769516110420227,"As it stands, there will be no mass exodus of Australians from #Ipl2021 but just how they will all get back into the country eventually remains clouded 

https://t.co/pMCw0suT4b",Ipl2021,Australia,Mon Apr 26 08:38:07 +0000 2021
1386600361096400897,positive,1.172373652458191,1.472740650177002,-0.0146591123193502,@theprojecttv it’s the vaccine that should be your focus !#accountability,accountability,Australia,Mon Apr 26 08:37:42 +0000 2021
1386606570440597504,negative,0.94036066532135,0.2609012722969055,1.1575132608413696,"Pandemic or no, I will happily take forward the habit of wiping down all gym equipment before and after with sanitiser for my own sake.... 

#COVID19Vic",COVID19Vic,Australia,Mon Apr 26 09:02:22 +0000 2021
1386608495294697477,negative,1.5362244844436646,-0.9984813332557678,2.636669158935547,"#thedrum ~ Federal responsibility was taken for quarantine originally:
Australians returning from Wuhan, China were quarantined on Christmas Island for two weeks before being cleared to come home to mainland Australia. To say Christmas Island is not equipped is false.",thedrum,Australia,Mon Apr 26 09:10:01 +0000 2021
1386609062146547717,negative,0.4456277191638946,0.8136557340621948,1.359180569648743,This is a great decision by Moderna... Shame Australia isn't listening. https://t.co/RaoHA5TAy5,,Australia,Mon Apr 26 09:12:17 +0000 2021
1386609212172554243,negative,0.9400643706321716,-0.2024910748004913,1.460485339164734,It’s never about scientific evidence; it’s all about controlling the people and their way of life. https://t.co/IumdGpXgYL,,Australia,Mon Apr 26 09:12:52 +0000 2021
1386613329309749248,negative,1.1537646055221558,-0.8869278430938721,1.8954291343688965,@thomaskaine5 We will never rid of Covid19 unless India is under control,,Australia,Mon Apr 26 09:29:14 +0000 2021
1386614121471250435,positive,1.7500077486038208,2.7637200355529785,-1.10992693901062,"Get well soon P'Tay @Tawan_V! 🙏🙏🙏
#GetWellSoonTayTawan https://t.co/ChiRrSdscZ",GetWellSoonTayTawan,Australia,Mon Apr 26 09:32:23 +0000 2021
1386615596054302724,negative,0.7605207562446594,0.1386975198984146,1.7352153062820437,"Not so great at seeing the bigger picture here.....

Lockdown doesn’t find extra cases.... it’s a safety net to prevent spread beyond what is known at the time of discovering the outbreak

Lockdown prevents those extra cases from ever existing, so of course you won’t find them 🤦🏻‍♀️ https://t.co/gcirOTQkhr",,Australia,Mon Apr 26 09:38:14 +0000 2021
1386616603240923141,neutral,1.8457235097885127,-1.0900964736938477,1.8158990144729612,This seems alarmingly late and a tad reactive.  Surely with India's situation known these actions should have been considered before a case showed up. https://t.co/zam9HX60OH,,Australia,Mon Apr 26 09:42:14 +0000 2021
1386618201895702530,positive,1.019464373588562,1.8092914819717407,0.0137182716280221,"No donation for PM Cares Fund? Well, Google knows the best... https://t.co/PGdQd0jamR",,Australia,Mon Apr 26 09:48:36 +0000 2021
1386619577618952196,negative,0.8714261651039124,0.1399979591369629,1.1004457473754885,"Mine is bugs bunny, winnie the poh and twity bird 

SSR Killed By Strangulation https://t.co/OqRlQJLbOz",,Australia,Mon Apr 26 09:54:04 +0000 2021
1386620400818262018,neutral,2.1959116458892822,1.7026734352111816,-0.0559400543570518,"Here to support each other warrior we stand together we are united 

SSR Killed By Strangulation https://t.co/TntFw7alon",,Australia,Mon Apr 26 09:57:20 +0000 2021
1386607323410358276,negative,0.7836306095123291,0.3087547719478607,1.4458985328674316,"@TheNestWCE 1:30pm start is not good, they had the covid lockdown going on in WA mentally they weren’t there. We have never played well on that Narrow ground doesn’t suit our style. Lets just relax. It is a long season",,Australia,Mon Apr 26 09:05:22 +0000 2021
1386608435622416385,negative,0.8793925046920776,-0.8463371396064758,2.5375030040740967,"Nobody cares what YOU think, Norman. Your predictions have been proved wrong time and time again with anything to do with COVID-19. https://t.co/YJjJifxdBm",,Australia,Mon Apr 26 09:09:47 +0000 2021
1386608861168103426,positive,0.7784046530723572,2.555791139602661,-0.0704228281974792,Thoughtful panel discussion on changing work &amp; life after COVID with @WeFightForFair Liberty Sanger @IslamicMuseum Moustafa Fahour. Great to be with @KashifBouns @apchundu78 @multiculturevic @MariaDimopoulo4 @Nikolaos4 https://t.co/vYw2HPSUsy,,Australia,Mon Apr 26 09:11:29 +0000 2021
1386616131125870597,neutral,2.060666561126709,0.0712224841117858,1.1498793363571167,@auspollielagger @mark_melbin @b_leeder @aussieavidread @realCarrickRyan @Leesidge The Public Health (COVID-19 Air Transportation Quarantine) Order (No 1) 2021 requires people who arrive in NSW by aircraft and who have been in countries other than Australia or New Zealand in the 14 days before their arrival to undertake mandatory quarantine in a quarantine 1/2,,Australia,Mon Apr 26 09:40:22 +0000 2021
1386618052632924162,neutral,2.3447182178497314,-0.7949147820472717,1.0052119493484497,"@AlboMP Anthony, why did states enact provisions within their own Public Health Acts to cover quarantine?

https://t.co/JlyR3nNTgU",,Australia,Mon Apr 26 09:48:00 +0000 2021
