Tweet_ID,Sentiment_Label,Logits_Neutral,Logits_Positive,Logits_Negative,Tweet_text,hashtags,country,created_at
1353791182363480064,negative,0.9885812401771544,-1.4499284029006958,4.07830286026001,"""No experience necessary "" and this is how violence, abuse and neglect gets inflicted upon people with disability @DRC_AU
""Coronavirus pandemic: Disability industry in care worker shortage"" https://t.co/cMT1mvBf17",,Australia,Mon Jan 25 19:45:44 +0000 2021
1353789258146828288,neutral,1.899645447731018,0.017499402165412903,0.2656088471412659,"@GasBoard21 Yes, Rona? Is there something you would like to contribute? 😛",,Australia,Mon Jan 25 19:38:05 +0000 2021
1353795541222580224,negative,0.7727979421615601,-0.6782554984092712,2.7723147869110107,"@dancingfool75 ""Fives""

Sidenote: me and the girl were going there last October until fkn Corona happened.",,Australia,Mon Jan 25 20:03:03 +0000 2021
1353797760185626626,positive,1.661918044090271,3.083918809890747,-0.6071084141731262,"To my mates from Scotland back home and to all those celebrating #BurnsNightIn around the world, stay safe and Slàinte Mhath . https://t.co/BXKFfTPdh3",BurnsNightIn,Australia,Mon Jan 25 20:11:53 +0000 2021
1353799353618591745,negative,0.44976478815078735,0.2882055640220642,1.5867065191268919,"Sydney's heatwave continues.
Australia Day celebrations canx due to Covid....I won't comment further!
Strange times indeed....
.
. @ Sydney Harbour https://t.co/pMgT4eF9F0",,Australia,Mon Jan 25 20:18:12 +0000 2021
1353802292646973450,neutral,1.77313494682312,1.0481594800949097,0.06309453397989273,@ApsoMollie1 Btw haven’t asked lately... how’s the lockdown going? Hope you’re all well,,Australia,Mon Jan 25 20:29:53 +0000 2021
1353805773881499648,negative,0.9164753556251526,-0.7508328557014465,2.683235883712769,"@katiefoges Why are they so late this year? I can't see how Covid delayed the review and approval process?

I've heard of too many graduates waiting - which places an unnecessary burden on their new schools!",,Australia,Mon Jan 25 20:43:43 +0000 2021
1353804057618444288,neutral,1.1569610834121704,0.8680185675621033,0.9666104316711426,"This is a very concerning read on #covid19's B117 variant. 😭💔 

The new variant, known as B.1.1.7, has wreaked havoc in the UK, fueling a surge in cases towards the end of 2020 despite a national lockdown being in place

https://t.co/zeim7dToYl https://t.co/WpGnxyWB8w",covid19,Australia,Mon Jan 25 20:36:54 +0000 2021
1353801204539695105,positive,0.3015099763870239,0.9094852805137634,0.5281246900558472,Save the Covid triumphalism — Australia has been lucky https://t.co/ABOj1Y1J6Y,,Australia,Mon Jan 25 20:25:34 +0000 2021
1353806875913986050,negative,1.109581708908081,-0.4123817384243012,2.4065845012664795,"I try &amp; stay indoors on ""Australia Day"" because in the past I have been verbally attacked because although I was born in Australia, my background is Chinese &amp; I look Chinese; I've been told to ""go back to China"" by white Australians.

I can't imagine with COVID how bad it'd be.",,Australia,Mon Jan 25 20:48:06 +0000 2021
1353808029649539072,negative,1.4851231575012207,-0.35951119661331177,1.7287776470184326,"Today in #Covid_19 news, we hit 100M total cases globally, of which 74M have been resolved, with 2.1M people dead (2.9% mortality). https://t.co/OQ0NMgaI3N",Covid_19,Australia,Mon Jan 25 20:52:41 +0000 2021
1353801260755894283,positive,0.9275985360145568,1.0835648775100708,0.770621657371521,"@yudhanjaya Ur being kind &amp; gracious—nothing more you can do

Ask her—ur sitting at red light at midnight. No other cars around. Do you drive on or wait for green? 99% wait even though there’s no benefit to them. It’s the right thing to do for society. Same wearing a mask—do it for others!",,Australia,Mon Jan 25 20:25:47 +0000 2021
1353811781647384581,positive,1.849032640457153,3.5114526748657227,-1.1393347978591921,Anatomy of our battle against COVID-19 https://t.co/m283GUUHhf via @abcnews one of the best Covid summaries I’ve seen,,Australia,Mon Jan 25 21:07:36 +0000 2021
1353813836084568065,neutral,0.7948982119560242,0.24507844448089602,-0.0372871458530426,What jerks!https://t.co/bhV2uf7eXX,,Australia,Mon Jan 25 21:15:45 +0000 2021
1353815106761551874,negative,1.190334677696228,-1.0969768762588499,2.5421876907348637,"The mad Catholic monk Tony Abbott was likely parroting his late Catholic fascist mentor, the crank rightwinger Bob Santamaria both are completely unintelligible to a rational mind. https://t.co/0pyM31aeAW",,Australia,Mon Jan 25 21:20:48 +0000 2021
1353817883604750336,neutral,1.8913973569869995,-0.01103895902633667,0.5502063035964966,"Is it safe to have the Covid-19 jab? https://t.co/PUZQqyk9qD # via @TimesLIVE.
Yes",,Australia,Mon Jan 25 21:31:50 +0000 2021
1353822480314454016,positive,1.473257303237915,4.561938762664795,-0.7350249290466309,"Congratulations to Chaplain John Kewa, of the Mission to Seafarers in Port Kembla, on being named Wollongong’s Australia Day Citizen of the Year. John was honoured for the Mission’s devotion to seafarers particularly to the crew of Ruby Princess impacted by the pandemic. https://t.co/qdasr5E6nO",,Australia,Mon Jan 25 21:50:06 +0000 2021
1353810510324535296,neutral,2.8971004486083984,1.989084362983704,-0.7728410363197327,COVID-19 test for FIFA Club World Cup tickets https://t.co/ywU1dwE7Vz #Football #Soccer #SportsBiz,"Football, Soccer, SportsBiz",Australia,Mon Jan 25 21:02:32 +0000 2021
1353819542636515330,positive,1.5586178302764893,1.7974042892456057,-0.06612680852413177,Looking forward to hearing how many cases of COVID are thirstily reported in the news from Invasion Day rallies.,,Australia,Mon Jan 25 21:38:26 +0000 2021
1353810430150365184,negative,0.84440678358078,-1.3693121671676636,4.1835808753967285,This idiot nearly delivered us into the jaws of total covid disaster. He ignored warnings about the emerging pandemic in the US and then did a Trump when the Trump virus arrived https://t.co/pFqWUmmCO4 https://t.co/p52frZmsIP,,Australia,Mon Jan 25 21:02:13 +0000 2021
1353814910065463296,neutral,1.1948143243789673,-0.30131882429122925,1.1652084589004517,"As Virus Grows Stealthier, Vaccine Makers Reconsider Battle Plans
Vaccines by Moderna and Pfizer-BioNTech effectively protect recipients. https://t.co/AO5ildtr1F",,Australia,Mon Jan 25 21:20:01 +0000 2021
1353826982568488960,negative,0.854649543762207,-1.139515399932861,3.4812052249908447,"Whilst in Australia it’s regressive Prime Minister Scott Morrison honors and promotes Margaret Court a religious bigot, preacher of hate, a COVID-denier, homophobe, hate-filled demonizer of LGBTQIA people. https://t.co/JuCTosfgsX",,Australia,Mon Jan 25 22:08:00 +0000 2021
1353828316336197638,neutral,2.070870876312256,0.06585289537906648,0.4476320743560791,@FitzroyLegal Are you willing to help Sydney too? https://t.co/lO8Gx4unwC,,Australia,Mon Jan 25 22:13:18 +0000 2021
1353828461949796352,negative,1.5886034965515137,-1.283952236175537,2.6787986755371094,It hasn't been ruled out for the future so if this THIRD lockdown doesn't work they might think about full mandortory quarantine from every country 😂😂😂😂😂 they really are a laughing stock of a government https://t.co/zkCw0cWS30,,Australia,Mon Jan 25 22:13:52 +0000 2021
1353828674848448512,negative,0.6608459949493408,0.7088921666145325,0.9111037254333496,"Up until the last paragraph, it was interesting. 
But the garbage came at the end! https://t.co/LagYpxuFFX",,Australia,Mon Jan 25 22:14:43 +0000 2021
1353830111196270593,negative,1.2607502937316897,-0.8609302639961243,2.6698055267333984,"The people of Ireland once again shafted by the government, under house arrest for another 6 weeks. Can't go further than 5k from your home but anyone can come into the country without quarantine 🤦‍♂️ joke shop https://t.co/Hy6HZP5x28",,Australia,Mon Jan 25 22:20:26 +0000 2021
1353830954171723776,neutral,0.984765350818634,0.9129725694656372,0.6564866304397583,"Not news I wanted to wake up to! 🥺 

We got this though #ClipperNation https://t.co/xiLdbTcVQg",ClipperNation,Australia,Mon Jan 25 22:23:47 +0000 2021
1353831544989773826,negative,1.0118602514266968,-0.28657960891723633,2.14892315864563,"@MitziMitzva Hard year to get it together tho hey

All the reasons I had for not going out - smoke/heat/storms/fires/pandemic/ extreme pollen counts/general malaise from living thru too many catastrophes... must be like that for you too. Just makes it so hard to pull all those bits together",,Australia,Mon Jan 25 22:26:07 +0000 2021
1353832245522354179,negative,0.3569987118244171,-0.8025915622711182,3.695015192031861,"An absolute disgrace! 40,000 #strandedaussies desperately trying to get home! #auspol @guardian https://t.co/T8ao7ZSq5s","strandedaussies, auspol",Australia,Mon Jan 25 22:28:54 +0000 2021
1353832461571039232,negative,0.6073743104934692,-0.2573406398296356,2.622376680374145,It’s heartbreaking calling my child to say I’m choosing to stay away from home to work a few days longer than intended - as my choice.  I can only imagine the horror of parents being separated from their children through no choice of their own. https://t.co/Hd0xwUqjCX,,Australia,Mon Jan 25 22:29:46 +0000 2021
1353838663679922176,neutral,1.6348116397857666,0.04943852499127388,1.2314176559448242,"@Benaskren For interest, check out Victoria Australia after a tough lockdown we have gone 30 days in our state without a community case, the only cases are 2 international tennis people whom are in quarantine isolation, it works. Go hard now easy later",,Australia,Mon Jan 25 22:54:25 +0000 2021
1353828107979874306,positive,1.059120774269104,1.5474241971969604,0.23080579936504364,"One of the great stories over the past year has been Indigenous self-determination. 

Recognising that coronavirus had the potential to decimate their communities, Elders and Indigenous-controlled health organisations acted.",,Australia,Mon Jan 25 22:12:28 +0000 2021
1353834339939753985,neutral,1.067098617553711,0.5250075459480286,0.6626038551330566,🇦🇺🇦🇺First U.S. case of highly transmissible Brazil coronavirus variant identified in Minnesota ⁦@washingtonpost⁩ ⁦@KimMHooper⁩  https://t.co/kfqRflKxBX,,Australia,Mon Jan 25 22:37:14 +0000 2021
1353837605419241479,negative,1.3157404661178589,0.25152891874313354,1.348734974861145,"(How's YOUR #superannuation looking?)

""Australia’s 31 billionaires raked in nearly $85 billion since the global pandemic was declared in March ... enough to give the 2.5 million poorest Australians a one-off payment of just over $33,300 each.""
 https://t.co/yLOp6MoFHL",superannuation,Australia,Mon Jan 25 22:50:12 +0000 2021
1353826977032019968,positive,1.5837111473083496,2.9302053451538086,-0.11121319979429244,"@GregorWell @PHE_uk @MHFA_Australia ...to health workforce/community post Covid, along with suicide 1st aid (which is different again!) Via @Living_Works (online START being rolled out by many local NHS/PH in UK)

The @Phoenix_Trauma in Aus has a great new psychological 1st aid program for Bushfire com'ties",,Australia,Mon Jan 25 22:07:58 +0000 2021
1353831770953719809,negative,0.9395061135292052,-0.30268993973731995,1.870201826095581,As if this day wasn’t complicated enough - covid restrictions make things more contentious. Thousands chasing the shade and attempting to physically distance at #InvasionDay2021 rally in Sydney https://t.co/UQAgyM6hOI,InvasionDay2021,Australia,Mon Jan 25 22:27:01 +0000 2021
1353833850007285760,neutral,2.052462339401245,0.15610602498054504,1.031579613685608,"See what happens when you follow the science, data and follow the Covid safe plans implemented by government. You get this at the end. https://t.co/AekwAcB2Pq",,Australia,Mon Jan 25 22:35:17 +0000 2021
1353835025599328256,neutral,2.379333019256592,0.7797867059707642,0.7112031579017639,People starting to show up to Civic Park for #InvasionDay #DayofMourning . Hand sanitiser station and Covid gear pick up/drop off point set up. People being directed to start putting their masks on. https://t.co/trU4OL7LBg,"InvasionDay, DayofMourning",Australia,Mon Jan 25 22:39:57 +0000 2021
1353836972171649024,neutral,1.020135760307312,-0.04880791157484055,0.7549833059310913,"""Double masking"" might have less impact than you think 🤔 https://t.co/ABOj1Y1J6Y",,Australia,Mon Jan 25 22:47:41 +0000 2021
1353831580628774913,neutral,1.6148788928985596,1.2436387538909912,-0.16664376854896545,"@noplaceforsheep Hope you were speaking in tongues, with a mask on each foot masquerading as thongs!",,Australia,Mon Jan 25 22:26:16 +0000 2021
1353835967472234497,positive,1.8700964450836184,3.0330607891082764,-0.4390186369419098,A welcome touch of cloud providing some cover for the march this morning. Almost time to mask up and start walking. Kick off from the Tent Embassy at 10am.  #survivalday #InvasionDay https://t.co/v2EwTm00Ey,"survivalday, InvasionDay",Australia,Mon Jan 25 22:43:42 +0000 2021
1353827083852517382,neutral,1.141960382461548,-0.5214281678199768,1.002039074897766,@CordeiroRick Proof that the vaccine destroys immortality.,,Australia,Mon Jan 25 22:08:24 +0000 2021
1353827236315504640,negative,1.7084704637527466,-1.0151020288467407,2.080914258956909,"So why hasn't Australia done a deal with Moderna?

Moderna vaccine appears to work against variants https://t.co/6mTbXy9X50",,Australia,Mon Jan 25 22:09:00 +0000 2021
1353828111377330176,negative,1.7436825037002563,-0.966154396533966,2.5006580352783203,"To date, there have been no deaths of Aboriginal or Torres Strait Islander people from the virus and the major outbreaks were traced back to healthcare workers from out of town.

When Indigenous people are given a voice and self-determination, (unsurprisingly) they get it right.",,Australia,Mon Jan 25 22:12:29 +0000 2021
1353840520733188097,neutral,1.6062973737716677,0.6213743686676025,0.15680073201656342,@TheOakLeafs @FaraazH87 I have it downloaded and have watched it a least three times during the pandemic.,,Australia,Mon Jan 25 23:01:47 +0000 2021
1353843912641630208,negative,1.1513077020645142,-0.6797786951065063,2.3208913803100586,"From @ScienceMagazine 

mutations that escape antibodies 
used to treat #COVID-19

many escape mutations impose little cost on RBD folding or receptor affinity, and some are already present at low levels among circulating viruses

= big worry!

#vaccine 

https://t.co/PNzgbBnc1s","COVID, vaccine",Australia,Mon Jan 25 23:15:16 +0000 2021
1353846006304018433,positive,0.33813005685806274,3.7504549026489262,-0.6248852610588074,Thank you Albo for remembering them ! https://t.co/6GiVAqPIiS,,Australia,Mon Jan 25 23:23:35 +0000 2021
1353847716040695814,neutral,1.177055597305298,0.12370095402002335,0.6647516489028931,"@ZLoescher @TSchimanko @VP I googled, covid related restrictions? Every country has had those for months.",,Australia,Mon Jan 25 23:30:23 +0000 2021
1353850069993230336,negative,0.7988401055335999,-0.26924172043800354,1.9228301048278809,"Thats Right wing Govts manual, take from the poor give to the rich, they never change, quite why anyone but the top end of town votes for them I will never understand ! https://t.co/sleHh0K20v",,Australia,Mon Jan 25 23:39:44 +0000 2021
1353851481850486784,positive,1.8867853879928589,2.176825046539306,0.05866089463233948,"@mumsthe_word_23 I'm hearing you, Nephew reschedule wedding for April this year hopefully for him and his partner we will all be at Port Macquarie to celebrate, pending covid of course.",,Australia,Mon Jan 25 23:45:21 +0000 2021
1353854025930661888,positive,0.4770142436027527,1.8959366083145144,-0.02982634119689465,At last they've done something usefull ! https://t.co/sleHh0K20v,,Australia,Mon Jan 25 23:55:27 +0000 2021
1353855000334585856,neutral,1.6138886213302612,-0.32032206654548645,0.8773245811462402,Surely this could’ve been handled quietly behind closed doors before season commencement. https://t.co/fw2FxpZCsV,,Australia,Mon Jan 25 23:59:20 +0000 2021
1353849046033555456,negative,0.9394220113754272,-0.2489233016967773,1.82259738445282,The pandemic has fuelled extreme inequality. It’s time for a global reset | The New Daily https://t.co/OX1gCBhzzz,,Australia,Mon Jan 25 23:35:40 +0000 2021
1353840602983456768,negative,1.3763108253479004,-0.3830991387367249,2.105828762054444,A concerning report. I’m also unsure what data support the assertion the Oxford/AZ vaccine is definitely not efficacious in the elderly attributed to German regulators. Need to see any new data in full. #Covid_19 #CovidVaccine https://t.co/jor3kzSItg,"Covid_19, CovidVaccine",Australia,Mon Jan 25 23:02:07 +0000 2021
1353842203731189766,positive,0.3260403573513031,4.153303146362306,-0.5041037201881409,"Congratulations to our very own, much deserving @Hux1975 on being awarded the PSM. We are very lucky in @ACTEducation  https://t.co/45leQBz5rK",,Australia,Mon Jan 25 23:08:29 +0000 2021
1353842706485678080,neutral,1.3633825778961182,0.7451034188270569,-0.02251367084681988,Invasion day rally is covid safe @ScottMorrisonMP @DanielAndrewsMP ?,,Australia,Mon Jan 25 23:10:29 +0000 2021
1353844195417440262,positive,2.1615362167358403,4.939058780670166,-1.4558321237564087,"Our first @GreaterGeelong Citizenship Ceremony at City Hall since Covid Mar 2020. Joining Acting Mayor @TSGeelong, @SenSHenderson, @LibbyCokerMP, @CCouzensMP welcoming our newest Aussies on #AustraliaDay2021 https://t.co/vmhUHJjMKM",AustraliaDay2021,Australia,Mon Jan 25 23:16:24 +0000 2021
1353845086044344320,negative,0.923725128173828,-0.5312146544456482,2.6583473682403564,"@AnthonyCole68 In the circumstances I would have to agree with @nswpolice. 

The last thing we want is for a wave of COVID infections to break out.

As disappointing as it is - @CityofPerth has cancelled the annual Skyworks for exactly the same reason. To stop large crowds. TI #StaySafe",StaySafe,Australia,Mon Jan 25 23:19:56 +0000 2021
1353845086585450498,neutral,2.0339689254760738,-0.9190447330474854,1.545620322227478,"So if the #vaccines prove only temporarily effective, just how will attitudes to #lockdown &amp; other strict measures to prevent galloping #Covid_19 change??","vaccines, lockdown, Covid_19",Australia,Mon Jan 25 23:19:56 +0000 2021
1353847809699532801,negative,0.5654779672622681,-0.7983806133270264,2.7327473163604736,Potential devastating impact of COVID-19 pandemic on the diagnosis and treatment of head and neck cancer 🇬🇧 https://t.co/8GlUgCg1rZ @swallowsgroup @OncologyLeedsTH @macmillancancer @TargetingCancer @ESTRO_RT @hncanceraus https://t.co/WEuwMipBie,,Australia,Mon Jan 25 23:30:45 +0000 2021
1353852833167142922,positive,1.2146766185760498,3.089640617370605,-0.3534161448478699,"@DanielAndrewsMP this morning talks about being proud of #Victoria a State of kindness and compassion, courage and conviction. Acknowledging healthcare workers: “together we defeated a 2nd wave of #COVID “ https://t.co/OSKBvXppAd","Victoria, COVID",Australia,Mon Jan 25 23:50:43 +0000 2021
1353853838726320128,neutral,1.5625996589660645,-0.440172404050827,1.5600069761276243,@ZLoescher @TSchimanko @VP We are aware he placed a travel ban 2-3 years before covid so that was not covid related,,Australia,Mon Jan 25 23:54:43 +0000 2021
1353846332851593216,positive,1.4715324640274048,1.5739141702651978,0.21866421401500705,"We’re out here at the domain for #InvasionDay - stay safe, drink lots of water, slip slop slap, wear a mask! https://t.co/zFkzIqPfIE",InvasionDay,Australia,Mon Jan 25 23:24:53 +0000 2021
1353841684929339394,neutral,1.3743383884429932,0.7569140195846558,0.23815958201885226,"@OMGTheMess Inevitably, Albo will wail and decry those least prioritised as recipients of the vaccine. Political virtue seeking.",,Australia,Mon Jan 25 23:06:25 +0000 2021
1353846599353470977,neutral,1.4841208457946775,0.3245665431022644,0.7099034786224365,"@AnthonyCole68 @nswpolice @CityofPerth At least face masks &amp; sanitizer. 

If anyone feels even slightly unwell #StayHome .

I reckon it'll be like this until the vaccine is rolled out. TI",StayHome,Australia,Mon Jan 25 23:25:57 +0000 2021
1353846647470473216,negative,0.5375795364379883,-0.5672451257705688,3.136887550354004,@LiamoDeB Too many people won't take the vaccine that's why I don't think it's gonna have a great effect as the government thinks. They've handled this pandemic absolutely terrible. What a shit show,,Australia,Mon Jan 25 23:26:08 +0000 2021
1353847032369176576,negative,0.9130591750144958,0.29233473539352417,1.462761163711548,"The only thing missing from today’s shenanigans is, ze German 😭
She would’ve visited if it wasn’t for the state of the world n the darn virus 😢
So, partaying for her as well! 🇦🇺",,Australia,Mon Jan 25 23:27:40 +0000 2021
1354007027995930624,positive,0.5183408856391907,0.8886351585388184,0.04181395098567009,yeah this... https://t.co/dg3S6azV4F,,Australia,Tue Jan 26 10:03:26 +0000 2021
1354007223979008001,neutral,1.2915632724761963,-0.17672142386436462,1.2287814617156982,"Listening to Rupert didn’t help ,Trump did the same have a look at America,if not for the premiers Australia would be the same https://t.co/whIhAla6TN",,Australia,Tue Jan 26 10:04:13 +0000 2021
1354008225478189057,positive,0.8918745517730713,2.385279655456543,-0.394149512052536,"Reflecting today on how grateful I am to Australia, on protecting me as both a human and a healthcare worker through the pandemic https://t.co/NleDOfkRCB",,Australia,Tue Jan 26 10:08:11 +0000 2021
1354008460640182274,negative,0.7530342936515808,-0.5673009157180786,2.5796964168548584,@SBSNews Tony Abbott is upset Australia relies on experts to help us deal with COVID19 because it's preventing us from sitting in the front seats of taxis..... 🤔 That's a pretty persuasive argument. 😂,,Australia,Tue Jan 26 10:09:07 +0000 2021
1354008827423670272,negative,0.5013668537139893,-0.6700879335403442,1.9413132667541504,Tony Abbot is a pedophile protector https://t.co/MRWHVbm4MJ,,Australia,Tue Jan 26 10:10:35 +0000 2021
1354009892961488897,negative,0.5805228352546692,0.5758171081542969,1.606841802597046,"There are many reasons to be grateful to be an Australian. But in this terrible situation with the Pandemic, Australians  have been exceptional , not only by our ability to cooperate with our Government , but by our resilience and care for our fellow Australians. Love you all.",,Australia,Tue Jan 26 10:14:49 +0000 2021
1354010978044678144,negative,1.0241888761520386,0.2664547562599182,2.050407886505127,Explaining to non science people that I study “a respiratory bacteria” they now reply with “oh like covid?”🤦‍♀️ yeeaahh not quite 😂 this is why we have to share our research!! #WomenInScience #WomenInSTEM #microbiology #sciencecommunication #scicomm #Covid_19 #AcademicChatter https://t.co/Y1qkOcz6Nt,"WomenInScience, WomenInSTEM, microbiology, sciencecommunication, scicomm, Covid_19, AcademicChatter",Australia,Tue Jan 26 10:19:08 +0000 2021
1354011201483620352,neutral,1.0925846099853516,0.30872371792793274,0.1618129312992096,Think I would prefer Bobbies though @Mr_Brown__ https://t.co/i9xCqAERHv,,Australia,Tue Jan 26 10:20:01 +0000 2021
1354011346954686469,neutral,1.3779867887496948,0.7030860185623169,1.338591694831848,Just when you thought the world couldn’t get any more complicated - we now have a fruit fly outbreak and all these cannot be packed in school lunchboxes tomorrow - the first day of the new school year and a day after a public holiday. #couldntmakeitup https://t.co/9UWa6l3OsU,couldntmakeitup,Australia,Tue Jan 26 10:20:36 +0000 2021
1354012165674475520,positive,1.6823265552520752,3.927380084991455,-1.0998148918151855,NCAS has 16 translations of our antimicrobials consumer information sheet https://t.co/qSVcYxmxZa We are happy to assist with more language versions! https://t.co/pFc2DEtz6e,,Australia,Tue Jan 26 10:23:51 +0000 2021
1354013829504540672,negative,1.2414668798446655,-0.4944232404232025,1.6394504308700562,Yes The US paid Moderna handsomely but we were asleep at the wheel Lucy. Only Cathie Wood was on Global media talking about CRISPr and Moderna. @JoshFrydenberg https://t.co/Ff2rDornNW,,Australia,Tue Jan 26 10:30:27 +0000 2021
1354015356348551168,positive,0.6860906481742859,1.7212985754013062,-0.3110165894031525,Get well soon Fadzayi. https://t.co/wlFqeB24Db,,Australia,Tue Jan 26 10:36:31 +0000 2021
1354020178946793472,neutral,0.9302349686622621,0.21045848727226255,0.3982448577880859,"@gayyimby Or relatively many non-COVID hospitalisations, I guess.",,Australia,Tue Jan 26 10:55:41 +0000 2021
1354021049944297472,negative,0.3942990005016327,0.5534195303916931,1.5493452548980713,"Fran Kelly is &amp; allways was an anti Labor viper! Anyone who recalls Keatings time as P M will remember her on a daily basis slagging off at everything he did, no matter if it was good for health educ', aged care, etc. Just spewing her endless bile! She has 0 credibility. A shrew! https://t.co/5rxh6r1Ipf",,Australia,Tue Jan 26 10:59:09 +0000 2021
1354009867619450880,positive,1.3199039697647097,3.21452260017395,-0.35952818393707275,Ok... so I may have baked Banana Bread to share (COVID-safely) for morning tea tomorrow... I have a fundamental belief that Banana bread solves many (all) of life’s struggles... 🤣🤣🤣🍞🍞🍞🍌🍌🍌 #bananabreadforthewin 🙌✨✨,bananabreadforthewin,Australia,Tue Jan 26 10:14:43 +0000 2021
1354011261638385664,neutral,1.091288924217224,-0.31730228662490845,1.000575065612793,Alright I didn’t have COVID before but I probably have it now 🤨🥴😂 https://t.co/atNSMFy0Kt,,Australia,Tue Jan 26 10:20:15 +0000 2021
