Tweet_ID,Sentiment_Label,Logits_Neutral,Logits_Positive,Logits_Negative,Tweet_text,hashtags,country,created_at
1345158956969148416,neutral,2.76152777671814,1.33556866645813,-0.9676414728164672,Northern part of northern beaches stay at home remains until 9th as planned.,,Australia,Sat Jan 02 00:04:21 +0000 2021
1345159030847795200,neutral,3.3065054416656494,0.8890680074691772,-1.035548448562622,Southern section of Northern Beaches released from stay at home directive from midnight.,,Australia,Sat Jan 02 00:04:39 +0000 2021
1345159464492548097,neutral,2.017781972885132,1.3152562379837036,0.13869798183441162,"@LouieLouLouigi @ToniParsons14 @rachelelisav @LesStonehouse Different cities. Early March I saw aerosol transmission, over distance, between 2 joggers. I wore balaclavas, scarves, from then until supplies of better masks became available towards the end of first lockdown. I was in Melb then.",,Australia,Sat Jan 02 00:06:22 +0000 2021
1345159602812243968,positive,0.41748297214508057,0.5252678990364075,-0.08013803511857986,This https://t.co/tucDhtYlaj,,Australia,Sat Jan 02 00:06:55 +0000 2021
1345160188228112384,neutral,2.168914794921875,1.5264003276824951,-0.04962175339460373,"- Gym classes down to 30
- No nightclubs or dancing 
- weddings, funerals and places of worship down to 100 
- NSW Health reviewing the SCG Covid safe plan today with the aim to keep jobs and normality",,Australia,Sat Jan 02 00:09:15 +0000 2021
1345160409548947457,neutral,2.1411912441253658,0.5272054076194763,0.588546097278595,NSW Health officials to do a walk-through today of the Covid safe plans at the SCG for the test.  #AUSvIND,AUSvIND,Australia,Sat Jan 02 00:10:08 +0000 2021
1345160475579858946,positive,1.7256542444229126,2.6453559398651123,-0.6638688445091248,"The line at Prahran Town Hall covid testing (Chapel street) is at least 50 people long.

Good to see people out, doing the right thing by the community.",,Australia,Sat Jan 02 00:10:23 +0000 2021
1345160525412352000,neutral,1.3367966413497925,0.2330417037010193,0.5123732686042786,So are Masks Mandatory @scg for Test? #COVID19,COVID19,Australia,Sat Jan 02 00:10:35 +0000 2021
1345160613652152320,neutral,1.7602458000183103,-0.5794017314910889,0.7511869668960571,@K_M_Q Agreed. Should have been done when the outbreak started,,Australia,Sat Jan 02 00:10:56 +0000 2021
1345162650322309121,negative,1.0088076591491701,-0.8213270306587219,3.366771459579468,Finally @GladysB mandates masks! Meanwhile we (Melb) deal with another outbreak FROM HER CARELESSNESS! If this was at the start (with a short lockdown) this wouldn’t be happening. Corrupt LNP put $ before lives. How selfish can you get? #COVID19Vic #covid19nsw #GladysTheCovidiot,"COVID19Vic, covid19nsw, GladysTheCovidiot",Australia,Sat Jan 02 00:19:02 +0000 2021
1345163026857508864,neutral,1.1327818632125854,0.5104984641075134,-0.18664059042930606,Northern Beaches Italian. 😬 https://t.co/7cdLjMjRsp,,Australia,Sat Jan 02 00:20:32 +0000 2021
1345163210941292547,neutral,1.4467673301696775,-0.18508800864219666,1.1392197608947754,@Achh15 Competent leadership during this pandemic hasn't been on display at the federal level...,,Australia,Sat Jan 02 00:21:16 +0000 2021
1345163497034792964,negative,0.9600890874862672,-0.900766372680664,2.000353574752808,Problem is that the @GladysB decisions become everyone else’s problems to fix https://t.co/nXzseY1hLb,,Australia,Sat Jan 02 00:22:24 +0000 2021
1345163827097137152,negative,0.7924456000328064,0.3898656070232392,1.8167098760604856,"Has #ScottyfromPhotoOps learnt his lesson from last years Hawaii debacle, now announcing he’s going on a weeks holiday, whereas 12mths ago no-one knew where he was!
Good one Scotty... NSW in the middle of a Covid episode, borders slammed shut, but @GladysB has it under control!",ScottyfromPhotoOps,Australia,Sat Jan 02 00:23:42 +0000 2021
1345163986262659073,negative,0.3558579087257385,1.1226365566253662,1.2306944131851196,But NSW are doing such great job lol https://t.co/ebWNbQoSQ4,,Australia,Sat Jan 02 00:24:20 +0000 2021
1345164234343108609,negative,1.3572458028793335,-0.010996036231517792,1.7683240175247192,"@factchekka @vanOnselenP @australian Now if FOI was allowed (cabinet in confidence) from this National Cabinet you may have a totally different pov.
The states were already making their own decisions by then because there was no consistant leadership.
We got ""live with covid"" or ""I'm going to the footy"". Joke!",,Australia,Sat Jan 02 00:25:20 +0000 2021
1345164677945249795,neutral,1.6322301626205444,-0.08794156461954117,1.5920146703720093,@StanMichael @ShockingOf @jaquix173 @Skull_Buggery @Qldaah @DanielAndrewsMP Just keep going. It's not a race and what we are trying to tell you is how to avoid it. Step 1. Wear masks.....2: Stay close to home. 3. Avoid crowds,,Australia,Sat Jan 02 00:27:05 +0000 2021
1345164950927417346,neutral,2.067016839981079,1.6435558795928955,-0.8088788390159607,Final some sense in NSW #Masks #WearAMask #covidNSW 😷😷😷😷 https://t.co/oTiWfsJWds,"Masks, WearAMask, covidNSW",Australia,Sat Jan 02 00:28:10 +0000 2021
1345165036205969408,positive,0.7497971653938293,2.947927713394165,-0.20628967881202695,@SBSNews Amazing to see a premier in the middle of an outbreak say she is taking leave. There are countless essential workers that I’m sure would love a break right now.,,Australia,Sat Jan 02 00:28:31 +0000 2021
1345165608623644672,positive,0.8739436864852905,0.9350402355194092,0.8636720180511475,Sensible play here. Great balance and all aimed at avoiding a disastrous lockdown. https://t.co/rcZHFADxeD,,Australia,Sat Jan 02 00:30:47 +0000 2021
1345165789188407297,negative,1.2990611791610718,-0.6551547050476074,2.2183845043182373,Morrison has just gone on holiday. Gladys just announced she is going on holiday. Andrews was criticised for not taking a break during the crisis. Now he is being hounded for taking a break. https://t.co/sO9pAhJ520,,Australia,Sat Jan 02 00:31:30 +0000 2021
1345165799925841920,positive,0.8238249421119691,1.989154815673828,-0.10991104692220688,"I feel there’s a bit of, ‘now it’s in the working suburbs we feel we can boss people around more than when it was in the rich ones’ but am glad to see the change in NSW  #WearAMask https://t.co/lYp7AtYdF4",WearAMask,Australia,Sat Jan 02 00:31:33 +0000 2021
1345166335165280258,positive,0.33438020944595337,0.433979868888855,0.059118099510669715,Legit. https://t.co/u2tNAEw9jo,,Australia,Sat Jan 02 00:33:40 +0000 2021
1345166603474780161,negative,0.6903390288352966,0.9441189169883728,1.2878191471099854,Not happy about the latest Vic outbreak so checked out quarantine options. #2021 #COVID19Vic #covidonmymind #pentridge #cellblocktango 🇦🇺 https://t.co/Ro9pYl4RxY,"COVID19Vic, covidonmymind, pentridge, cellblocktango",Australia,Sat Jan 02 00:34:44 +0000 2021
1345166619635372033,neutral,1.035688400268555,0.4478858411312103,0.8620173335075378,Can someone please PM me a scientific explanation of why children under 12 are most likely not to catch and spread Covid-19? Thank you.,,Australia,Sat Jan 02 00:34:48 +0000 2021
1345167129935368193,negative,0.5843737125396729,-1.0570143461227417,3.696324348449707,Gee🙄 it took a long time.. Finally the Gladys gov is taking this pandemic seriously.. What a fucked-up useless mob.. finally waking up from their slumber. . Still too lite but.. 😩,,Australia,Sat Jan 02 00:36:50 +0000 2021
1345167155277430785,negative,0.6192947030067444,0.12788432836532593,1.6336382627487185,"FINALLY!
Masks will now be mandated in shopping centres, public transport etc
With the majority of Sydneysiders not taking Covid19 seriously, this is long overdue measure that would NOT be harmful to the economy.
#WearAMask 
https://t.co/Doj84JNZ22",WearAMask,Australia,Sat Jan 02 00:36:56 +0000 2021
1345167258423726080,neutral,1.0204900503158572,-0.2473623752593994,0.9836875200271606,After months of non-stop work? He should retire now. https://t.co/GBfh8wOuOg,,Australia,Sat Jan 02 00:37:21 +0000 2021
1345167815532183554,neutral,1.1136375665664673,0.19171839952468872,1.1018385887145996,"@vera77mazz @mattiecamp @normanswan Think we know by now that Covid isn't going away anytime soon.

Cases will keep occuring.",,Australia,Sat Jan 02 00:39:33 +0000 2021
1345167986961747969,negative,1.119579553604126,-0.3698452413082123,1.767798900604248,PRO TIP: wear a mask and sunglasses to hide that you’re crying 👍🏻 https://t.co/Ip0UAwgsAT,,Australia,Sat Jan 02 00:40:14 +0000 2021
1345169656437358592,negative,0.8614194989204407,-0.4223271906375885,2.093913078308105,@mollyfud @camkellie That makes even less sense. It should just be one rule. It wouldn’t kill people to stay home for 24 hours until they got a result.,,Australia,Sat Jan 02 00:46:52 +0000 2021
1345171009029120001,positive,1.445842742919922,3.8701345920562735,-0.941456973552704,"It’s amazing the narrative across the media with this NSW Northern Beaches outbreak.

Messaging in NSW linking cases to Melbourne and in Melbourne the opposite. 🙄 #Divided",Divided,Australia,Sat Jan 02 00:52:15 +0000 2021
1345171106009792513,neutral,1.4110512733459473,0.1470380425453186,1.0301774740219116,"@normanswan @sleepingdingo Premier B just said that Crossroads took 4 months to get to zero. She very much hopes that it’s quicker in this case but prolonged still likely. We all want the same thing, zero COVID with least disruption. Going hard early is consistent with that.",,Australia,Sat Jan 02 00:52:38 +0000 2021
1345158968541265920,neutral,2.1272692680358887,0.26086708903312683,0.7050976753234863,The southern zone of the northern beaches is now counted as part of greater Sydney. The northern part will be locked down until January 9 #coronavirus,coronavirus,Australia,Sat Jan 02 00:04:24 +0000 2021
1345159664476901378,negative,1.578925848007202,-0.7493875622749329,2.291723728179932,"NSW, what have you done? Your virus has now leaked into Victoria because your premier did not pushed for a harsher restrictions when the virus was first detected in your state a few weeks ago.
#thanksGladys #covid19 #coronavirus  #chinavirus  #thanksnsw  https://t.co/lgSPvTln10","thanksGladys, covid19, coronavirus, chinavirus, thanksnsw",Australia,Sat Jan 02 00:07:10 +0000 2021
1345167500732817408,negative,1.0115200281143188,0.5668968558311462,1.4821863174438477,"Important #health news. Masks made mandatory in Greater Sydney indoors. Includes Central Coast/Blue Mountains. Strongly support this added public health measure. For those who think latest NSW #coronavirus outbreak is not of concern, sends a strong message. #covidnsw #COVID19nsw https://t.co/x5jhmDOzgp","health, coronavirus, covidnsw, COVID19nsw",Australia,Sat Jan 02 00:38:18 +0000 2021
1345172665959546881,positive,0.27739277482032776,1.2609801292419434,0.5674816966056824,@harryc2017 @macsween_prue @GladysB Nice try. But you a wrong. https://t.co/K3chjig7dV,,Australia,Sat Jan 02 00:58:50 +0000 2021
1345158849297203200,negative,1.0911980867385864,0.2044512927532196,1.497782588005066,"@mkcogs @PatsKarvelas Patricia is only being agreeable to dodge mentioning that the new version of Covid-19 is 70% faster at transferring to the victim. Of course that means increasing spacing by 70%. Instead of 4 square metres per person, it befomes a rounded 16 square metres.",,Australia,Sat Jan 02 00:03:56 +0000 2021
1345159851639332864,negative,0.7962425947189331,-0.8557948470115662,2.992738008499145,"The reason that NSW can run lax policies in relation to COVID, is because the rest of the country is doing the right thing in terms of containment. They value life over money @GladysB. #FFS #tryingtomakeitlookgood #bully #businessmoreimportantthanhumans","FFS, tryingtomakeitlookgood, bully, businessmoreimportantthanhumans",Australia,Sat Jan 02 00:07:55 +0000 2021
1345160041620361216,neutral,1.9393457174301147,0.11870596557855605,0.44058528542518616,"Controlled out door events down to 2,000 from 5,000. Cricket - covid safe plan being reviewed",,Australia,Sat Jan 02 00:08:40 +0000 2021
1345161212116357120,negative,0.7155390977859497,-1.1121715307235718,3.296177625656128,@realDonaldTrump Failed worst responses for covid in world you should be in jail,,Australia,Sat Jan 02 00:13:19 +0000 2021
1345161800883453953,negative,0.7300669550895691,-0.5047185420989989,2.371697902679444,@mpesce @GladysB Partisan Covid opinions shit me to tears. Right now I'm seeing criticism inverse to a few months ago based upon whoever they support.,,Australia,Sat Jan 02 00:15:39 +0000 2021
1345162045562359810,neutral,1.8557838201522827,-0.754638135433197,1.5426714420318604,#nanaonthemove #eatlessmovemore  Out of 14 days self isolation &amp; three negative COVID tests. 🏃🏻‍♀️ https://t.co/dljQeLU4pG,"nanaonthemove, eatlessmovemore",Australia,Sat Jan 02 00:16:38 +0000 2021
1345162309652471811,negative,1.013615369796753,-0.4405361711978912,2.826002359390259,"@GladysB 
Finally #GladysTheCovidiot .... MASKS ARE TO BE MANDATORY INSIDE IN NSW, as usual NSW late to the party. if you had done this at onset of NB Covid spread we in Victoria wouldn’t be facing restrictions again ... Borders wouldn’t be slammed shut .. you should RESIGN now !",GladysTheCovidiot,Australia,Sat Jan 02 00:17:41 +0000 2021
1345163054196035584,neutral,1.63733172416687,1.0993618965148926,0.2992294728755951,Service NSW will be reaching out to all businesses with a covid safe plan to obtain an after hours number. Makes the Tracies job easier to speak to business owners urgently,,Australia,Sat Jan 02 00:20:38 +0000 2021
1345164813169692672,neutral,2.057244777679444,-0.5613120794296265,0.8858203291893005,@VicGovDHHS how can we get tested if all the covid testing sites are over capacity no further testing?,,Australia,Sat Jan 02 00:27:38 +0000 2021
1345165642060636162,negative,0.955946922302246,-0.010683037340641022,1.5657038688659668,@edengillespie Really? Shouldn’t a Covid-free state be something to look forward to?,,Australia,Sat Jan 02 00:30:55 +0000 2021
1345166321596596224,positive,1.0026792287826538,1.5591593980789185,-0.243365541100502,@Ash00110011 @COVID_Australia @NSWHealth This should have been made mandatory a week or so ago! But glad it's there now.,,Australia,Sat Jan 02 00:33:37 +0000 2021
1345166572264902656,negative,1.0576316118240356,-0.4122893512248993,2.212263822555542,"It really echoes the way we’ve been communicated with these last 36 hours - are we COVID risks or not? Victoria says we’re not (unless directly linked to cases or locations). WA says we are, but only very loudly in public? Communication from police, WA health, G2G has been dismal",,Australia,Sat Jan 02 00:34:37 +0000 2021
1345166759519653889,negative,1.0954980850219729,-1.0232901573181152,2.976203203201294,"@johnlittle @australian headline
'Infected Victorians trigger NSW scare'.
These Victorians unknowingly contracted Covid in Victoria from NSW infected people. 
Biased somewhat?",,Australia,Sat Jan 02 00:35:22 +0000 2021
1345169736401711104,negative,0.9948970079421996,0.5397664904594421,1.0717800855636597,@RoyceWilsonAU @Cynthiainoz NSW Police were think enough to think it was cool fining people sitting to the Covid testing queue for using their phones in their cars. A whole new meaning for special constable.,,Australia,Sat Jan 02 00:47:11 +0000 2021
1345170149398126592,positive,0.9151268601417542,1.0729210376739502,0.7196387648582458,"@Wolfie_Rankin Not the most covid safe thing at the moment, but I will take you up on it some day!",,Australia,Sat Jan 02 00:48:50 +0000 2021
1345170230692073472,negative,0.5268864035606384,0.3250841200351715,0.5600709915161133,@hangry_pinay Yeah. Kami kahit no rain still sayang. Covid is waving.,,Australia,Sat Jan 02 00:49:09 +0000 2021
1345170815285751809,positive,0.4556580483913422,0.9406613111495972,0.7235897779464722,"I have found a cluster of COVID free people, they are all shopping in West Gosford, great find!  #COVIDIOTS",COVIDIOTS,Australia,Sat Jan 02 00:51:29 +0000 2021
1345158939214712832,negative,0.5980152487754822,0.5412291288375854,0.9916131496429444,"I really like Brad Hazzard's light blue and white mask today. 

Very non-threatening.",,Australia,Sat Jan 02 00:04:17 +0000 2021
1345160635424804864,positive,0.6887133121490479,2.2109148502349854,0.15611396729946134,"OMG, is @GladysB finally mandating indoor mask wearing in #NSW Welcome to 2021 Gladys, better late than never #COVID19 😷","NSW, COVID19",Australia,Sat Jan 02 00:11:02 +0000 2021
1345161637741744130,negative,0.4128955006599426,-0.2336335182189941,1.7870179414749146,"Just wear a bloody mask when you're out, its a no brainer ! https://t.co/1VSCK1bp39",,Australia,Sat Jan 02 00:15:00 +0000 2021
1345161891937599490,negative,0.3094471395015717,0.1718631386756897,2.2039167881011963,"#Gladys finally mandates masks in some indoor settings, about bloody time! As a returned Aussie I can’t wait to get down the pokies in my now mandatory mask to rid myself of any remaining funds! #covid19nsw #strandedaussies","Gladys, covid19nsw, strandedaussies",Australia,Sat Jan 02 00:16:01 +0000 2021
1345162305449807873,neutral,1.853517174720764,-0.3703809678554535,0.913771390914917,Health minister: government can make the rules but it’s up to personal responsibility. Please wear a mask where required and adhere to other restrictions,,Australia,Sat Jan 02 00:17:40 +0000 2021
1345162485909786624,negative,0.9027876853942872,-0.22073492407798767,2.3862745761871342,"@fakejstrauss @JanekKayley @ATheatergoer The way to protect yourself and others, particularly if you live in US, is to wear a mask, socially distance and stay home if possible. This is the responsibility that comes with freedom. Everything else is bullshit.",,Australia,Sat Jan 02 00:18:23 +0000 2021
1345162681599234048,neutral,1.166183352470398,0.2520101070404053,0.7772896885871887,"@sophie_walsh9 @NeilMcMahon @9NewsAUS I think the mask mandate is for greater Sydney, not all of NSW.",,Australia,Sat Jan 02 00:19:09 +0000 2021
1345164325946761216,neutral,1.8496067523956297,-0.34547367691993713,0.7182395458221436,"Herald Sun: masks are muzzles sheeple
Daily Telegraph: do your bit and wear a mask https://t.co/j51rWKQr7Q",,Australia,Sat Jan 02 00:25:41 +0000 2021
1345164905909874690,neutral,2.1263687610626216,-0.7187272906303406,0.8337517976760864,@fictillius was there any mention about exemptions to mask wearing for certain medical conditions?,,Australia,Sat Jan 02 00:28:00 +0000 2021
1345164972674801664,negative,0.6394198536872864,0.8699126839637756,0.8763742446899414,"@cujo_au @Reasonableques3 @NSWHealth I have a great response to the ball-gag comment ... But my mistress won't let me post it !! 

But agree. 

It's a mask. It's not that hard to wear.",,Australia,Sat Jan 02 00:28:16 +0000 2021
1345165532354334722,positive,0.9973209500312804,2.9206523895263667,-0.5856472849845886,"@debkasmar Great news for you. Woohoo. Do we must wear mask at SCG ? I know masks must wear on public transport, shopping and indoors entertainment etc",,Australia,Sat Jan 02 00:30:29 +0000 2021
1345165964287954945,neutral,1.938794493675232,0.5632357001304626,0.5674247145652771,Chant on new advice on masks. 4 months to close down transmission from the crossroads seeding. Data shows community responds to wearing mask when outbreaks occur. The mandate is to get back to zero as quickly as possible,,Australia,Sat Jan 02 00:32:12 +0000 2021
1345166450642731008,negative,0.7599241137504578,-0.2677302658557892,2.0905795097351074,"@sandylanceley It feels like they are sick of media stories. I’m not anti mask but it’s near impossible to transmit in a near empty cinema, a non crowded train or wandering through Bunnings. I agree a mask is good in high risk situations",,Australia,Sat Jan 02 00:34:08 +0000 2021
1345169857923280896,neutral,1.3500607013702393,0.6976461410522461,0.4201737642288208,@Glaven1994 @gpward72 I could see that but I would think they would be happy with current numbers. I can see they obviously want to squash the outbreak sooner but I don’t think wearing a mask in a shop really makes a difference?,,Australia,Sat Jan 02 00:47:40 +0000 2021
1345172653057867779,neutral,1.207788586616516,1.1141433715820312,0.35655179619789124,"@OzOracle Surgical masks are used effectively in medical settings. N95’s are only required in aerosol producing situations. Keep your distance, hand hygiene and a clean mask is a good preventative strategy for the general public. 👍🏼 Facts, not opinion.",,Australia,Sat Jan 02 00:58:47 +0000 2021
1345168666883592192,positive,1.2032759189605713,2.0203564167022705,0.04838641732931137,"This is extraordinary. India already has 50 million vials of the AZ vaccine ready to go, 100x more than the UK, where it was developed. The pandemic is teaching countries like the UK and Australia an important lesson about sovereign science manufacturing capability. https://t.co/L7JsUTv3eY",,Australia,Sat Jan 02 00:42:56 +0000 2021
1345169191653937158,neutral,1.2645330429077148,0.6714532375335693,0.8732485175132751,"@Tigers_of_Old Remember we should have vaccine approval by March, which I like as will see side effects in Europe UK USA by then. 
Hopefully rolled out over a couple of months should be getting back to good crowds by June. No jab no ticket I imagine but won’t stop people passing them on.",,Australia,Sat Jan 02 00:45:01 +0000 2021
1345161394421862401,neutral,2.0555863380432133,1.192681074142456,0.5778274536132812,With the ongoing Corona virus spread in Victoria it’s wise to keep a daily record of the indoor places you visited. Just in case you need to retrace your steps.,,Australia,Sat Jan 02 00:14:02 +0000 2021
1345162603853594624,negative,1.0410749912261963,-0.5132367610931396,2.5985498428344727,"Let's be clear. The approach used by @GladysB to manage #covid19nsw runs contrary to the science.

Yet the media paint the strategy as valid. Balancing the economy and virus suppression.

Time to call bullsh°t. #MandateMasks and lockdown  #NSW. 

https://t.co/vPwYGTokLz","covid19nsw, MandateMasks, NSW",Australia,Sat Jan 02 00:18:51 +0000 2021
1345167122675032064,negative,1.42066752910614,-0.4517994821071625,2.5072779655456543,"@macsween_prue @AustralianLabor @AnnastaciaMP @DanielAndrewsMP No we shut the borders due to sydneysiders bringing the virus down...black rock started by northern beaches, dine out on 21st dec the person should have got Menulog to deliver their meal to their house without guest",,Australia,Sat Jan 02 00:36:48 +0000 2021
1345167307182465026,negative,1.3190617561340332,-0.7759180068969727,2.377542734146118,@macsween_prue @AustralianLabor @AnnastaciaMP @DanielAndrewsMP Excuse me but Victoria only has cases in the community because people traveled from Sydney to Melbourne who had the virus and does that mean when NSW closed its borders to Victoria last time you didn’t trust your contract tracing,,Australia,Sat Jan 02 00:37:32 +0000 2021
1345168007643897859,negative,1.5967026948928833,0.02516886591911316,1.8242708444595337,"The approach of the NSW/FED is on trial.
Does a 'treat the virus and the economy equally' approach work? 
Or is the 'concentrate on the virus first' approach by the other States (SA and TAS as well) a better option?

Watch this space! https://t.co/7yKYThBds9",,Australia,Sat Jan 02 00:40:19 +0000 2021
1345169931160092673,negative,1.7051458358764648,-0.6055843234062195,2.1069905757904053,"@TrotStats @migga @normanswan @sleepingdingo Yes it was linked back to Liverpool which ultimately was linked to those early cases like Crossroads back in July. In other words, the 2nd wave Melbourne virus died out in Moss Vale (last known infection in that wave).",,Australia,Sat Jan 02 00:47:58 +0000 2021
