Tweet_ID,Sentiment_Label,Logits_Neutral,Logits_Positive,Logits_Negative,Tweet_text,hashtags,country,created_at
1352194318933479424,negative,1.105726718902588,-0.5749590396881104,2.3915941715240483,"..to historians to debate how a US administration could fail so spectacularly in public health response to a pandemic, but wonder if necessary lessons will be learned globally before next major infectious outbreak, the risk of which continues to increase with a warming planet..",,Australia,Thu Jan 21 10:00:22 +0000 2021
1352195055465820162,neutral,1.1814708709716797,0.4195270836353302,0.9667696356773376,"An historic day when Biden made executive orders about climate change, the pandemic, immigration etc and Lyle is obsessed with pronouns. I guess we should be grateful that he's moved on from toilets. https://t.co/UF2js9i4sd",,Australia,Thu Jan 21 10:03:18 +0000 2021
1352195105944322048,negative,0.8650643825531006,-0.2517939209938049,0.907237708568573,But it is the liberal way https://t.co/cXPSKmUM9f,,Australia,Thu Jan 21 10:03:30 +0000 2021
1352196939912151041,neutral,1.6390875577926636,0.6156190633773804,1.1373099088668823,"Surely Dr.Fauci knows he is going to be asked a 1,000 questions about Trump at that @zoom_us meeting!!! https://t.co/DhEBHtE6wJ",,Australia,Thu Jan 21 10:10:47 +0000 2021
1352198191404310528,neutral,1.6156752109527588,1.1633095741271973,-0.6729720830917358,Here we go 🙄 https://t.co/dBj9h5KoFs,,Australia,Thu Jan 21 10:15:46 +0000 2021
1352199285522092034,negative,1.1090221405029297,-0.6253159046173096,2.650160312652588,"Every day I check the #COVID19 stats and sigh with relief when:
*We haven't reached 100M cases;
*San Marino hasn't reached two deaths per thousand total capita;
*No new country has reached one death per thousand total capita¹.

That's how bad things are. 

¹Currently 24 have",COVID19,Australia,Thu Jan 21 10:20:06 +0000 2021
1352199675957403654,neutral,2.677643299102783,2.059394121170044,-1.0742207765579224,A Midsummer Nights Dream in the midst of Covid .. @ Royal Botanic Gardens Victoria https://t.co/ZXQ5qmfLIt,,Australia,Thu Jan 21 10:21:40 +0000 2021
1352200401953587202,negative,0.9102411270141602,-1.3282349109649658,4.100921154022217,"“No one expected us to have to close schools”

Literally everybody in the UK either expected it or was talking about it, with one exception - the man in charge of the DoE. Of all the things that make Boris look shit, not sacking this hopeless, dangerous Berk is somehow the worst. https://t.co/sa5f3UCRk1",,Australia,Thu Jan 21 10:24:33 +0000 2021
1352203414793383936,negative,1.4892559051513672,-1.2556908130645752,3.0412511825561523,I've just signed this petition demanding @ScottMorrisonMP stops Coalition MPs like Craig Kelly from spreading dangerous misinformation about COVID. Can you sign too? https://t.co/iZ0gXBEytM via @GetUp,,Australia,Thu Jan 21 10:36:31 +0000 2021
1352204507317374977,neutral,1.2962242364883425,0.6421001553535461,0.021136820316314697,You might have to stay home @matoots57 https://t.co/mQWEmLfpEv,,Australia,Thu Jan 21 10:40:51 +0000 2021
1352205231258439682,neutral,1.1121243238449097,-0.0527009442448616,-0.15144678950309753,White lines https://t.co/AVYkFw2weV,,Australia,Thu Jan 21 10:43:44 +0000 2021
1352206337225105410,negative,0.8086704015731812,-0.8297162652015686,3.152716398239136,"Wtf is going on here. Honestly, the IFIs are on a SAPs trip turbo charged by pandemic fallout. @IMFNews @IMFLive who is going tp listen to crap you put out about new tax settlements. You ghouls. https://t.co/1HgBbvX4rX",,Australia,Thu Jan 21 10:48:08 +0000 2021
1352207884243722241,negative,1.0287693738937378,-0.0376075878739357,1.3851135969161987,"Really, which vaccine they going to use PM. Did you ask him. Bet you it's not the Astra Zenica https://t.co/XVC2j626xV",,Australia,Thu Jan 21 10:54:17 +0000 2021
1352208281251397634,neutral,1.5239583253860474,-0.6281753778457642,1.42119038105011,People need to do their own research and not rely on the main stream media for their covid information https://t.co/SJPXhmEXfV,,Australia,Thu Jan 21 10:55:51 +0000 2021
1352208846589030401,negative,1.3426553010940552,-0.9891714453697203,2.120913028717041,They are either in a cult or have been dropped on their heads. #Trump will milk them with his BS until he dies. Like a TV evangelical preacher. https://t.co/nk1qCCZNmv,Trump,Australia,Thu Jan 21 10:58:06 +0000 2021
1352195918733340677,positive,1.4278222322463991,1.7785086631774902,-0.042400941252708435,"Timely editorial. We have been very, very fortunate in Australia. Look at the UK by comparison now. Outcomes for patients with #COVID19 - known knowns, known unknowns, and unknown unknowns in @theMJA https://t.co/m9INBRDi0O",COVID19,Australia,Thu Jan 21 10:06:44 +0000 2021
1352200394055684103,neutral,1.97386372089386,-0.07752249389886856,0.7569959759712219,Key consensus statement. In the MJA https://t.co/YeXrgWBYSr #COVID‐19 safety: aerosol‐generating procedures and cardiothoracic surgery and anaesthesia — Australian and New Zealand consensus statement in @theMJA https://t.co/idEhDStROE,COVID,Australia,Thu Jan 21 10:24:31 +0000 2021
1352200569494990849,negative,1.4168167114257812,-1.16190505027771,2.4393811225891118,"There have been 97M Covid cases, of which 72M have been resolved, with 2.9% of resolved cases being casualties: over two million people are dead, and God knows how many are seriously injured.",,Australia,Thu Jan 21 10:25:13 +0000 2021
1352212615276056577,neutral,1.800031661987305,0.9066462516784668,0.9153792262077332,"A bit late to the party as I’m recovering from having my appendix removed (classic librarian), but please take a look at my latest blog post for @BioDivLibrary describing how I used the site to lecture on rare book cataloguing to @RMIT and @SISCSU students this past October https://t.co/vvlBetbbOj",,Australia,Thu Jan 21 11:13:05 +0000 2021
1352217815969746946,positive,2.2601077556610107,3.5445618629455566,-1.3302470445632937,@_paaaaulG Looking flawless for 308 days in a row? You're doing well with your time in lockdown!,,Australia,Thu Jan 21 11:33:44 +0000 2021
1352218475394068480,positive,0.1859336495399475,2.3480665683746342,0.195230633020401,"@G_Woodhouse @DrZoeHyde I found this thread quite excellent

https://t.co/6thXBBLjqU",,Australia,Thu Jan 21 11:36:22 +0000 2021
1352222605508415491,negative,1.2216213941574097,-0.6996955871582031,2.0408067703247066,@djaspen94 @Peter_Fitz Trump is a doer? Fk you.  Never had a serious plan of action for the pandemic.,,Australia,Thu Jan 21 11:52:46 +0000 2021
1352223412609957888,neutral,1.9399009943008425,-0.20961701869964602,1.2201430797576904,"International travel off the cards for 2021, coronavirus border restrictions likely to remain in place https://t.co/qCfCStphwO #travel #COVID19 #Tourism @sqcountry","travel, COVID19, Tourism",Australia,Thu Jan 21 11:55:59 +0000 2021
1352215589696073730,neutral,1.704458713531494,-0.07243262976408005,1.1082708835601809,We have already recovered from the covid downturn of last year. When are we going to recover from the Morrison recession PM. https://t.co/Duyi2hO7Ep,,Australia,Thu Jan 21 11:24:54 +0000 2021
1352217237575221249,neutral,0.8343923091888428,0.3500198125839233,-0.0826527550816536,Lil Covid test https://t.co/z1TPo7bhyo,,Australia,Thu Jan 21 11:31:27 +0000 2021
1352219555653853187,negative,1.207532525062561,-0.9773573279380798,2.4819700717926025,"@EustaceKirsten @ladymidath1 I don’t understand why they reject ppl with health issues, who wants to employ unwell ppl in theses Covid times?
Something like 13 healthy ppl to a job anyway. https://t.co/OqZISaQXeY",,Australia,Thu Jan 21 11:40:39 +0000 2021
1352221727837753345,neutral,1.4747345447540283,1.0631000995635986,0.3831602931022644,Singer Diana Holt runs away to join the circus after COVID-19 ruins international work https://t.co/ML13i1wY5u #toowoomba #circus,"toowoomba, circus",Australia,Thu Jan 21 11:49:17 +0000 2021
1352221883563876354,negative,0.8007267713546753,0.6291239261627197,1.0859681367874146,Keen for a USA trip now .. once covid is gone of course..,,Australia,Thu Jan 21 11:49:54 +0000 2021
1352222146915835904,negative,0.39786356687545776,-0.3162310719490051,1.7556923627853394,COVID-19 event restrictions threaten future of fireworks industry https://t.co/4HTleffkp7 #COVID19,COVID19,Australia,Thu Jan 21 11:50:57 +0000 2021
1352222714266673155,positive,0.4886261522769928,1.0532901287078855,0.8584873080253601,AAMI Park being reduced to 25% capacity? ALeague is going down this year. Kinda glad I'm not going to Adelaide away with all the covid regulations!,,Australia,Thu Jan 21 11:53:12 +0000 2021
1352223347669491715,positive,0.5825870633125305,3.2216272354125977,-0.4367941319942473,@theAliceRoberts Yes U should! Our state has been COVID free for 9 months! Only cases are in hotel quarantine ❤️so grateful to our premier,,Australia,Thu Jan 21 11:55:43 +0000 2021
1352212933384671232,negative,1.1957290172576904,-0.555367112159729,2.729740619659424,In #Aus we have accepted #mask wearing for eight months now - why Is this such a challenge for #UK - we have our #COVID19Vic cases down to zero #SocialDistancing rage triggers surge of attacks on supermarket staff https://t.co/HtkFNQwimt,"Aus, mask, UK, COVID19Vic, SocialDistancing",Australia,Thu Jan 21 11:14:20 +0000 2021
1352221882271993859,positive,1.2286512851715088,1.436899185180664,0.11393365263938905,AND a mask!!! https://t.co/E8AmUHrSB8,,Australia,Thu Jan 21 11:49:54 +0000 2021
1352225061378224128,neutral,1.9485771656036377,1.5478099584579468,-0.2422528713941574,I made a PowerPoint and attended some meetings on Microsoft Teams. #showoff #BidenHarris2020 https://t.co/xe1di82Nxz,"showoff, BidenHarris2020",Australia,Thu Jan 21 12:02:32 +0000 2021
1352228417962352644,negative,0.15432509779930115,0.8332821726799011,1.6555846929550169,Don’t miss it!!! https://t.co/LXryHblUhy,,Australia,Thu Jan 21 12:15:52 +0000 2021
1352230610824151042,positive,0.7080305814743042,1.6481472253799438,0.4028917849063873,"Tbh, the best option for Tokyo 2021 is for next to no fans, sadly. https://t.co/LU6HHS4beo",,Australia,Thu Jan 21 12:24:35 +0000 2021
1352231853596413954,negative,1.140563726425171,-0.12004821747541428,1.633726716041565,@emmaloves_blog Have you taken nambu or tozai line during rush hour ore corona m? Or the en toshi line.. it’s all fair game and people would not even look to give seats..,,Australia,Thu Jan 21 12:29:31 +0000 2021
1352235407904104450,neutral,1.620636820793152,0.24458160996437076,0.06689143925905228,Fraudenberg flouted the mask rule in the patisserie https://t.co/WBXrzcEh2S,,Australia,Thu Jan 21 12:43:39 +0000 2021
1352231063939022848,negative,1.7295047044754028,0.04440892115235329,1.775233030319214,@tiffanyldouglas Geeez now there is a blast from the past Tiffany. About 10 years FB friendship. The risk from what you ask. COVID-19  as is Singapore we are far from out of the woods. I’am very worried about our Winter Tiffany. Are you on GAB?,,Australia,Thu Jan 21 12:26:23 +0000 2021
1352228510962655233,neutral,1.7668551206588743,0.8822697401046753,-0.6376168131828308,@MillerStream Better mask up then Miller.,,Australia,Thu Jan 21 12:16:14 +0000 2021
1352230921643016193,neutral,1.0863103866577148,0.6032404899597168,0.9395308494567872,@ashemusic Wooop wooop. The world can rest now. Sorta. We still go the virus. But hey things are looking up. For now.,,Australia,Thu Jan 21 12:25:49 +0000 2021
1352239864327016448,negative,1.275075912475586,0.17862439155578613,1.4225916862487793,@little_pop_work I tend to sit cat between Etsy &amp; ebay but sometimes Wish has cheap things too. When ordering from China postage is free or shipping can be $20. I'm in AUS.  Just remember Covid has slowed things down. Some things are fast and some seem to take forever but average has been 6wks,,Australia,Thu Jan 21 13:01:21 +0000 2021
1352246010999816195,negative,0.4342547953128815,-0.320034921169281,2.583963632583618,"@WIONews Not a good step. Tedros did not press China for transparency and also access to investigate the virus. This is a big issue, having cost the US and the world millions of lives and immeasurable suffering. The WHO and Tedros in particular need to be investigated thoroughly!",,Australia,Thu Jan 21 13:25:47 +0000 2021
1352265688774176771,positive,0.5913942456245422,5.80256462097168,-0.5364219546318054,Love love LOVE this! 🤿 Finding positives in spite of a pandemic! @PADI @TheWDHOF @girlsthatscuba @WomeninOceanSci #SCUBA #SolomonIslanders #openwater #WomenInDiving #oceanoptimism https://t.co/qlS9DkpvWH,"SCUBA, SolomonIslanders, openwater, WomenInDiving, oceanoptimism",Australia,Thu Jan 21 14:43:58 +0000 2021
1352270692700438528,negative,0.7003353834152222,-0.3283113241195679,2.821007490158081,"@AshleyyDTX @diamonds_closet @lizmarie4299 Dude.. you’re literally working as a FSSWer in the middle of a pandemic that’s killed 400 thousand people in your country. I would take it easy on throwing stones from a glass house, though I personally understand the need to work during these tough times.",,Australia,Thu Jan 21 15:03:51 +0000 2021
1352271674025000961,positive,1.97971773147583,6.718955993652344,-2.173045873641968,Wishing all the best to our colleague and friend Carlos 🙏 https://t.co/5PJRoPrJu7,,Australia,Thu Jan 21 15:07:45 +0000 2021
1352273758296260608,positive,0.9402887225151062,2.0208110809326167,0.31638163328170776,"@JoeBiden CONGRATULATIONS from Down Under! I know you will  beat covid after so many unnecessary lives were lost. Even though I'm on the other side of the world, all U.S.A is in my heart &amp; prayers.",,Australia,Thu Jan 21 15:16:02 +0000 2021
1352270425825320966,positive,0.9772415757179259,1.5881681442260742,0.8075703978538513,"@BarackObama on the other side of the world &amp; I'm celebrating with u! You are all in my hearts during your covid catastrophe &amp; now someone who cares about the people is in charge, numbers will go down. It'll take time,  but things WILL GET BETTER! You are one of my idols!",,Australia,Thu Jan 21 15:02:48 +0000 2021
1352313935366549504,negative,0.9894169569015504,-0.8656013011932373,2.475649118423462,"@blueypete @footytim @Stevo7AFL @7NewsMelbourne Suggest that @blueypete stays indoors, wears 3 masks .This virus doesn’t discriminate. It’s killed the economy ,employment, logic and common sense ,the flu ,small businesses etc  #imbecile",imbecile,Australia,Thu Jan 21 17:55:41 +0000 2021
1352316187594555399,positive,0.7625666260719299,0.9953349232673644,0.8524733185768127,@AliciaMarieBODY Yup. Pretty much. And more than people know. I studied the works of Senator Barack Obama on pandemic handling as required learning when I was doing my masters in security studies - before he was President and we had heard of him outside the US. A greater man than people know https://t.co/Ck6DZk71z1,,Australia,Thu Jan 21 18:04:38 +0000 2021
1352320376957673473,negative,1.2342797517776491,-1.4903748035430908,3.9962956905364986,@tenetztowinne This is the reason #CV19 has remained a serious issue 1 year on. How stupid are humans? Hard borders strict quarantine good hand hygiene &amp; social distancing are the only way to stop the virus.,CV19,Australia,Thu Jan 21 18:21:17 +0000 2021
1352336408963289088,negative,1.341273307800293,-0.8405074477195741,1.8451780080795288,@7NewsMelbourne @9NewsAUS @10NewsFirstMelb @theheraldsun @theage @australian why are not your so called journalists all over this? https://t.co/r5g9NlW31A,,Australia,Thu Jan 21 19:24:59 +0000 2021
1352336976335183872,neutral,2.002777338027954,1.1353968381881714,0.9089699387550354,It's Friday and the start of the weekend at Club Manly. Covid Restrictions have eased so masks not mandatory.  You do not have to remain seated and Dancing is back. Capacity has als increased so come on out. Tonight the courtesy bus available from 5pm to 9pm. https://t.co/Eu2xpvYIgE,,Australia,Thu Jan 21 19:27:15 +0000 2021
1352337071793270785,negative,1.554778814315796,0.10412400215864183,1.6256864070892334,You need to sign in using QR code. Staff can assist and use sanitiser. At times you will need to wear a mask as directed. If your sick stay home. For all club information go to https://t.co/FvQx3dwYsl,,Australia,Thu Jan 21 19:27:37 +0000 2021
1352338251848159232,negative,1.4256552457809448,-0.04411465674638748,1.713290095329285,@cottonboy65 @theAliceRoberts Peter as a Victorian who was locked down for 3 months ending in October - LOCKDOWN WORKS. we now have had 0 community transmission for over 2 weeks and any new community transmission is quickly traced and effectively communicated.,,Australia,Thu Jan 21 19:32:19 +0000 2021
1352338736344784896,negative,1.5139946937561035,-0.8627283573150635,2.225148677825928,"I’m unsure that the Australian/NZ solution would work in the UK. The isolation and the food self sufficiency are huge factors here.
Could Britain close its borders once lockdown ends? https://t.co/QfJ56A6AE4 via @spectator",,Australia,Thu Jan 21 19:34:14 +0000 2021
1352343184072794114,neutral,1.3243805170059204,1.1844778060913086,1.032019019126892,"@ataallen147 @jimmylara04 I get it Peter, we lost a season last year March to November, the minute the doors opened we got a competition running for football. Problem with the lockdown is that there are many kids that turned there back on sport and haven’t come back yet, others to ages to be coaxed back!",,Australia,Thu Jan 21 19:51:55 +0000 2021
1352345121417695232,neutral,1.2389731407165527,0.4273097217082977,0.7399904131889343,"Crazy to think in a non covid world, I would be in South Africa right now... 😳",,Australia,Thu Jan 21 19:59:36 +0000 2021
1352342049853300736,neutral,2.1968114376068115,-0.4660948812961578,1.5233711004257202,@ValerieBarlow6 @S7OCKY So if you’re one of the first 14 you’re not going to spread the virus?,,Australia,Thu Jan 21 19:47:24 +0000 2021
1352342107801808896,negative,1.1022602319717407,0.18706423044204712,1.1269816160202026,"@Keata16 @SBSNews Yes, he has leant support to the state premiers who have done most of the heavy lifting in containing the virus every time it came into Australia.",,Australia,Thu Jan 21 19:47:38 +0000 2021
1352349676196925442,neutral,1.4377790689468384,0.8341956734657288,-0.14970721304416654,Boris &amp; Brexit a masterstroke. https://t.co/pXOpgyMgRL,,Australia,Thu Jan 21 20:17:42 +0000 2021
1352355183821377536,negative,0.6197425127029419,-0.1426990032196045,1.4701479673385618,@BarryHeeler And then undid his good work over weak leadership through the pandemic. The US suffered economically more than it should have.,,Australia,Thu Jan 21 20:39:36 +0000 2021
1352355606905012225,negative,1.1378265619277954,-0.690459132194519,2.216841697692871,"Thousands of Cairns tourism workers and business owners will pay the price, if Scott Morrison doesn’t budge on JobKeeper. His claims that it’s not needed just show he’s spectacularly out of touch with Far Nth Qld. https://t.co/uCn7YjX3Sx",,Australia,Thu Jan 21 20:41:16 +0000 2021
1352356320683278338,positive,1.2716535329818726,1.329283595085144,-0.3210031986236572,@SandroDemaio might as well get prepared… https://t.co/gO10jAuSuv,,Australia,Thu Jan 21 20:44:07 +0000 2021
1352356280816476161,negative,1.1457350254058838,-1.200150728225708,3.427945375442505,"@vline_ballarat @vline WTF do I pay $9 a day for ? First you cancel services then give us 3 carriages only now it’s bus replacements, during covid? Sitting in a crowded bus with people not wearing a mask or anyone enforcing masks. WTF V/Line ? @DanielAndrewsMP",,Australia,Thu Jan 21 20:43:57 +0000 2021
1352358701814874112,neutral,2.743032693862915,0.4855780601501465,0.1278255134820938,@mjrowland68 hi can you please give an update of Portugal’s covid crisis ?,,Australia,Thu Jan 21 20:53:34 +0000 2021
1352357700990996480,neutral,1.868997573852539,-0.4591789543628693,1.7822874784469604,@Mrodd__ @josemorgado Community safety &amp; health comes first. If all other nations had closed their borders &amp; quarantined arrivals the virus's intl spread could be stopped. That's how Aus New Zealand Singapore &amp; others have contained it. I did 2 lots of 14 days Aus-NZ it's tough but necessary.,,Australia,Thu Jan 21 20:49:36 +0000 2021
1352362778544148481,positive,1.7655760049819946,2.3220255374908447,0.2843224108219147,"#COVIDVaccination set to start in #Vic on Feb 15. It will be a massive, complex undertaking. @VicGovDHHS - how are we tapping into our local #health professional #student #workforce? They can help now &amp; be better prepared for the next pandemic. #studentsassistAus #gettheJABdone https://t.co/S9seynimgY","COVIDVaccination, Vic, health, student, workforce, studentsassistAus, gettheJABdone",Australia,Thu Jan 21 21:09:46 +0000 2021
1352363517823750148,negative,0.9729032516479492,-0.3910684883594513,2.9656772613525386,@RHONDAVUEWITHU @OutlanderHome @RikRankin Trump that narcissistic misogynistic a...hole made the USA a laughing stock around the world! Hopefully with Biden &amp; Especially HARRIS running USA it will get back on track &amp; Wear a mask!,,Australia,Thu Jan 21 21:12:43 +0000 2021
1352363623058862081,neutral,2.507427215576172,2.3173444271087646,-0.9183884859085084,#AustralianOpen tennis player #PaulaBadosa tests positive for COVID-19 in hotel quarantine in #Melbourne https://t.co/zt7SYlQqmJ,"AustralianOpen, PaulaBadosa, Melbourne",Australia,Thu Jan 21 21:13:08 +0000 2021
1352364057844613121,neutral,1.5418273210525513,-0.18093568086624146,1.2927160263061523,"@samsheffer Because when the government said lock down we locked down, when they said wear a mask we wore a mask, when they said no gatherings over 10 people the majority of us listened. Admittedly we are much smaller and easier to stop the spread than USA. Hopefully the new president",,Australia,Thu Jan 21 21:14:51 +0000 2021
1352364298064982017,neutral,2.1151683330535893,1.4599987268447876,-0.5991109013557434,@SoulWorkshop @RikRankin @JoeBiden He’s got Kamala by his side he should 🙌 stay safe wear a mask 🙏😷🇦🇺,,Australia,Thu Jan 21 21:15:49 +0000 2021
1352364575375585280,positive,1.0227397680282593,1.3865599632263184,0.3011768162250519,"If this is true, then it is funny sometimes how the world works in mysterious ways... https://t.co/dDdcrCMW1h",,Australia,Thu Jan 21 21:16:55 +0000 2021
1352366512607121410,negative,0.7852510213851929,-0.1030154749751091,1.7088319063186646,"&gt;America: no we won’t provide affordable healthcare, get a job.
&gt;companies: gets prop passed that classes gig workers as contractors to not pay insurance.
&gt;company valued at 30billn: sack everyone that tries to organise for instance. https://t.co/25q96cWuSf",,Australia,Thu Jan 21 21:24:37 +0000 2021
1352368788197400576,negative,0.7384387850761414,0.7888094186782837,1.3974740505218506,"@shellkryan This is BS. Having said that, I figured out during my PhD that I mentally felt better when I got out of my pjs (and into comfy but nice clothes) to work from home... but I don't think this would prevent or heal mental illness or burnout from being overworked during a pandemic!!",,Australia,Thu Jan 21 21:33:39 +0000 2021
1352371482509238281,negative,0.6002957224845886,-0.1500229835510254,2.2183513641357417,"This summarizes my endless frustration with the Democrats. The GOP would never consider a similar partnership, they would just ram their policies through with brute force. 

Great, dems! You’re doing things the right way. And not accomplishing anywhere near what you could. https://t.co/YtvTOVjBt9",,Australia,Thu Jan 21 21:44:21 +0000 2021
1352372023968763905,negative,0.4821482002735138,0.3363952040672302,1.0256685018539429,Must have been a glitch in the earpiece! https://t.co/MDKUlH0yHU,,Australia,Thu Jan 21 21:46:31 +0000 2021
1352373076726407168,negative,1.2231515645980835,0.14508679509162906,1.2757915258407593,"I see Scott Morrison is back to sledging @AnnastaciaMP over her COVID response. Since quarantine is a FEDERAL responsibility, how about the PM finds a solution, rather than just throws rocks? He just never holds a hose.",,Australia,Thu Jan 21 21:50:42 +0000 2021
1352373278212452357,positive,1.696170210838318,3.048191547393799,-0.3616132140159607,#pharmacystudents &amp; #pharmacists working with underserved communities to build #trust about #CovidVaccine... how great is that? https://t.co/4cpFVYJ2Rj,"pharmacystudents, pharmacists, trust, CovidVaccine",Australia,Thu Jan 21 21:51:30 +0000 2021
1352373416959987713,neutral,1.474361777305603,0.16494786739349365,0.2929070591926575,"@DanClarkSports @Bombergrl2000 Are you sure? 🤔 
https://t.co/LA00jxjMwN",,Australia,Thu Jan 21 21:52:03 +0000 2021
1352374489279959043,negative,1.1834810972213743,-0.8406857848167419,2.223459005355835,"@9NewsAUS @7NewsMelbourne @DanielAndrewsMP @vline_ballarat personal risk @vline imposing on passengers, enforced city bus trips not enforcing coughing passengers who don’t wear masks and are sitting right next to me no social distancing is endangering my health must be addressed.",,Australia,Thu Jan 21 21:56:18 +0000 2021
1352375128475099136,neutral,2.1046512126922607,0.25662681460380554,0.6572589278221129,"@ tennis players 

Clear example of why strict quarantine is the right way to go. https://t.co/Vh4zKqHlVH",,Australia,Thu Jan 21 21:58:51 +0000 2021
1352362515397664769,negative,0.7480699419975281,0.048289485275745385,1.4764052629470823,"@tonibrockliss Covid has been a huge factor. People have spent more time online, but they have also been scared, looking for answers",,Australia,Thu Jan 21 21:08:44 +0000 2021
1352363290547023873,negative,1.0984622240066528,-0.8777359127998352,2.675492763519287,"@samsheffer He failed big time. But looking at the media so did half the population of americans who either supported him or believe covid is a scam, or just can't follow basic rules because of some patriotic view they hold. Australia is basically leading the world covid wise.",,Australia,Thu Jan 21 21:11:48 +0000 2021
